
REQUEST 1
POST https://api-ma.triodos.com/xs2a-bg/nl/v1/consents

RESPONSE 1
201
Content-Type: application/json

{"consentStatus":"received","consentId":"**HASHED:4d**","authorisationId":"**HASHED:19**","access":{"accounts":[{"iban":"***ibans***"}],"balances":[{"iban":"***ibans***"}],"transactions":[{"iban":"***ibans***"}]},"recurringIndicator":true,"validUntil":"2021-07-18","frequencyPerDay":4,"lastActionDate":"2021-04-19","_links":{"scaOAuth":"https://api.triodos.com/auth/nl/.well-known/openid-configuration","scaRedirect":"https://api.triodos.com/auth/nl/v1/auth?response_type=code&scope=openid+offline_access+AIS%3A**HASHED:4d**&client_id=**HASHED:Ch**&redirect_uri=https%3A%2F%2Fapi.tink.com%2Fapi%2Fv1%2Fcredentials%2Fthird-party%2Fcallback","scaStatus":"/nl/v1/consents/**HASHED:4d**/authorisations/**HASHED:19**","self":"/nl/v1/consents/**HASHED:4d**","confirmation":"/nl/v1/consents/**HASHED:4d**/authorisations/**HASHED:19**","status":"/nl/v1/consents/**HASHED:4d**/status"}}

REQUEST 2
POST https://api-ma.triodos.com/auth/nl/v1/token

RESPONSE 2
200
Content-Type: application/json

{"access_token":"**HASHED:Mr**","refresh_token":"**HASHED:Ez**","scope":"openid offline_access AIS:**HASHED:4d**","id_token":"eyJhbGciOiJIUzI1NiJ9.eyJzdWIiOiJTZVRCalVNSEFQczd2aXRHYWQzVGxVMUVZVGhiMTloUVhlZnVWMzl4N1AwPSIsImF1ZCI6Il**HASHED:It**kiLCJhdXRoX3RpbWUiOiIxNjE4ODMxNzkxIiwiaXNzIjoiaHR0cHM6XC9cL2FwaS50cmlvZG9zLmNvbVwvYXV0aFwvbmwiLCJjbmYiOnsieDV0I1MyNTYiOiJDMUUwNTc4MTdCRkNEQUZBMzQ3NTNENzc0RjNEMTgxMjZFQTlDQzBEMzU5N0NBNDlBRTM2QkNGRTg4RUFERTY4In0sImV4cCI6MTYxODgzMjM5MiwiaWF0Ijo**HASHED:mz**.Bpq6L35I3WXIq4Dsaeh5XN5hv9dc01NCDQK4Hx1HVRw","token_type":"bearer","expires_in":600}

REQUEST 3
PUT https://api-ma.triodos.com/xs2a-bg/nl/v1/consents/**HASHED:4d**/authorisations/**HASHED:19**

RESPONSE 3
200
Content-Type: application/json

{"scaStatus":"finalised","authorisationId":"authId","_links":{"scaStatus":"/nl/v1/consents/**HASHED:4d**/authorisations/**HASHED:19**","confirmation":"/nl/v1/consents/**HASHED:4d**/authorisations/**HASHED:19**"}}

REQUEST 4
GET https://api-ma.triodos.com/xs2a-bg/nl/v1/accounts

RESPONSE 4
200
Content-Type: application/json

{"accounts":[{"iban":"***ibans***","currency":"EUR","resourceId":"c56fb304-1102-441a-91fa-aa7ce54c2bae","cashAccountType":"CACC","name":"R. Loef","status":"enabled","_links":{"account":"/nl/v1/accounts/c56fb304-1102-441a-91fa-aa7ce54c2bae","transactions":"/nl/v1/accounts/c56fb304-1102-441a-91fa-aa7ce54c2bae/transactions","balances":"/nl/v1/accounts/c56fb304-1102-441a-91fa-aa7ce54c2bae/balances"}}]}

REQUEST 5
GET https://api-ma.triodos.com/xs2a-bg/nl/v1/accounts/c56fb304-1102-441a-91fa-aa7ce54c2bae/balances

RESPONSE 5
200
Content-Type: application/json

{"account":{"iban":"***ibans***"},"balances":[{"balanceType":"closingBooked","balanceAmount":{"currency":"EUR","amount":"10132.19"},"referenceDate":"2021-04-19","creditLimitIncluded":false},{"balanceType":"expected","balanceAmount":{"currency":"EUR","amount":"10132.19"},"referenceDate":"2021-04-19","creditLimitIncluded":true}]}

REQUEST 6
GET https://api-ma.triodos.com/xs2a-bg/nl/v1/accounts/c56fb304-1102-441a-91fa-aa7ce54c2bae/transactions?bookingStatus=both&dateFrom=2000-10-10

RESPONSE 6
200
Content-Type: application/json

{"account":{"iban":"***ibans***"},"transactions":{"booked":[{"transactionId":"b62af334-3f82-4e0e-8953-1e33080fc9e9","bookingDate":"2021-04-19","valueDate":"2021-04-19","transactionAmount":{"currency":"EUR","amount":"21.60"},"creditorName":"Parfumerie Douglas BV via WorldPay","creditorAccount":{"iban":"NL59ABNA0626226163"},"remittanceInformationUnstructured":"Ordernummer 17659559305 / Transactienummer 0030006656539436 / 16-04-21 22:20 / 00231328021777 Douglas.nl","proprietaryBankTransactionCode":"ID","endToEndIdentification":"16-04-21 22:20 0030006656539436"},{"transactionId":"d88de80c-7430-4348-acfd-f452a2c39b2d","bookingDate":"2021-04-19","valueDate":"2021-04-19","transactionAmount":{"currency":"EUR","amount":"5.97"},"creditorName":"AMZN MKTP NL","creditorAccount":{"iban":"DE28700111106021375053"},"remittanceInformationUnstructured":"Ordernummer 3149VBD / Transactienummer 0140000363278314 / 16-04-21 21:23 / Amzn Mktp NL verwerkt door Amazon Payments Europe SCA","proprietaryBankTransactionCode":"ID","endToEndIdentification":"16-04-21 21:23 0140000363278314"},{"transactionId":"b5c52202-67bc-4b9c-a3dc-ff4a810ae298","bookingDate":"2021-04-19","valueDate":"2021-04-19","transactionAmount":{"currency":"EUR","amount":"109.05"},"creditorName":"ASOS.com Ltd","creditorAccount":{"iban":"BE85739020855506"},"remittanceInformationUnstructured":"Ordernummer 3NS6DIE / Transactienummer 0140000363224395 / 16-04-21 17:42 / ASOS verwerkt door PPRO Payment Services S.A.","proprietaryBankTransactionCode":"ID","endToEndIdentification":"16-04-21 17:42 0140000363224395"},{"transactionId":"8a3ef3dd-b902-47ec-8536-a3d1ea1eb992","bookingDate":"2021-04-19","valueDate":"2021-04-19","transactionAmount":{"currency":"EUR","amount":"12.38"},"creditorAccount":{},"remittanceInformationUnstructured":"Ekoplaza Kerkplein \\'S-GRAVENHAGE\\ BETAALAUTOMAAT 18-04-21 17:54 PASNR. 004 CONTACTLOOS","proprietaryBankTransactionCode":"BA"},{"transactionId":"27346399-fbc6-4542-b96d-95b9bdf9d3e4","bookingDate":"2021-04-19","valueDate":"2021-04-19","transactionAmount":{"currency":"EUR","amount":"13.41"},"creditorAccount":{},"remittanceInformationUnstructured":"ALBERT HEIJN 1495 \\'S-GRAVENHAGE\\ BETAALAUTOMAAT 18-04-21 13:16 PASNR. 004 CONTACTLOOS","proprietaryBankTransactionCode":"BA"},{"transactionId":"8884af0d-0788-46e1-930d-357c9acb445a","bookingDate":"2021-04-19","valueDate":"2021-04-19","transactionAmount":{"currency":"EUR","amount":"21.79"},"creditorAccount":{},"remittanceInformationUnstructured":"Ekoplaza Kerkplein \\'S-GRAVENHAGE\\ BETAALAUTOMAAT 18-04-21 13:09 PASNR. 004 CONTACTLOOS","proprietaryBankTransactionCode":"BA"},{"transactionId":"8ecf8253-8892-4698-a8df-2fee1130bb8c","bookingDate":"2021-04-17","valueDate":"2021-04-17","transactionAmount":{"currency":"EUR","amount":"50.00"},"creditorName":"R. Loef","creditorAccount":{"iban":"NL41TRIO2024792529"},"remittanceInformationUnstructured":"","proprietaryBankTransactionCode":"PO"},{"transactionId":"78e42a36-e250-4b5e-bed1-fdb91603b3a7","bookingDate":"2021-04-16","valueDate":"2021-04-16","transactionAmount":{"currency":"EUR","amount":"20.70"},"creditorAccount":{},"remittanceInformationUnstructured":"CCV*MULTI VLAAI C S BV\\S GRAVENHAGE \\ BETAALAUTOMAAT 15-04-21 10:55 PASNR. 004 CONTACTLOOS","proprietaryBankTransactionCode":"BA"},{"transactionId":"5138ddf3-881e-4fd9-be76-dcf8b5752d5a","bookingDate":"2021-04-16","valueDate":"2021-04-16","transactionAmount":{"currency":"EUR","amount":"79.99"},"creditorName":"Snipes Nederland B.V.","creditorAccount":{"iban":"NL79RABO0118165585"},"remittanceInformationUnstructured":"Ordernummer 60788D5BCBFC / Transactienummer 0020005012791256 / 15-04-21 21:00 / Bestell-Nr. 20213112889207 verwerkt door Deutsche Kontor Privatbank AG","proprietaryBankTransactionCode":"ID","endToEndIdentification":"15-04-21 21:00 0020005012791256"},{"transactionId":"de1692b3-10d4-4464-9dc7-16b878e8b5b0","bookingDate":"2021-04-15","valueDate":"2021-04-15","transactionAmount":{"currency":"EUR","amount":"1.00"},"creditorAccount":{},"remittanceInformationUnstructured":"AO Den Haag Kerkplein \\'S-GRAVENHAGE\\ BETAALAUTOMAAT 14-04-21 13:50 PASNR. 004 CONTACTLOOS","proprietaryBankTransactionCode":"BA"},{"transactionId":"5db27cf7-c1fc-4f76-9597-7bf9bd2605f7","bookingDate":"2021-04-15","valueDate":"2021-04-15","transactionAmount":{"currency":"EUR","amount":"4.22"},"creditorAccount":{},"remittanceInformationUnstructured":"ALBERT HEIJN 1495 \\'S-GRAVENHAGE\\ BETAALAUTOMAAT 14-04-21 13:49 PASNR. 004 CONTACTLOOS","proprietaryBankTransactionCode":"BA"},{"transactionId":"0f0fb62e-3517-44ca-8ecb-072f64c67afb","bookingDate":"2021-04-14","valueDate":"2021-04-14","transactionAmount":{"currency":"EUR","amount":"5.98"},"debtorName":"SCOUPY NEDERLAND BV","debtorAccount":{"iban":"NL07ABNA0882531751"},"remittanceInformationUnstructured":"Scoupy cashback","proprietaryBankTransactionCode":"ET","endToEndIdentification":"26875394"},{"transactionId":"26f20725-be0f-4645-b614-be66aa67856b","bookingDate":"2021-04-14","valueDate":"2021-04-14","transactionAmount":{"currency":"EUR","amount":"30.67"},"creditorAccount":{},"remittanceInformationUnstructured":"ALBERT HEIJN 1624 \\'S-GRAVENHAGE\\ BETAALAUTOMAAT 13-04-21 12:45 PASNR. 004 CONTACTLOOS","proprietaryBankTransactionCode":"BA"},{"transactionId":"69c82444-8bc9-493f-84a5-e7373337ca3f","bookingDate":"2021-04-13","valueDate":"2021-04-13","transactionAmount":{"currency":"EUR","amount":"2.49"},"creditorAccount":{},"remittanceInformationUnstructured":"ALBERT HEIJN 1624 \\'S-GRAVENHAGE\\ BETAALAUTOMAAT 12-04-21 12:47 PASNR. 004 CONTACTLOOS","proprietaryBankTransactionCode":"BA"},{"transactionId":"45529c09-6a50-4eb1-a3a0-26bb6cb09f36","bookingDate":"2021-04-12","valueDate":"2021-04-12","transactionAmount":{"currency":"EUR","amount":"9.00"},"creditorName":"DE VOLKSKRANT B V","creditorAccount":{"iban":"NL24ABNA0448098806"},"remittanceInformationUnstructured":"NL76ZZZ330618570000 203***ibans*** 2w03l7rekdowy1xl 5400004109920786 ABONNR 29923489 DE VOLKSKRANT VANAF 13/04/2021 26 KRANTEN INCL 9 PCT BTW 0 74 203***ibans***","proprietaryBankTransactionCode":"EI","endToEndIdentification":"2w03l7rekdowy1xl"},{"transactionId":"121c567a-fa1a-4abb-ab9b-8dfd6caf4ca4","bookingDate":"2021-04-12","valueDate":"2021-04-11","transactionAmount":{"currency":"EUR","amount":"10.27"},"creditorAccount":{},"remittanceInformationUnstructured":"ALBERT HEIJN 1495 \\'S-GRAVENHAGE\\ BETAALAUTOMAAT 10-04-21 13:34 PASNR. 004 CONTACTLOOS","proprietaryBankTransactionCode":"BA"},{"transactionId":"04757065-dad3-434e-9ee7-1d8f9fbfa510","bookingDate":"2021-04-12","valueDate":"2021-04-11","transactionAmount":{"currency":"EUR","amount":"14.31"},"creditorAccount":{},"remittanceInformationUnstructured":"Ekoplaza Gr. Markt \\'S-GRAVENHAGE\\ BETAALAUTOMAAT 10-04-21 13:13 PASNR. 004 CONTACTLOOS","proprietaryBankTransactionCode":"BA"},{"transactionId":"d904a23a-30f4-4d53-9748-9348a71558d4","bookingDate":"2021-04-08","valueDate":"2021-04-08","transactionAmount":{"currency":"EUR","amount":"5.84"},"creditorAccount":{},"remittanceInformationUnstructured":"ALBERT HEIJN 1495 \\'S-GRAVENHAGE\\ BETAALAUTOMAAT 07-04-21 13:44 PASNR. 004 CONTACTLOOS","proprietaryBankTransactionCode":"BA"},{"transactionId":"f8a17244-af1b-4e61-813c-6025c8072c54","bookingDate":"2021-04-08","valueDate":"2021-04-08","transactionAmount":{"currency":"EUR","amount":"6.98"},"creditorAccount":{},"remittanceInformationUnstructured":"Ekoplaza Kerkplein \\'S-GRAVENHAGE\\ BETAALAUTOMAAT 07-04-21 10:42 PASNR. 004 CONTACTLOOS","proprietaryBankTransactionCode":"BA"},{"transactionId":"96ead22b-40bd-42f9-8d3b-b0f7b815545b","bookingDate":"2021-04-07","valueDate":"2021-04-07","transactionAmount":{"currency":"EUR","amount":"22.50"},"creditorAccount":{},"remittanceInformationUnstructured":"C&M*HOUSE OF BELLONA \\S GRAVENHAGE \\ BETAALAUTOMAAT 06-04-21 12:25 PASNR. 004 CONTACTLOOS","proprietaryBankTransactionCode":"BA"},{"transactionId":"d3997707-9222-4be8-96e8-9cfbc2f593cf","bookingDate":"2021-04-07","valueDate":"2021-04-07","transactionAmount":{"currency":"EUR","amount":"4.67"},"creditorAccount":{},"remittanceInformationUnstructured":"PLUS Fahrenheitstraat \\'S-GRAVENHAGE\\ BETAALAUTOMAAT 06-04-21 12:32 PASNR. 004 CONTACTLOOS","proprietaryBankTransactionCode":"BA"},{"transactionId":"01f89c65-aaca-4445-a5df-ec2c0094ca96","bookingDate":"2021-04-06","valueDate":"2021-04-06","transactionAmount":{"currency":"EUR","amount":"3.99"},"creditorName":"Pathé Thuis","creditorAccount":{"iban":"NL59DEUT0265295297"},"remittanceInformationUnstructured":"Ordernummer 28658159 / Transactienummer 1030000358187839 / 05-04-21 20:29 / Betaling van 3,99 EUR","proprietaryBankTransactionCode":"ID","endToEndIdentification":"05-04-21 20:29 1030000358187839"},{"transactionId":"7387a9b0-1401-4502-b7dd-04c4f4d47f77","bookingDate":"2021-04-06","valueDate":"2021-04-06","transactionAmount":{"currency":"EUR","amount":"11.00"},"creditorName":"Papa en Mama","creditorAccount":{"iban":"NL14TRIO0784887799"},"remittanceInformationUnstructured":"INTERNET","proprietaryBankTransactionCode":"PO"},{"transactionId":"dd73e807-31f2-4934-81a5-3d238094ec38","bookingDate":"2021-04-05","valueDate":"2021-04-03","transactionAmount":{"currency":"EUR","amount":"0.76"},"creditorAccount":{},"remittanceInformationUnstructured":"Ekoplaza Kerkplein \\'S-GRAVENHAGE\\ BETAALAUTOMAAT 02-04-21 16:26 PASNR. 004 CONTACTLOOS","proprietaryBankTransactionCode":"BA"},{"transactionId":"716375a4-d728-445e-b0c1-3828181c2b67","bookingDate":"2021-04-02","valueDate":"2021-04-02","transactionAmount":{"currency":"EUR","amount":"12.39"},"creditorAccount":{},"remittanceInformationUnstructured":"Boots Den Haag \\'S-GRAVENHAGE\\ BETAALAUTOMAAT 01-04-21 14:25 PASNR. 004 CONTACTLOOS","proprietaryBankTransactionCode":"BA"},{"transactionId":"070d760b-7ed7-4179-92f1-9c0ad813ac1f","bookingDate":"2021-04-02","valueDate":"2021-04-02","transactionAmount":{"currency":"EUR","amount":"5.28"},"creditorAccount":{},"remittanceInformationUnstructured":"AO Den Haag Kerkplein \\'S-GRAVENHAGE\\ BETAALAUTOMAAT 01-04-21 14:20 PASNR. 004 CONTACTLOOS","proprietaryBankTransactionCode":"BA"},{"transactionId":"c4c398c9-5106-470d-bb35-cf2ee0653309","bookingDate":"2021-04-01","valueDate":"2021-04-01","transactionAmount":{"currency":"EUR","amount":"124.95"},"creditorName":"CZ Groep Zorgverzekeraar","creditorAccount":{"iban":"NL85INGB0668339063"},"remittanceInformationUnstructured":"NL18ZZZ410952220000 429146620001001001 SDD0180771309 kenmerk 9002603219617749 Rel.nr. 429146620 Periode 01-04-2021/30-04-2021 CZ Zorgverzekering -  -","proprietaryBankTransactionCode":"EI","endToEndIdentification":"SDD0180771309"},{"transactionId":"3cfe7313-edc9-4f0c-8de8-7b045f087366","bookingDate":"2021-04-01","valueDate":"2021-04-01","transactionAmount":{"currency":"EUR","amount":"5.00"},"creditorName":"Doneeractie.nl via Mollie","creditorAccount":{"iban":"NL70RABO0115600000"},"remittanceInformationUnstructured":"Ordernummer M02062561M9PO5GU / Transactienummer 0020004956788596 / 31-03-21 23:34 / 1066428.84291 - Actie: 51465","proprietaryBankTransactionCode":"ID","endToEndIdentification":"31-03-21 23:34 0020004956788596"},{"transactionId":"9bf183a8-190c-4238-b621-9ee05389db3b","bookingDate":"2021-04-01","valueDate":"2021-04-01","transactionAmount":{"currency":"EUR","amount":"22.52"},"creditorAccount":{},"remittanceInformationUnstructured":"ALBERT HEIJN 1495 \\'S-GRAVENHAGE\\ BETAALAUTOMAAT 31-03-21 12:07 PASNR. 004 CONTACTLOOS","proprietaryBankTransactionCode":"BA"},{"transactionId":"c586b1c8-db27-4ea9-8810-0e09b5033d42","bookingDate":"2021-03-29","valueDate":"2021-03-29","transactionAmount":{"currency":"EUR","amount":"50.00"},"creditorName":"Apple","creditorAccount":{"iban":"NL59ABNA0817771190"},"remittanceInformationUnstructured":"Ordernummer 1519170186697656 / Transactienummer 0030006488840292 / 29-03-21 13:51 / MV9SGDKXHXa0 https://apple.co/b","proprietaryBankTransactionCode":"ID","endToEndIdentification":"29-03-21 13:51 0030006488840292"},{"transactionId":"e51b9cf8-5063-46f9-adbd-1d1c9ae229b3","bookingDate":"2021-03-29","valueDate":"2021-03-29","transactionAmount":{"currency":"EUR","amount":"15.99"},"creditorAccount":{},"remittanceInformationUnstructured":"ALBERT HEIJN 1495 \\'S-GRAVENHAGE\\ BETAALAUTOMAAT 28-03-21 20:38 PASNR. 004 CONTACTLOOS","proprietaryBankTransactionCode":"BA"},{"transactionId":"e9962d0f-6e43-4534-859c-94fca175d634","bookingDate":"2021-03-29","valueDate":"2021-03-29","transactionAmount":{"currency":"EUR","amount":"2.39"},"creditorAccount":{},"remittanceInformationUnstructured":"Ekoplaza Kerkplein \\'S-GRAVENHAGE\\ BETAALAUTOMAAT 28-03-21 16:54 PASNR. 004 CONTACTLOOS","proprietaryBankTransactionCode":"BA"},{"transactionId":"af618395-8d69-47a6-88a7-31f545a49c87","bookingDate":"2021-03-29","valueDate":"2021-03-28","transactionAmount":{"currency":"EUR","amount":"15.16"},"creditorAccount":{},"remittanceInformationUnstructured":"ALBERT HEIJN 1495 \\'S-GRAVENHAGE\\ BETAALAUTOMAAT 27-03-21 13:25 PASNR. 004 CONTACTLOOS","proprietaryBankTransactionCode":"BA"},{"transactionId":"595f84c5-0aef-44f2-b65d-8d7f56b5c514","bookingDate":"2021-03-27","valueDate":"2021-03-27","transactionAmount":{"currency":"EUR","amount":"50.00"},"creditorName":"Papa en Mama","creditorAccount":{"iban":"NL14TRIO0784887799"},"remittanceInformationUnstructured":"Zodat jullie van mij kunnen blijven genieten :)","proprietaryBankTransactionCode":"PO"},{"transactionId":"41976b14-d57f-494f-9875-50ee5f96d130","bookingDate":"2021-03-27","valueDate":"2021-03-27","transactionAmount":{"currency":"EUR","amount":"3.50"},"creditorAccount":{},"remittanceInformationUnstructured":"Kosten Triodos Internet Betaalrekening NL86 TRIO 0390 9455 44, R. Loef, periode 26 maart 2021 tot en met 25 april 2021","proprietaryBankTransactionCode":"KN"},{"transactionId":"c1ae6c92-3db0-484d-9dcb-2f5f85068826","bookingDate":"2021-03-26","valueDate":"2021-03-26","transactionAmount":{"currency":"EUR","amount":"15.00"},"debtorName":"Hr A Ramdhani","debtorAccount":{"iban":"NL76INGB0701525738"},"remittanceInformationUnstructured":"","proprietaryBankTransactionCode":"ET","endToEndIdentification":"NOTPROVIDED"},{"transactionId":"6118a0f3-2ab4-403f-9a72-7f0d74455e09","bookingDate":"2021-03-26","valueDate":"2021-03-26","transactionAmount":{"currency":"EUR","amount":"25.00"},"debtorName":"Hr A Ramdhani","debtorAccount":{"iban":"NL76INGB0701525738"},"remittanceInformationUnstructured":"12/17 (april)","proprietaryBankTransactionCode":"ET","endToEndIdentification":"NOTPROVIDED"},{"transactionId":"c483bf15-ddbd-4488-b44d-49c09f0147fd","bookingDate":"2021-03-26","valueDate":"2021-03-26","transactionAmount":{"currency":"EUR","amount":"25.00"},"debtorName":"Hr A Ramdhani","debtorAccount":{"iban":"NL76INGB0701525738"},"remittanceInformationUnstructured":"11/17","proprietaryBankTransactionCode":"ET","endToEndIdentification":"NOTPROVIDED"},{"transactionId":"34dc1c58-35d7-444c-8885-358e83ac241b","bookingDate":"2021-03-26","valueDate":"2021-03-26","transactionAmount":{"currency":"EUR","amount":"25.00"},"debtorName":"Hr A Ramdhani","debtorAccount":{"iban":"NL76INGB0701525738"},"remittanceInformationUnstructured":"10/17","proprietaryBankTransactionCode":"ET","endToEndIdentification":"NOTPROVIDED"},{"transactionId":"ce8d70eb-6997-43b9-90a4-654a3ff531f4","bookingDate":"2021-03-26","valueDate":"2021-03-26","transactionAmount":{"currency":"EUR","amount":"25.00"},"debtorName":"Hr A Ramdhani","debtorAccount":{"iban":"NL76INGB0701525738"},"remittanceInformationUnstructured":"9/17","proprietaryBankTransactionCode":"ET","endToEndIdentification":"NOTPROVIDED"},{"transactionId":"8e3a66e7-335e-4266-bae9-8419ddb2d54f","bookingDate":"2021-03-26","valueDate":"2021-03-26","transactionAmount":{"currency":"EUR","amount":"25.00"},"debtorName":"Hr A Ramdhani","debtorAccount":{"iban":"NL76INGB0701525738"},"remittanceInformationUnstructured":"8/17","proprietaryBankTransactionCode":"ET","endToEndIdentification":"NOTPROVIDED"},{"transactionId":"0e5d4bc7-1a4b-4844-8322-dc5badfa5641","bookingDate":"2021-03-26","valueDate":"2021-03-26","transactionAmount":{"currency":"EUR","amount":"25.00"},"debtorName":"Hr A Ramdhani","debtorAccount":{"iban":"NL76INGB0701525738"},"remittanceInformationUnstructured":"7/17","proprietaryBankTransactionCode":"ET","endToEndIdentification":"NOTPROVIDED"},{"transactionId":"924e986c-6be4-4027-8aac-987f0246b2a1","bookingDate":"2021-03-26","valueDate":"2021-03-26","transactionAmount":{"currency":"EUR","amount":"10.75"},"creditorAccount":{},"remittanceInformationUnstructured":"ALBERT HEIJN 1495 \\'S-GRAVENHAGE\\ BETAALAUTOMAAT 25-03-21 15:00 PASNR. 004 CONTACTLOOS","proprietaryBankTransactionCode":"BA"},{"transactionId":"0ac1d49f-73b3-406a-baaa-9dc868647d44","bookingDate":"2021-03-26","valueDate":"2021-03-26","transactionAmount":{"currency":"EUR","amount":"28.80"},"creditorAccount":{},"remittanceInformationUnstructured":"ALBERT HEIJN 1495 \\'S-GRAVENHAGE\\ BETAALAUTOMAAT 25-03-21 15:03 PASNR. 004 CONTACTLOOS","proprietaryBankTransactionCode":"BA"},{"transactionId":"c813317d-a00c-4171-9f35-56d627e03c90","bookingDate":"2021-03-26","valueDate":"2021-03-26","transactionAmount":{"currency":"EUR","amount":"1.20"},"creditorAccount":{},"remittanceInformationUnstructured":"Stg Middin Bakker Vlin\\'S-GRAVENHAGE\\ BETAALAUTOMAAT 25-03-21 13:34 PASNR. 004 CONTACTLOOS","proprietaryBankTransactionCode":"BA"},{"transactionId":"265141f9-f7a9-4e6e-901e-ef1ab5d8ca37","bookingDate":"2021-03-25","valueDate":"2021-03-25","transactionAmount":{"currency":"EUR","amount":"1291.14"},"debtorName":"Biotoop B.V.","debtorAccount":{"iban":"NL17RABO0150335199"},"remittanceInformationUnstructured":"Salaris Periode 3 2021","proprietaryBankTransactionCode":"ET","endToEndIdentification":"12B7FB8A4A13C9879D6FD59C94844970"},{"transactionId":"e98511a1-3f80-4f0e-8ece-823411ed25aa","bookingDate":"2021-03-25","valueDate":"2021-03-25","transactionAmount":{"currency":"EUR","amount":"15.24"},"creditorName":"BEN NEDERLAND","creditorAccount":{"iban":"NL61COBA0733974775"},"remittanceInformationUnstructured":"NL93ZZZ332656790051 1.50755644 500320316264 Klant 1.50755644 Factuur 908036221124","proprietaryBankTransactionCode":"EI","endToEndIdentification":"500320316264"},{"transactionId":"661cc98f-7473-44d5-a2a7-bf64630c0c82","bookingDate":"2021-03-25","valueDate":"2021-03-25","transactionAmount":{"currency":"EUR","amount":"23.19"},"creditorName":"Foodticket","creditorAccount":{"iban":"NL04ADYB2017400157"},"remittanceInformationUnstructured":"Ordernummer 1836166219065883NUFS / Transactienummer 0180108345947764 / 24-03-21 22:38 / Ethica Restaurant/Foodticket","proprietaryBankTransactionCode":"ID","endToEndIdentification":"24-03-21 22:38 0180108345947764"},{"transactionId":"70b7e870-234a-429b-8840-46da9099e937","bookingDate":"2021-03-25","valueDate":"2021-03-25","transactionAmount":{"currency":"EUR","amount":"7.86"},"creditorAccount":{},"remittanceInformationUnstructured":"ALBERT HEIJN 1495 \\'S-GRAVENHAGE\\ BETAALAUTOMAAT 24-03-21 12:38 PASNR. 004 CONTACTLOOS","proprietaryBankTransactionCode":"BA"},{"transactionId":"c49af7bb-fb07-4b3a-bc73-a2a98622d649","bookingDate":"2021-03-23","valueDate":"2021-03-23","transactionAmount":{"currency":"EUR","amount":"4.99"},"creditorName":"SPOTIFY","creditorAccount":{"iban":"NL48ABNA0502830042"},"remittanceInformationUnstructured":"SpotifyNL NL74ZZZ342764500017 1315558504370921 C1616163304364921C SpotifyNL P13FC1EABA","proprietaryBankTransactionCode":"EI","endToEndIdentification":"C1616163304364921C"},{"transactionId":"587af313-971a-4ee4-9ecc-3139a8ebe011","bookingDate":"2021-03-22","valueDate":"2021-03-22","transactionAmount":{"currency":"EUR","amount":"107.00"},"debtorName":"BELASTINGDIENST","debtorAccount":{"iban":"NL86INGB0002445588"},"remittanceInformationUnstructured":"MAAND APR. NR. 233988725T100013 VOORSCHOT ZORGTOESLAG 2021 (LOEF ) MEER INFO OP WWW.TOESLAGEN.NL","proprietaryBankTransactionCode":"ET","endToEndIdentification":"GVSXX20210317042963831"},{"transactionId":"4e9ccb2b-d875-46c4-9efe-aac62942ed78","bookingDate":"2021-03-22","valueDate":"2021-03-22","transactionAmount":{"currency":"EUR","amount":"5.82"},"creditorAccount":{},"remittanceInformationUnstructured":"Ekoplaza Kerkplein \\'S-GRAVENHAGE\\ BETAALAUTOMAAT 21-03-21 15:42 PASNR. 004 CONTACTLOOS","proprietaryBankTransactionCode":"BA"},{"transactionId":"fdb65059-20a6-486e-9949-531786cde413","bookingDate":"2021-03-22","valueDate":"2021-03-22","transactionAmount":{"currency":"EUR","amount":"3.22"},"creditorAccount":{},"remittanceInformationUnstructured":"ALBERT HEIJN 1495 \\'S-GRAVENHAGE\\ BETAALAUTOMAAT 21-03-21 13:09 PASNR. 004 CONTACTLOOS","proprietaryBankTransactionCode":"BA"},{"transactionId":"35b52f05-ad51-4673-ab9d-346b902096a3","bookingDate":"2021-03-22","valueDate":"2021-03-21","transactionAmount":{"currency":"EUR","amount":"6.00"},"creditorAccount":{},"remittanceInformationUnstructured":"Ekoplaza Kerkplein \\'S-GRAVENHAGE\\ BETAALAUTOMAAT 20-03-21 10:59 PASNR. 004 CONTACTLOOS","proprietaryBankTransactionCode":"BA"},{"transactionId":"56f5f59a-1be7-42c5-a805-d39335fd41b9","bookingDate":"2021-03-22","valueDate":"2021-03-20","transactionAmount":{"currency":"EUR","amount":"99.70"},"creditorAccount":{},"remittanceInformationUnstructured":"Dierendokter Den Ha \\'S-GRAVENHAGE\\ BETAALAUTOMAAT 19-03-21 09:41 PASNR. 004","proprietaryBankTransactionCode":"BA"},{"transactionId":"a04f9696-c7b8-4acd-8189-d4997166da95","bookingDate":"2021-03-19","valueDate":"2021-03-19","transactionAmount":{"currency":"EUR","amount":"3.25"},"creditorAccount":{},"remittanceInformationUnstructured":"ALBERT HEIJN 1495 \\'S-GRAVENHAGE\\ BETAALAUTOMAAT 18-03-21 20:29 PASNR. 004 CONTACTLOOS","proprietaryBankTransactionCode":"BA"},{"transactionId":"65378ca8-97e0-4632-9e47-9e0fa1ee7a76","bookingDate":"2021-03-18","valueDate":"2021-03-18","transactionAmount":{"currency":"EUR","amount":"27.71"},"creditorAccount":{},"remittanceInformationUnstructured":"ALBERT HEIJN 1495 \\'S-GRAVENHAGE\\ BETAALAUTOMAAT 17-03-21 13:07 PASNR. 004 CONTACTLOOS","proprietaryBankTransactionCode":"BA"},{"transactionId":"c4b360e0-1444-491a-b749-b3e62dd81129","bookingDate":"2021-03-18","valueDate":"2021-03-18","transactionAmount":{"currency":"EUR","amount":"5.74"},"creditorAccount":{},"remittanceInformationUnstructured":"Ekoplaza Kerkplein \\'S-GRAVENHAGE\\ BETAALAUTOMAAT 17-03-21 13:02 PASNR. 004 CONTACTLOOS","proprietaryBankTransactionCode":"BA"},{"transactionId":"b5e58aba-e9f1-4fb0-b382-d2c1d63ab2bb","bookingDate":"2021-03-17","valueDate":"2021-03-17","transactionAmount":{"currency":"EUR","amount":"17.61"},"creditorAccount":{},"remittanceInformationUnstructured":"Ekoplaza Weimarstr \\'S-GRAVENHAGE\\ BETAALAUTOMAAT 16-03-21 15:50 PASNR. 004 CONTACTLOOS","proprietaryBankTransactionCode":"BA"},{"transactionId":"2d468e9d-d5c7-41df-bdd4-46ccc357a443","bookingDate":"2021-03-17","valueDate":"2021-03-17","transactionAmount":{"currency":"EUR","amount":"50.00"},"creditorName":"R. Loef","creditorAccount":{"iban":"NL41TRIO2024792529"},"remittanceInformationUnstructured":"","proprietaryBankTransactionCode":"PO"},{"transactionId":"7a012018-eb66-4cd5-abb4-e62fa3ce2041","bookingDate":"2021-03-16","valueDate":"2021-03-16","transactionAmount":{"currency":"EUR","amount":"24.22"},"creditorAccount":{},"remittanceInformationUnstructured":"ALBERT HEIJN 1495 \\'S-GRAVENHAGE\\ BETAALAUTOMAAT 15-03-21 12:15 PASNR. 004 CONTACTLOOS","proprietaryBankTransactionCode":"BA"},{"transactionId":"31a8a0c3-5376-4b54-9aa7-0ecea01b296b","bookingDate":"2021-03-15","valueDate":"2021-03-15","transactionAmount":{"currency":"EUR","amount":"5.48"},"debtorName":"SCOUPY NEDERLAND BV","debtorAccount":{"iban":"NL07ABNA0882531751"},"remittanceInformationUnstructured":"Scoupy cashback","proprietaryBankTransactionCode":"ET","endToEndIdentification":"26512662"},{"transactionId":"cf8493b1-5196-4e99-86a6-b102ec9c1f6d","bookingDate":"2021-03-15","valueDate":"2021-03-15","transactionAmount":{"currency":"EUR","amount":"4.90"},"creditorAccount":{},"remittanceInformationUnstructured":"Ekoplaza Kerkplein \\'S-GRAVENHAGE\\ BETAALAUTOMAAT 14-03-21 13:47 PASNR. 004 CONTACTLOOS","proprietaryBankTransactionCode":"BA"},{"transactionId":"f87d46fa-3629-4e06-a326-222f74f22583","bookingDate":"2021-03-15","valueDate":"2021-03-14","transactionAmount":{"currency":"EUR","amount":"8.17"},"creditorAccount":{},"remittanceInformationUnstructured":"ALBERT HEIJN 1495 \\'S-GRAVENHAGE\\ BETAALAUTOMAAT 13-03-21 13:25 PASNR. 004 CONTACTLOOS","proprietaryBankTransactionCode":"BA"},{"transactionId":"88c11cbe-7202-4609-a9eb-8505ca4b75a9","bookingDate":"2021-03-15","valueDate":"2021-03-14","transactionAmount":{"currency":"EUR","amount":"0.61"},"creditorAccount":{},"remittanceInformationUnstructured":"Ekoplaza Kerkplein \\'S-GRAVENHAGE\\ BETAALAUTOMAAT 13-03-21 13:33 PASNR. 004 CONTACTLOOS","proprietaryBankTransactionCode":"BA"},{"transactionId":"f7fafed4-fa17-4e91-bf8c-156a99af1d1a","bookingDate":"2021-03-12","valueDate":"2021-03-12","transactionAmount":{"currency":"EUR","amount":"11.38"},"creditorAccount":{},"remittanceInformationUnstructured":"ALBERT HEIJN 1495 \\'S-GRAVENHAGE\\ BETAALAUTOMAAT 11-03-21 14:15 PASNR. 004 CONTACTLOOS","proprietaryBankTransactionCode":"BA"},{"transactionId":"8a66972f-79ee-4dd7-9e1b-33042b0f3d05","bookingDate":"2021-03-11","valueDate":"2021-03-11","transactionAmount":{"currency":"EUR","amount":"9.00"},"creditorName":"DE VOLKSKRANT B V","creditorAccount":{"iban":"NL24ABNA0448098806"},"remittanceInformationUnstructured":"NL76ZZZ330618570000 203***ibans*** 2gga2k11ayvwn2hz 1400004108791339 ABONNR 29923489 DE VOLKSKRANT VANAF 12/03/2021 26 KRANTEN INCL 9 PCT BTW 0 74 203***ibans***","proprietaryBankTransactionCode":"EI","endToEndIdentification":"2gga2k11ayvwn2hz"},{"transactionId":"ecd4a9e6-76aa-46e4-a744-85ceab8cf136","bookingDate":"2021-03-10","valueDate":"2021-03-10","transactionAmount":{"currency":"EUR","amount":"78.29"},"creditorName":"DUO","creditorAccount":{"iban":"NL45INGB0705001903"},"remittanceInformationUnstructured":"Ordernummer I000685459100002 / Transactienummer 0050005307822372 / 10-03-21 13:15 / 6792.8397.3858 verwerkt door Dienst Uitvoering Onderwijs","proprietaryBankTransactionCode":"ID","endToEndIdentification":"10-03-21 13:15 0050005307822372"},{"transactionId":"45738646-125a-49da-8819-945e79733eb5","bookingDate":"2021-03-10","valueDate":"2021-03-10","transactionAmount":{"currency":"EUR","amount":"11.00"},"creditorName":"ABN AMRO Bank NV","creditorAccount":{"iban":"NL13ABNA0506417344"},"remittanceInformationUnstructured":"Ordernummer 000296257441 / Transactienummer 0030006313485150 / 10-03-21 12:32 / Dick de Vlieger NL26INGB0000860330","proprietaryBankTransactionCode":"ID","endToEndIdentification":"10-03-21 12:32 0030006313485150"},{"transactionId":"6e0a32bf-bc20-401d-a02a-33e565869f07","bookingDate":"2021-03-10","valueDate":"2021-03-10","transactionAmount":{"currency":"EUR","amount":"2.87"},"creditorAccount":{},"remittanceInformationUnstructured":"Albert Heijn 1487 \\'S-GRAVENHAGE\\ BETAALAUTOMAAT 09-03-21 17:02 PASNR. 004 CONTACTLOOS","proprietaryBankTransactionCode":"BA"},{"transactionId":"81006e19-c170-4f18-9ced-cc1425fcf882","bookingDate":"2021-03-10","valueDate":"2021-03-10","transactionAmount":{"currency":"EUR","amount":"10.70"},"creditorAccount":{},"remittanceInformationUnstructured":"Ekoplaza Weimarstr \\'S-GRAVENHAGE\\ BETAALAUTOMAAT 09-03-21 13:22 PASNR. 004 CONTACTLOOS","proprietaryBankTransactionCode":"BA"},{"transactionId":"a19aef00-8600-4e17-ab62-1bf7a32ecbe5","bookingDate":"2021-03-09","valueDate":"2021-03-09","transactionAmount":{"currency":"EUR","amount":"2.30"},"creditorAccount":{},"remittanceInformationUnstructured":"ALBERT HEIJN 1495 \\'S-GRAVENHAGE\\ BETAALAUTOMAAT 08-03-21 11:17 PASNR. 004 CONTACTLOOS","proprietaryBankTransactionCode":"BA"},{"transactionId":"c3e487c6-969b-4a24-8e43-f5c380ed0fc0","bookingDate":"2021-03-09","valueDate":"2021-03-09","transactionAmount":{"currency":"EUR","amount":"19.31"},"creditorAccount":{},"remittanceInformationUnstructured":"ALBERT HEIJN 1624 \\'S-GRAVENHAGE\\ BETAALAUTOMAAT 08-03-21 10:58 PASNR. 004 CONTACTLOOS","proprietaryBankTransactionCode":"BA"},{"transactionId":"832b9ed9-663e-4e51-ade1-7665eda2b6c2","bookingDate":"2021-03-08","valueDate":"2021-03-08","transactionAmount":{"currency":"EUR","amount":"17.50"},"creditorAccount":{},"remittanceInformationUnstructured":"C&M*HOUSE OF BELLONA \\S GRAVENHAGE \\ BETAALAUTOMAAT 05-03-21 12:21 PASNR. 004 CONTACTLOOS","proprietaryBankTransactionCode":"BA"},{"transactionId":"eeb86575-3857-4cea-a89a-7c7cb5ca9933","bookingDate":"2021-03-08","valueDate":"2021-03-08","transactionAmount":{"currency":"EUR","amount":"12.76"},"creditorAccount":{},"remittanceInformationUnstructured":"ALBERT HEIJN 1495 \\'S-GRAVENHAGE\\ BETAALAUTOMAAT 07-03-21 15:08 PASNR. 004 CONTACTLOOS","proprietaryBankTransactionCode":"BA"},{"transactionId":"72e4e450-d157-4fb8-8b54-5e18f6e85e9e","bookingDate":"2021-03-06","valueDate":"2021-03-06","transactionAmount":{"currency":"EUR","amount":"11.00"},"creditorName":"Papa en Mama","creditorAccount":{"iban":"NL14TRIO0784887799"},"remittanceInformationUnstructured":"INTERNET","proprietaryBankTransactionCode":"PO"},{"transactionId":"cb619ee4-dcf8-4fcd-aa8e-b3215e1b7908","bookingDate":"2021-03-04","valueDate":"2021-03-04","transactionAmount":{"currency":"EUR","amount":"11.35"},"creditorAccount":{},"remittanceInformationUnstructured":"ALBERT HEIJN 1495 \\'S-GRAVENHAGE\\ BETAALAUTOMAAT 03-03-21 17:41 PASNR. 004 CONTACTLOOS","proprietaryBankTransactionCode":"BA"},{"transactionId":"1ef6d1b4-3d42-4569-9fc9-d27ae349a3f7","bookingDate":"2021-03-04","valueDate":"2021-03-04","transactionAmount":{"currency":"EUR","amount":"1.77"},"creditorAccount":{},"remittanceInformationUnstructured":"ALBERT HEIJN 1495 \\'S-GRAVENHAGE\\ BETAALAUTOMAAT 03-03-21 14:35 PASNR. 004 CONTACTLOOS","proprietaryBankTransactionCode":"BA"},{"transactionId":"6ce9d939-ab48-442f-9741-95e3c2fec58e","bookingDate":"2021-03-03","valueDate":"2021-03-03","transactionAmount":{"currency":"EUR","amount":"43.00"},"creditorName":"The Body Shop Benelux B.V.","creditorAccount":{"iban":"NL04ADYB2017400157"},"remittanceInformationUnstructured":"Ordernummer 6239147235732807JYOO / Transactienummer 0180106146878172 / 02-03-21 23:19 / NLEZ11607600","proprietaryBankTransactionCode":"ID","endToEndIdentification":"02-03-21 23:19 0180106146878172"},{"transactionId":"87edfd53-51c6-448c-a48b-9a5a1c4f1ac9","bookingDate":"2021-03-02","valueDate":"2021-03-02","transactionAmount":{"currency":"EUR","amount":"139.20"},"debtorName":"W. Loef en/of M. Loef-Sc","debtorAccount":{"iban":"NL14TRIO0784887799"},"remittanceInformationUnstructured":"Vereffening schuld/dank voor voorschieten:)","proprietaryBankTransactionCode":"ET"},{"transactionId":"0a8fcadf-2c37-463e-974c-139dcef0c3e0","bookingDate":"2021-03-02","valueDate":"2021-03-02","transactionAmount":{"currency":"EUR","amount":"0.65"},"creditorAccount":{},"remittanceInformationUnstructured":"ALBERT HEIJN 1495 \\'S-GRAVENHAGE\\ BETAALAUTOMAAT 01-03-21 15:43 PASNR. 004 CONTACTLOOS","proprietaryBankTransactionCode":"BA"},{"transactionId":"4dc941a9-440a-4fe4-9426-9097c3955d3e","bookingDate":"2021-03-02","valueDate":"2021-03-02","transactionAmount":{"currency":"EUR","amount":"14.56"},"creditorAccount":{},"remittanceInformationUnstructured":"AO Den Haag Kerkplein \\'S-GRAVENHAGE\\ BETAALAUTOMAAT 01-03-21 15:26 PASNR. 004 CONTACTLOOS","proprietaryBankTransactionCode":"BA"},{"transactionId":"1fb10ab7-33a1-4b44-bf51-089872447412","bookingDate":"2021-03-02","valueDate":"2021-03-02","transactionAmount":{"currency":"EUR","amount":"21.19"},"creditorAccount":{},"remittanceInformationUnstructured":"Ekoplaza Kerkplein \\'S-GRAVENHAGE\\ BETAALAUTOMAAT 01-03-21 15:36 PASNR. 004 CONTACTLOOS","proprietaryBankTransactionCode":"BA"},{"transactionId":"be01b5ed-06c2-49f3-a783-63a30b0ee88e","bookingDate":"2021-03-01","valueDate":"2021-03-01","transactionAmount":{"currency":"EUR","amount":"29.00"},"creditorName":"PayPal (Europe) S.a.r.l. et Cie., S.C.A.","creditorAccount":{"iban":"DE88500700100175526303"},"remittanceInformationUnstructured":"LU96ZZZ0000000000000000058 48D2224TH4LKW 1012480872671 PP AFSCHRIJVING 1012480872671 PAYPAL","proprietaryBankTransactionCode":"EI","endToEndIdentification":"1012480872671 PP AFSCHRIJVING"},{"transactionId":"4486e414-5f9d-4b24-9bf0-e8eed590f394","bookingDate":"2021-03-01","valueDate":"2021-03-01","transactionAmount":{"currency":"EUR","amount":"124.95"},"creditorName":"CZ Groep Zorgverzekeraar","creditorAccount":{"iban":"NL85INGB0668339063"},"remittanceInformationUnstructured":"NL18ZZZ410952220000 429146620001001001 SDD0178625582 kenmerk 9001902216693694 Rel.nr. 429146620 Periode 01-03-2021/31-03-2021 CZ Zorgverzekering -  -","proprietaryBankTransactionCode":"EI","endToEndIdentification":"SDD0178625582"},{"transactionId":"0ba7b3ef-b3a9-487e-90b1-729c80dd9f04","bookingDate":"2021-03-01","valueDate":"2021-03-01","transactionAmount":{"currency":"EUR","amount":"336.62"},"creditorName":"DUO","creditorAccount":{"iban":"NL45INGB0705001903"},"remittanceInformationUnstructured":"Ordernummer I000685459100001 / Transactienummer 0050005284813836 / 28-02-21 21:08 / 7118.7056.7898 verwerkt door Dienst Uitvoering Onderwijs","proprietaryBankTransactionCode":"ID","endToEndIdentification":"28-02-21 21:08 0050005284813836"},{"transactionId":"12b20174-6d50-4425-8ddc-4ccfb4d4b3e0","bookingDate":"2021-03-01","valueDate":"2021-03-01","transactionAmount":{"currency":"EUR","amount":"27.90"},"creditorName":"Welkoop webwinkel via Adyen","creditorAccount":{"iban":"NL51ABNA0565668625"},"remittanceInformationUnstructured":"Ordernummer 1316144269036475 / Transactienummer 0030006231543278 / 27-02-21 12:55 / 182168264","proprietaryBankTransactionCode":"ID","endToEndIdentification":"27-02-21 12:55 0030006231543278"},{"transactionId":"2f322e3b-758d-4945-8aa9-3689b3e948b3","bookingDate":"2021-03-01","valueDate":"2021-03-01","transactionAmount":{"currency":"EUR","amount":"3.69"},"creditorAccount":{},"remittanceInformationUnstructured":"ALBERT HEIJN 1495 \\'S-GRAVENHAGE\\ BETAALAUTOMAAT 28-02-21 15:50 PASNR. 004 CONTACTLOOS","proprietaryBankTransactionCode":"BA"},{"transactionId":"844885c3-0333-4b88-9ce8-25bd2190edd3","bookingDate":"2021-03-01","valueDate":"2021-03-01","transactionAmount":{"currency":"EUR","amount":"3.61"},"creditorAccount":{},"remittanceInformationUnstructured":"Ekoplaza Kerkplein \\'S-GRAVENHAGE\\ BETAALAUTOMAAT 28-02-21 12:42 PASNR. 004 CONTACTLOOS","proprietaryBankTransactionCode":"BA"},{"transactionId":"6d898ef5-bbf7-40ec-9b6b-516c5709fe97","bookingDate":"2021-03-01","valueDate":"2021-03-01","transactionAmount":{"currency":"EUR","amount":"1.00"},"creditorAccount":{},"remittanceInformationUnstructured":"AO Den Haag Kerkplein \\'S-GRAVENHAGE\\ BETAALAUTOMAAT 28-02-21 12:46 PASNR. 004 CONTACTLOOS","proprietaryBankTransactionCode":"BA"},{"transactionId":"f6ee568a-4131-47e9-92a6-6ce3c69de379","bookingDate":"2021-02-27","valueDate":"2021-02-27","transactionAmount":{"currency":"EUR","amount":"50.00"},"creditorName":"Papa en Mama","creditorAccount":{"iban":"NL14TRIO0784887799"},"remittanceInformationUnstructured":"Zodat jullie van mij kunnen blijven genieten :)","proprietaryBankTransactionCode":"PO"},{"transactionId":"a9f366f7-c7b4-4863-95e0-6ef16a63651f","bookingDate":"2021-02-27","valueDate":"2021-02-27","transactionAmount":{"currency":"EUR","amount":"3.50"},"creditorAccount":{},"remittanceInformationUnstructured":"Kosten Triodos Internet Betaalrekening NL86 TRIO 0390 9455 44, R. Loef, periode 26 februari 2021 tot en met 25 maart 2021","proprietaryBankTransactionCode":"KN"},{"transactionId":"3cb75f18-b4de-4002-ac78-158b5cbf084f","bookingDate":"2021-02-26","valueDate":"2021-02-26","transactionAmount":{"currency":"EUR","amount":"62.25"},"creditorName":"SiteDish.nl via Mollie","creditorAccount":{"iban":"NL70RABO0115600000"},"remittanceInformationUnstructured":"Ordernummer M01968481M9E5Q5V / Transactienummer 0020004821841160 / 25-02-21 19:05 / ?71965?: iDEAL Betaling La Grotta S","proprietaryBankTransactionCode":"ID","endToEndIdentification":"25-02-21 19:05 0020004821841160"},{"transactionId":"95452aa8-db40-4a45-a6f3-fbb20c611864","bookingDate":"2021-02-25","valueDate":"2021-02-25","transactionAmount":{"currency":"EUR","amount":"1296.96"},"debtorName":"Biotoop B.V.","debtorAccount":{"iban":"NL17RABO0150335199"},"remittanceInformationUnstructured":"Salaris Periode 2 2021","proprietaryBankTransactionCode":"ET","endToEndIdentification":"FC08FDBA4321BDD14157FEA063528946"},{"transactionId":"41b2c5ea-76b5-4588-8b60-6ce0a207c8ba","bookingDate":"2021-02-25","valueDate":"2021-02-25","transactionAmount":{"currency":"EUR","amount":"15.24"},"creditorName":"BEN NEDERLAND","creditorAccount":{"iban":"NL61COBA0733974775"},"remittanceInformationUnstructured":"NL93ZZZ332656790051 1.50755644 502020529532 Klant 1.50755644 Factuur 908035650785","proprietaryBankTransactionCode":"EI","endToEndIdentification":"502020529532"},{"transactionId":"5c1a7210-1fa9-4ef0-ad8b-75988440de82","bookingDate":"2021-02-24","valueDate":"2021-02-24","transactionAmount":{"currency":"EUR","amount":"1250.08"},"debtorName":"Univ Leiden Collegegelde","debtorAccount":{"iban":"NL71RABO0103257217"},"remittanceInformationUnstructured":"Restitutie 990000020924","proprietaryBankTransactionCode":"ET","endToEndIdentification":"NOTPROVIDED"},{"transactionId":"0d06484f-cf65-4a12-beb5-fb1ec21a0a53","bookingDate":"2021-02-24","valueDate":"2021-02-24","transactionAmount":{"currency":"EUR","amount":"336.62"},"debtorName":"DUO Hoofdrekening","debtorAccount":{"iban":"NL45INGB0705001903"},"remittanceInformationUnstructured":"8010057681546813 Maandbetaling Studiefinanciering maand 02/2021","proprietaryBankTransactionCode":"ET","endToEndIdentification":"8010057681546813"},{"transactionId":"31b5f378-1868-47cf-a16d-542d0a40cddb","bookingDate":"2021-02-23","valueDate":"2021-02-23","transactionAmount":{"currency":"EUR","amount":"4.99"},"creditorName":"SPOTIFY","creditorAccount":{"iban":"NL48ABNA0502830042"},"remittanceInformationUnstructured":"SpotifyNL NL74ZZZ342764500017 1315558504370921 C4316139112367089C SpotifyNL P138837552","proprietaryBankTransactionCode":"EI","endToEndIdentification":"C4316139112367089C"},{"transactionId":"1a97dd9a-bce2-43be-afbb-83e8b912eecb","bookingDate":"2021-02-23","valueDate":"2021-02-23","transactionAmount":{"currency":"EUR","amount":"5.91"},"creditorAccount":{},"remittanceInformationUnstructured":"ALBERT HEIJN 1495 \\'S-GRAVENHAGE\\ BETAALAUTOMAAT 22-02-21 13:19 PASNR. 004 CONTACTLOOS","proprietaryBankTransactionCode":"BA"},{"transactionId":"986200f8-0550-4ef0-9569-4c42ea6ccda1","bookingDate":"2021-02-22","valueDate":"2021-02-22","transactionAmount":{"currency":"EUR","amount":"107.00"},"debtorName":"BELASTINGDIENST","debtorAccount":{"iban":"NL86INGB0002445588"},"remittanceInformationUnstructured":"MAAND MRT. NR. 233988725T100013 VOORSCHOT ZORGTOESLAG 2021 (LOEF ) MEER INFO OP WWW.TOESLAGEN.NL","proprietaryBankTransactionCode":"ET","endToEndIdentification":"GVSXX20210217025225501"}],"pending":[],"_links":{"account":"/nl/v1/accounts/c56fb304-1102-441a-91fa-aa7ce54c2bae","first":"/nl/v1/accounts/c56fb304-1102-441a-91fa-aa7ce54c2bae/transactions?bookingStatus=both&dateFrom=2000-10-10","next":"/nl/v1/accounts/c56fb304-1102-441a-91fa-aa7ce54c2bae/transactions?edgeToken=V1hb1HqLsHUSs0DVLNH8sIfOippayAKefPrbUvq4TRt9Ibm2g4vld41ti9PgjlvsBg8VB1NWyYY%3D"}}}

REQUEST 7
GET https://api-ma.triodos.com/xs2a-bg/nl/v1/accounts/c56fb304-1102-441a-91fa-aa7ce54c2bae/transactions?edgeToken=V1hb1HqLsHUSs0DVLNH8sIfOippayAKefPrbUvq4TRt9Ibm2g4vld41ti9PgjlvsBg8VB1NWyYY%3D&bookingStatus=both&dateFrom=2000-10-10

RESPONSE 7
200
Content-Type: application/json

{"account":{"iban":"***ibans***"},"transactions":{"booked":[{"transactionId":"a49064bc-91e7-4439-b019-8c9d8fae1e13","bookingDate":"2021-02-22","valueDate":"2021-02-22","transactionAmount":{"currency":"EUR","amount":"8.17"},"creditorAccount":{},"remittanceInformationUnstructured":"ALBERT HEIJN 1495 \\'S-GRAVENHAGE\\ BETAALAUTOMAAT 21-02-21 18:27 PASNR. 004 CONTACTLOOS","proprietaryBankTransactionCode":"BA"},{"transactionId":"d7a1478b-c0de-439b-85d1-b7382a0b3414","bookingDate":"2021-02-22","valueDate":"2021-02-21","transactionAmount":{"currency":"EUR","amount":"6.49"},"creditorAccount":{},"remittanceInformationUnstructured":"Albert Heijn 1801 \\'S-GRAVENHAGE\\ BETAALAUTOMAAT 20-02-21 13:36 PASNR. 004 CONTACTLOOS","proprietaryBankTransactionCode":"BA"},{"transactionId":"d3725d70-c94d-4680-bffe-edcd27092512","bookingDate":"2021-02-22","valueDate":"2021-02-20","transactionAmount":{"currency":"EUR","amount":"11.91"},"creditorAccount":{},"remittanceInformationUnstructured":"ALBERT HEIJN 1495 \\'S-GRAVENHAGE\\ BETAALAUTOMAAT 19-02-21 17:18 PASNR. 004 CONTACTLOOS","proprietaryBankTransactionCode":"BA"},{"transactionId":"13be339a-a80c-4ea7-ac30-1b11f597616f","bookingDate":"2021-02-19","valueDate":"2021-02-19","transactionAmount":{"currency":"EUR","amount":"2.50"},"creditorName":"Stichting De Mooiste Routes via Mol","creditorAccount":{"iban":"NL51DEUT0265262461"},"remittanceInformationUnstructured":"Ordernummer M02205771M9BO6XC / Transactienummer 1150001463838678 / 18-02-21 16:58 / Abonnee: 14383, Losse route","proprietaryBankTransactionCode":"ID","endToEndIdentification":"18-02-21 16:58 1150001463838678"},{"transactionId":"c0886022-39bb-49b8-b31a-b46d6774eba4","bookingDate":"2021-02-18","valueDate":"2021-02-18","transactionAmount":{"currency":"EUR","amount":"6.40"},"creditorAccount":{},"remittanceInformationUnstructured":"ALBERT HEIJN 1495 \\'S-GRAVENHAGE\\ BETAALAUTOMAAT 17-02-21 13:17 PASNR. 004 CONTACTLOOS","proprietaryBankTransactionCode":"BA"},{"transactionId":"3f7206af-5e85-455a-8b17-9cd7ff671ee8","bookingDate":"2021-02-18","valueDate":"2021-02-18","transactionAmount":{"currency":"EUR","amount":"16.69"},"creditorAccount":{},"remittanceInformationUnstructured":"Ekoplaza Kerkplein \\'S-GRAVENHAGE\\ BETAALAUTOMAAT 17-02-21 13:10 PASNR. 004 CONTACTLOOS","proprietaryBankTransactionCode":"BA"},{"transactionId":"17bdf598-c5b3-4dfb-8e09-f8ad6bbe8c22","bookingDate":"2021-02-17","valueDate":"2021-02-17","transactionAmount":{"currency":"EUR","amount":"25.27"},"creditorAccount":{},"remittanceInformationUnstructured":"ALBERT HEIJN 1624 \\'S-GRAVENHAGE\\ BETAALAUTOMAAT 16-02-21 11:11 PASNR. 004 CONTACTLOOS","proprietaryBankTransactionCode":"BA"},{"transactionId":"b2c68d69-db23-4fad-954b-01fc6f8b287b","bookingDate":"2021-02-17","valueDate":"2021-02-17","transactionAmount":{"currency":"EUR","amount":"50.00"},"creditorName":"R. Loef","creditorAccount":{"iban":"NL41TRIO2024792529"},"remittanceInformationUnstructured":"","proprietaryBankTransactionCode":"PO"},{"transactionId":"6d216050-0ddc-467e-83f8-054c4b5b1364","bookingDate":"2021-02-17","valueDate":"2021-02-17","transactionAmount":{"currency":"EUR","amount":"40.00"},"creditorName":"Papa en Mama","creditorAccount":{"iban":"NL14TRIO0784887799"},"remittanceInformationUnstructured":"Zodat jullie van mij kunnen blijven genieten :)","proprietaryBankTransactionCode":"PO"},{"transactionId":"63148b2c-3da0-44be-bdc2-c44f2802c2b0","bookingDate":"2021-02-15","valueDate":"2021-02-15","transactionAmount":{"currency":"EUR","amount":"10.25"},"debtorName":"Stichting ICEPAY","debtorAccount":{"iban":"NL87RABO0190447028"},"remittanceInformationUnstructured":"ICEPF 62845109 Bookmatch betaling 1055140","proprietaryBankTransactionCode":"ET","endToEndIdentification":"62845109"},{"transactionId":"bc7c1195-764d-493a-90f3-9c44c5b88bf4","bookingDate":"2021-02-15","valueDate":"2021-02-15","transactionAmount":{"currency":"EUR","amount":"2.71"},"creditorAccount":{},"remittanceInformationUnstructured":"Ekoplaza Kerkplein \\'S-GRAVENHAGE\\ BETAALAUTOMAAT 14-02-21 13:16 PASNR. 004 CONTACTLOOS","proprietaryBankTransactionCode":"BA"},{"transactionId":"665e29a0-e17d-4777-b724-5386af46fdeb","bookingDate":"2021-02-15","valueDate":"2021-02-13","transactionAmount":{"currency":"EUR","amount":"1.98"},"creditorAccount":{},"remittanceInformationUnstructured":"ALBERT HEIJN 1495 \\'S-GRAVENHAGE\\ BETAALAUTOMAAT 12-02-21 20:23 PASNR. 004 CONTACTLOOS","proprietaryBankTransactionCode":"BA"},{"transactionId":"7e45479c-1a8e-4625-a7bd-3dc93e785090","bookingDate":"2021-02-12","valueDate":"2021-02-12","transactionAmount":{"currency":"EUR","amount":"4.80"},"debtorName":"Stichting ICEPAY","debtorAccount":{"iban":"NL87RABO0190447028"},"remittanceInformationUnstructured":"ICEPF 62770314 Bookmatch betaling 1054263","proprietaryBankTransactionCode":"ET","endToEndIdentification":"62770314"},{"transactionId":"4fa42f93-7ea0-4a20-9ac7-45f3ffa4fe60","bookingDate":"2021-02-12","valueDate":"2021-02-12","transactionAmount":{"currency":"EUR","amount":"50.94"},"creditorName":"bol.com","creditorAccount":{"iban":"NL27INGB0000026500"},"remittanceInformationUnstructured":"Ordernummer BUN1801000983051 / Transactienummer 0050005242868203 / 11-02-21 20:08 / bol.com ref BUN1801000983051 verwerkt door bol.com b.v.","proprietaryBankTransactionCode":"ID","endToEndIdentification":"11-02-21 20:08 0050005242868203"},{"transactionId":"b1f087a2-641c-487c-961e-9eb6b39cbac3","bookingDate":"2021-02-12","valueDate":"2021-02-12","transactionAmount":{"currency":"EUR","amount":"31.46"},"creditorAccount":{},"remittanceInformationUnstructured":"ALBERT HEIJN 1624 \\'S-GRAVENHAGE\\ BETAALAUTOMAAT 11-02-21 14:06 PASNR. 004 CONTACTLOOS","proprietaryBankTransactionCode":"BA"},{"transactionId":"5087b696-ff65-49ce-8faf-75abd7db2a33","bookingDate":"2021-02-11","valueDate":"2021-02-11","transactionAmount":{"currency":"EUR","amount":"10.92"},"creditorAccount":{},"remittanceInformationUnstructured":"ALBERT HEIJN 1495 \\'S-GRAVENHAGE\\ BETAALAUTOMAAT 10-02-21 14:14 PASNR. 004 CONTACTLOOS","proprietaryBankTransactionCode":"BA"},{"transactionId":"4d2271f4-237f-4c66-8c65-268c0e2c8949","bookingDate":"2021-02-11","valueDate":"2021-02-11","transactionAmount":{"currency":"EUR","amount":"4.63"},"creditorAccount":{},"remittanceInformationUnstructured":"Ekoplaza Kerkplein \\'S-GRAVENHAGE\\ BETAALAUTOMAAT 10-02-21 14:01 PASNR. 004 CONTACTLOOS","proprietaryBankTransactionCode":"BA"},{"transactionId":"23ea29f1-97a7-4727-adfb-663363030fbb","bookingDate":"2021-02-11","valueDate":"2021-02-11","transactionAmount":{"currency":"EUR","amount":"4.41"},"creditorAccount":{},"remittanceInformationUnstructured":"Ekoplaza Kerkplein \\'S-GRAVENHAGE\\ BETAALAUTOMAAT 10-02-21 11:46 PASNR. 004 CONTACTLOOS","proprietaryBankTransactionCode":"BA"},{"transactionId":"e13af48a-abf3-4a86-b350-87fa10d598a8","bookingDate":"2021-02-10","valueDate":"2021-02-10","transactionAmount":{"currency":"EUR","amount":"46.50"},"creditorName":"Crimibox via Mollie","creditorAccount":{"iban":"NL70RABO0115600000"},"remittanceInformationUnstructured":"Ordernummer M04847144M992CLY / Transactienummer 0020004761975106 / 10-02-21 11:08 / Crimibox - #17293692076134","proprietaryBankTransactionCode":"ID","endToEndIdentification":"10-02-21 11:08 0020004761975106"},{"transactionId":"6b9a973f-a289-4421-a827-a0590decc8e2","bookingDate":"2021-02-10","valueDate":"2021-02-10","transactionAmount":{"currency":"EUR","amount":"6.99"},"creditorAccount":{},"remittanceInformationUnstructured":"Albert Heijn 1850 \\'S-GRAVENHAGE\\ BETAALAUTOMAAT 09-02-21 12:10 PASNR. 004 CONTACTLOOS","proprietaryBankTransactionCode":"BA"},{"transactionId":"9c999ee8-dc76-415a-bebf-2b8c11c58fa8","bookingDate":"2021-02-09","valueDate":"2021-02-09","transactionAmount":{"currency":"EUR","amount":"9.00"},"creditorName":"DE VOLKSKRANT B V","creditorAccount":{"iban":"NL24ABNA0448098806"},"remittanceInformationUnstructured":"NL76ZZZ330618570000 203***ibans*** 218l510zsrth02gf 4400004107666791 ABONNR 29923489 DE VOLKSKRANT VANAF 10/02/2021 26 KRANTEN INCL 9 PCT BTW 0 74 203***ibans***","proprietaryBankTransactionCode":"EI","endToEndIdentification":"218l510zsrth02gf"},{"transactionId":"c4dc6181-cb03-415d-9a7b-c2c53b09978b","bookingDate":"2021-02-08","valueDate":"2021-02-08","transactionAmount":{"currency":"EUR","amount":"7.66"},"creditorAccount":{},"remittanceInformationUnstructured":"Ekoplaza Kerkplein \\'S-GRAVENHAGE\\ BETAALAUTOMAAT 07-02-21 16:36 PASNR. 004 CONTACTLOOS","proprietaryBankTransactionCode":"BA"},{"transactionId":"023f81fe-e24b-495b-b339-3e52c73bca66","bookingDate":"2021-02-06","valueDate":"2021-02-06","transactionAmount":{"currency":"EUR","amount":"11.00"},"creditorName":"Papa en Mama","creditorAccount":{"iban":"NL14TRIO0784887799"},"remittanceInformationUnstructured":"INTERNET","proprietaryBankTransactionCode":"PO"},{"transactionId":"0aabcbcd-8474-4fee-b2c7-30acc3d7d122","bookingDate":"2021-02-05","valueDate":"2021-02-05","transactionAmount":{"currency":"EUR","amount":"0.85"},"creditorAccount":{},"remittanceInformationUnstructured":"Ekoplaza Kerkplein \\'S-GRAVENHAGE\\ BETAALAUTOMAAT 04-02-21 17:01 PASNR. 004 CONTACTLOOS","proprietaryBankTransactionCode":"BA"},{"transactionId":"619290c4-0afe-4c9f-a780-458bddf768b8","bookingDate":"2021-02-02","valueDate":"2021-02-02","transactionAmount":{"currency":"EUR","amount":"13.05"},"creditorAccount":{},"remittanceInformationUnstructured":"ALBERT HEIJN 1495 \\'S-GRAVENHAGE\\ BETAALAUTOMAAT 01-02-21 12:15 PASNR. 004 CONTACTLOOS","proprietaryBankTransactionCode":"BA"},{"transactionId":"eb581420-e983-4660-8f46-72b18d35302b","bookingDate":"2021-02-02","valueDate":"2021-02-02","transactionAmount":{"currency":"EUR","amount":"16.45"},"creditorAccount":{},"remittanceInformationUnstructured":"Ekoplaza Kerkplein \\'S-GRAVENHAGE\\ BETAALAUTOMAAT 01-02-21 12:09 PASNR. 004 CONTACTLOOS","proprietaryBankTransactionCode":"BA"},{"transactionId":"ce6a0a78-d9f9-424a-a42e-64a5d807bec3","bookingDate":"2021-02-01","valueDate":"2021-02-01","transactionAmount":{"currency":"EUR","amount":"21.50"},"creditorName":"BEN NEDERLAND","creditorAccount":{"iban":"NL61COBA0733974775"},"remittanceInformationUnstructured":"NL93ZZZ332656790051 1.50755644 500823487225 Klant 1.50755644 Factuur 908034912968","proprietaryBankTransactionCode":"EI","endToEndIdentification":"500823487225"},{"transactionId":"a5933df3-6b5b-4a58-8424-eb3da2b4f893","bookingDate":"2021-02-01","valueDate":"2021-02-01","transactionAmount":{"currency":"EUR","amount":"11.99"},"creditorName":"PayPal (Europe) S.a.r.l. et Cie., S.C.A.","creditorAccount":{"iban":"DE88500700100175526303"},"remittanceInformationUnstructured":"LU96ZZZ0000000000000000058 48D2224TH4LKW 1012118861093 PP AFSCHRIJVING 1012118861093 PAYPAL","proprietaryBankTransactionCode":"EI","endToEndIdentification":"1012118861093 PP AFSCHRIJVING"},{"transactionId":"f289132d-ac5e-4139-8f11-c4e86d54e4a0","bookingDate":"2021-02-01","valueDate":"2021-02-01","transactionAmount":{"currency":"EUR","amount":"124.95"},"creditorName":"CZ Groep Zorgverzekeraar","creditorAccount":{"iban":"NL85INGB0668339063"},"remittanceInformationUnstructured":"NL18ZZZ410952220000 429146620001001001 SDD0176567593 kenmerk 5002201213773249 Rel.nr. 429146620 Periode 01-02-2021/28-02-2021 CZ Zorgverzekering -  -","proprietaryBankTransactionCode":"EI","endToEndIdentification":"SDD0176567593"},{"transactionId":"abe9aa51-1951-472e-8e78-94ff2a7488f4","bookingDate":"2021-02-01","valueDate":"2021-02-01","transactionAmount":{"currency":"EUR","amount":"3.99"},"creditorAccount":{},"remittanceInformationUnstructured":"ALBERT HEIJN 1495 \\'S-GRAVENHAGE\\ BETAALAUTOMAAT 31-01-21 18:28 PASNR. 004 CONTACTLOOS","proprietaryBankTransactionCode":"BA"},{"transactionId":"e94a5441-3768-4bce-a75e-8221a75a8fb0","bookingDate":"2021-02-01","valueDate":"2021-02-01","transactionAmount":{"currency":"EUR","amount":"6.61"},"creditorAccount":{},"remittanceInformationUnstructured":"Ekoplaza Kerkplein \\'S-GRAVENHAGE\\ BETAALAUTOMAAT 31-01-21 12:53 PASNR. 004 CONTACTLOOS","proprietaryBankTransactionCode":"BA"},{"transactionId":"0d1fbd95-6145-4af6-b69d-a6edbe5d1361","bookingDate":"2021-02-01","valueDate":"2021-01-31","transactionAmount":{"currency":"EUR","amount":"2.79"},"creditorAccount":{},"remittanceInformationUnstructured":"Ekoplaza Kerkplein \\'S-GRAVENHAGE\\ BETAALAUTOMAAT 30-01-21 16:10 PASNR. 004 CONTACTLOOS","proprietaryBankTransactionCode":"BA"},{"transactionId":"94451f26-0305-407b-bd9c-e4a6f3bc0651","bookingDate":"2021-02-01","valueDate":"2021-01-30","transactionAmount":{"currency":"EUR","amount":"4.00"},"creditorAccount":{},"remittanceInformationUnstructured":"ALBERT HEIJN 1624 \\'S-GRAVENHAGE\\ BETAALAUTOMAAT 29-01-21 12:05 PASNR. 004 CONTACTLOOS","proprietaryBankTransactionCode":"BA"},{"transactionId":"43da83b7-c0c8-4897-b061-f46c25b4efac","bookingDate":"2021-01-29","valueDate":"2021-01-29","transactionAmount":{"currency":"EUR","amount":"11.72"},"creditorAccount":{},"remittanceInformationUnstructured":"ALBERT HEIJN 1495 \\'S-GRAVENHAGE\\ BETAALAUTOMAAT 28-01-21 14:24 PASNR. 004 CONTACTLOOS","proprietaryBankTransactionCode":"BA"},{"transactionId":"b18ab895-aa5a-42ae-9e55-d2f2d6892e1a","bookingDate":"2021-01-28","valueDate":"2021-01-28","transactionAmount":{"currency":"EUR","amount":"1464.86"},"debtorName":"Biotoop B.V.","debtorAccount":{"iban":"NL17RABO0150335199"},"remittanceInformationUnstructured":"Salaris Periode 1 2021","proprietaryBankTransactionCode":"ET","endToEndIdentification":"8DB791F94ADF258F47736EA426B4ACF4"},{"transactionId":"3ada43d7-3019-4512-b67c-312170780eef","bookingDate":"2021-01-28","valueDate":"2021-01-28","transactionAmount":{"currency":"EUR","amount":"5.95"},"creditorAccount":{},"remittanceInformationUnstructured":"Ekoplaza Kerkplein \\'S-GRAVENHAGE\\ BETAALAUTOMAAT 27-01-21 13:02 PASNR. 004 CONTACTLOOS","proprietaryBankTransactionCode":"BA"},{"transactionId":"90948954-ca66-4e85-b6fd-eccc06103ca8","bookingDate":"2021-01-27","valueDate":"2021-01-27","transactionAmount":{"currency":"EUR","amount":"3.50"},"creditorAccount":{},"remittanceInformationUnstructured":"Kosten Triodos Internet Betaalrekening NL86 TRIO 0390 9455 44, R. Loef, periode 26 januari 2021 tot en met 25 februari 2021","proprietaryBankTransactionCode":"KN"},{"transactionId":"3e04d061-ab55-4c70-9081-01caec2ddfa3","bookingDate":"2021-01-26","valueDate":"2021-01-26","transactionAmount":{"currency":"EUR","amount":"29.08"},"creditorName":"Infomedics","creditorAccount":{"iban":"NL34ABNA0243240058"},"remittanceInformationUnstructured":"Ordernummer 19800647799 / Transactienummer 0030005956466860 / 26-01-21 14:01 / Invoice 72138593028071 verwerkt door Infomedics B.V.","proprietaryBankTransactionCode":"ID","endToEndIdentification":"26-01-21 14:01 0030005956466860"},{"transactionId":"fb52f06f-a120-4fac-bfbb-d7e0a4305035","bookingDate":"2021-01-25","valueDate":"2021-01-25","transactionAmount":{"currency":"EUR","amount":"9.16"},"creditorAccount":{},"remittanceInformationUnstructured":"ALBERT HEIJN 1495 \\'S-GRAVENHAGE\\ BETAALAUTOMAAT 24-01-21 18:31 PASNR. 004 CONTACTLOOS","proprietaryBankTransactionCode":"BA"},{"transactionId":"51c96d0a-ff50-4fbb-8b34-4b2671eb0cba","bookingDate":"2021-01-25","valueDate":"2021-01-25","transactionAmount":{"currency":"EUR","amount":"11.38"},"creditorAccount":{},"remittanceInformationUnstructured":"AO Den Haag Kerkplein \\'S-GRAVENHAGE\\ BETAALAUTOMAAT 24-01-21 13:10 PASNR. 004 CONTACTLOOS","proprietaryBankTransactionCode":"BA"},{"transactionId":"4c716e13-2990-4fb1-a8b3-1f5a5fd4b42d","bookingDate":"2021-01-25","valueDate":"2021-01-25","transactionAmount":{"currency":"EUR","amount":"4.99"},"creditorName":"SPOTIFY","creditorAccount":{"iban":"NL48ABNA0502830042"},"remittanceInformationUnstructured":"SpotifyNL NL74ZZZ342764500017 1315558504370921 C4816112328379680C SpotifyNL P131C46DB4","proprietaryBankTransactionCode":"EI","endToEndIdentification":"C4816112328379680C"},{"transactionId":"ae63aaa3-be41-419f-8143-4695bd1881d1","bookingDate":"2021-01-22","valueDate":"2021-01-22","transactionAmount":{"currency":"EUR","amount":"336.62"},"debtorName":"DUO Hoofdrekening","debtorAccount":{"iban":"NL45INGB0705001903"},"remittanceInformationUnstructured":"7010057681546413 Maandbetaling Studiefinanciering maand 01/2021","proprietaryBankTransactionCode":"ET","endToEndIdentification":"7010057681546413"},{"transactionId":"7d40b072-f263-40c0-b8a6-2f79ae35a653","bookingDate":"2021-01-22","valueDate":"2021-01-22","transactionAmount":{"currency":"EUR","amount":"7.38"},"creditorAccount":{},"remittanceInformationUnstructured":"Ekoplaza Kerkplein \\'S-GRAVENHAGE\\ BETAALAUTOMAAT 21-01-21 11:33 PASNR. 004 CONTACTLOOS","proprietaryBankTransactionCode":"BA"},{"transactionId":"3a946e44-3930-4b8a-a883-aba8ed6a6c07","bookingDate":"2021-01-21","valueDate":"2021-01-21","transactionAmount":{"currency":"EUR","amount":"16.14"},"creditorAccount":{},"remittanceInformationUnstructured":"ALBERT HEIJN 1495 \\'S-GRAVENHAGE\\ BETAALAUTOMAAT 20-01-21 12:48 PASNR. 004 CONTACTLOOS","proprietaryBankTransactionCode":"BA"},{"transactionId":"58007b18-bd8f-4b79-b46c-282c42cfe074","bookingDate":"2021-01-21","valueDate":"2021-01-21","transactionAmount":{"currency":"EUR","amount":"31.71"},"creditorAccount":{},"remittanceInformationUnstructured":"Ekoplaza Kerkplein \\'S-GRAVENHAGE\\ BETAALAUTOMAAT 20-01-21 12:59 PASNR. 004 CONTACTLOOS","proprietaryBankTransactionCode":"BA"},{"transactionId":"faa78f1c-aadc-4db2-a094-3ef2fa381e9c","bookingDate":"2021-01-20","valueDate":"2021-01-20","transactionAmount":{"currency":"EUR","amount":"107.00"},"debtorName":"BELASTINGDIENST","debtorAccount":{"iban":"NL86INGB0002445588"},"remittanceInformationUnstructured":"MAAND FEB. NR. 233988725T100013 VOORSCHOT ZORGTOESLAG 2021 (LOEF ) MEER INFO OP WWW.TOESLAGEN.NL","proprietaryBankTransactionCode":"ET","endToEndIdentification":"GVSXX20210115007212658"},{"transactionId":"9456c19d-5d18-40fe-8c8f-bb14401d0f38","bookingDate":"2021-01-19","valueDate":"2021-01-19","transactionAmount":{"currency":"EUR","amount":"33.85"},"creditorName":"Dienst Justis via ING Bank","creditorAccount":{"iban":"NL21INGB0674773837"},"remittanceInformationUnstructured":"Ordernummer 202101190007529451504906 / Transactienummer 0050005179354108 / 19-01-21 00:07 / Verklaring Omtrent het Gedrag","proprietaryBankTransactionCode":"ID","endToEndIdentification":"19-01-21 00:07 0050005179354108"},{"transactionId":"c6bf71cd-3ab0-4cb8-aa8d-148492055147","bookingDate":"2021-01-19","valueDate":"2021-01-19","transactionAmount":{"currency":"EUR","amount":"6.50"},"creditorName":"Mijnvogaanvraag.nl via Mollie","creditorAccount":{"iban":"NL51DEUT0265262461"},"remittanceInformationUnstructured":"Ordernummer M06111711M91DY8W / Transactienummer 1150001421037907 / 18-01-21 17:01 / Ref. VOG-2021010088 Mijnvogaanvraag","proprietaryBankTransactionCode":"ID","endToEndIdentification":"18-01-21 17:01 1150001421037907"},{"transactionId":"1952b2b6-5b6b-4937-a423-b068f7cfe8b1","bookingDate":"2021-01-17","valueDate":"2021-01-17","transactionAmount":{"currency":"EUR","amount":"50.00"},"creditorName":"R. Loef","creditorAccount":{"iban":"NL41TRIO2024792529"},"remittanceInformationUnstructured":"","proprietaryBankTransactionCode":"PO"},{"transactionId":"522279f0-d58a-4d63-adaa-411b5140eabb","bookingDate":"2021-01-17","valueDate":"2021-01-17","transactionAmount":{"currency":"EUR","amount":"40.00"},"creditorName":"Papa en Mama","creditorAccount":{"iban":"NL14TRIO0784887799"},"remittanceInformationUnstructured":"Zodat jullie van mij kunnen blijven genieten :)","proprietaryBankTransactionCode":"PO"},{"transactionId":"f4165144-9873-40f9-871d-3ce739782106","bookingDate":"2021-01-15","valueDate":"2021-01-15","transactionAmount":{"currency":"EUR","amount":"8.35"},"creditorAccount":{},"remittanceInformationUnstructured":"ALBERT HEIJN 1495 \\'S-GRAVENHAGE\\ BETAALAUTOMAAT 14-01-21 13:14 PASNR. 004 CONTACTLOOS","proprietaryBankTransactionCode":"BA"},{"transactionId":"6a625d69-257e-4624-81a1-bd1d679f3c3a","bookingDate":"2021-01-14","valueDate":"2021-01-14","transactionAmount":{"currency":"EUR","amount":"181.00"},"debtorName":"Biotoop B.V.","debtorAccount":{"iban":"NL17RABO0150335199"},"remittanceInformationUnstructured":"26202 voorschot R. Loef 19","proprietaryBankTransactionCode":"ET","endToEndIdentification":"non ref"},{"transactionId":"5fc3a7a5-2b4c-49c3-bc63-72b1b1cb7cdf","bookingDate":"2021-01-12","valueDate":"2021-01-12","transactionAmount":{"currency":"EUR","amount":"9.00"},"creditorName":"DE VOLKSKRANT B V","creditorAccount":{"iban":"NL24ABNA0448098806"},"remittanceInformationUnstructured":"NL76ZZZ330618570000 203***ibans*** 24v3wli13f5212i2 9400014106573018 ABONNR 29923489 DE VOLKSKRANT VANAF 11/01/2021 26 KRANTEN INCL 9 PCT BTW 0 74 203***ibans***","proprietaryBankTransactionCode":"EI","endToEndIdentification":"24v3wli13f5212i2"},{"transactionId":"f06ef61b-99d6-4df0-8547-d6fd8a19b884","bookingDate":"2021-01-11","valueDate":"2021-01-11","transactionAmount":{"currency":"EUR","amount":"4.58"},"creditorAccount":{},"remittanceInformationUnstructured":"ALBERT HEIJN 1495 \\'S-GRAVENHAGE\\ BETAALAUTOMAAT 10-01-21 18:25 PASNR. 004 CONTACTLOOS","proprietaryBankTransactionCode":"BA"},{"transactionId":"2307a568-57b2-4f6c-990c-e5f0742fe43d","bookingDate":"2021-01-11","valueDate":"2021-01-11","transactionAmount":{"currency":"EUR","amount":"3.93"},"creditorAccount":{},"remittanceInformationUnstructured":"Ekoplaza Kerkplein \\'S-GRAVENHAGE\\ BETAALAUTOMAAT 10-01-21 12:09 PASNR. 004 CONTACTLOOS","proprietaryBankTransactionCode":"BA"},{"transactionId":"b0d2d9c8-73b8-48d2-a58c-74a8318ccddf","bookingDate":"2021-01-11","valueDate":"2021-01-09","transactionAmount":{"currency":"EUR","amount":"15.27"},"creditorAccount":{},"remittanceInformationUnstructured":"Albert Heijn 1624 \\'S-GRAVENHAGE\\ BETAALAUTOMAAT 08-01-21 16:18 PASNR. 004 CONTACTLOOS","proprietaryBankTransactionCode":"BA"},{"transactionId":"ff7599e8-2397-4a1c-998d-5fa14572b052","bookingDate":"2021-01-09","valueDate":"2021-01-09","transactionAmount":{"currency":"EUR","amount":"100.00"},"debtorName":"W. Loef en/of M. Loef-Sc","debtorAccount":{"iban":"NL14TRIO0784887799"},"remittanceInformationUnstructured":"Deel vd schuld ..","proprietaryBankTransactionCode":"ET"},{"transactionId":"c8324819-0d18-49b4-a14d-4dc8ebfe8af6","bookingDate":"2021-01-08","valueDate":"2021-01-08","transactionAmount":{"currency":"EUR","amount":"1.00"},"debtorName":"PayPal (Europe) S.a.r.l. et Cie., S.C.A.","debtorAccount":{"iban":"DE88500700100175526303"},"remittanceInformationUnstructured":"YYW1011849685374 PAYPAL","proprietaryBankTransactionCode":"ET","endToEndIdentification":"YYW1011849685374 PP AFSCHRIJVING"},{"transactionId":"c87b2d02-42b7-4ee0-acfc-bb878d3fcb0a","bookingDate":"2021-01-08","valueDate":"2021-01-08","transactionAmount":{"currency":"EUR","amount":"18.59"},"creditorAccount":{},"remittanceInformationUnstructured":"ALBERT HEIJN 1624 \\'S-GRAVENHAGE\\ BETAALAUTOMAAT 07-01-21 17:09 PASNR. 004 CONTACTLOOS","proprietaryBankTransactionCode":"BA"},{"transactionId":"48cbb758-29e1-4e02-abfc-ec96c874aeca","bookingDate":"2021-01-06","valueDate":"2021-01-06","transactionAmount":{"currency":"EUR","amount":"50.00"},"creditorName":"Apple","creditorAccount":{"iban":"NL59ABNA0817771190"},"remittanceInformationUnstructured":"Ordernummer 4316099269245886 / Transactienummer 0030005892191329 / 06-01-21 10:55 / MV9QSTFQS3a0 https://apple.co/b","proprietaryBankTransactionCode":"ID","endToEndIdentification":"06-01-21 10:55 0030005892191329"},{"transactionId":"718a5ae4-e9df-45a5-8852-be5adcaada68","bookingDate":"2021-01-06","valueDate":"2021-01-06","transactionAmount":{"currency":"EUR","amount":"11.00"},"creditorName":"Papa en Mama","creditorAccount":{"iban":"NL14TRIO0784887799"},"remittanceInformationUnstructured":"INTERNET","proprietaryBankTransactionCode":"PO"},{"transactionId":"4b4a0cb1-abb7-414b-90f4-f83c26d5f8ef","bookingDate":"2021-01-05","valueDate":"2021-01-05","transactionAmount":{"currency":"EUR","amount":"20.50"},"creditorName":"ABN AMRO Bank NV","creditorAccount":{"iban":"NL13ABNA0506417344"},"remittanceInformationUnstructured":"Ordernummer 000276729943 / Transactienummer 0030005889690961 / 05-01-21 13:55 / Fabienne Los NL47RABO0145523071","proprietaryBankTransactionCode":"ID","endToEndIdentification":"05-01-21 13:55 0030005889690961"},{"transactionId":"ad125ae6-9306-4da0-943d-b8c6f7af1b97","bookingDate":"2021-01-04","valueDate":"2021-01-04","transactionAmount":{"currency":"EUR","amount":"124.95"},"creditorName":"CZ Groep Zorgverzekeraar","creditorAccount":{"iban":"NL85INGB0668339063"},"remittanceInformationUnstructured":"NL18ZZZ410952220000 429146620001001001 SDD0174337709 kenmerk 2002512201199088 Rel.nr. 429146620 Periode 01-01-2021/31-01-2021 CZ Zorgverzekering -  -","proprietaryBankTransactionCode":"EI","endToEndIdentification":"SDD0174337709"},{"transactionId":"39ea1116-52c2-4d8e-ac07-e35e81bdcd59","bookingDate":"2021-01-04","valueDate":"2021-01-04","transactionAmount":{"currency":"EUR","amount":"1.29"},"creditorAccount":{},"remittanceInformationUnstructured":"ALBERT HEIJN 1495 \\'S-GRAVENHAGE\\ BETAALAUTOMAAT 03-01-21 18:23 PASNR. 004 CONTACTLOOS","proprietaryBankTransactionCode":"BA"},{"transactionId":"f8648083-cf48-464d-910b-58d40c6f89fb","bookingDate":"2021-01-04","valueDate":"2021-01-04","transactionAmount":{"currency":"EUR","amount":"9.18"},"creditorAccount":{},"remittanceInformationUnstructured":"Ekoplaza Kerkplein \\'S-GRAVENHAGE\\ BETAALAUTOMAAT 03-01-21 13:46 PASNR. 004 CONTACTLOOS","proprietaryBankTransactionCode":"BA"},{"transactionId":"6ec6a566-1df6-4149-9df1-2189ebc35c22","bookingDate":"2021-01-01","valueDate":"2021-01-01","transactionAmount":{"currency":"EUR","amount":"1.73"},"creditorAccount":{},"remittanceInformationUnstructured":"Ekoplaza Kerkplein \\'S-GRAVENHAGE\\ BETAALAUTOMAAT 31-12-20 18:48 PASNR. 004 CONTACTLOOS","proprietaryBankTransactionCode":"BA"},{"transactionId":"39b9936b-8c9a-45ed-9083-4e648e04a8a5","bookingDate":"2021-01-01","valueDate":"2021-01-01","transactionAmount":{"currency":"EUR","amount":"1.85"},"creditorAccount":{},"remittanceInformationUnstructured":"ALBERT HEIJN 2207 \\'S-GRAVENHAGE\\ BETAALAUTOMAAT 31-12-20 11:15 PASNR. 004 CONTACTLOOS","proprietaryBankTransactionCode":"BA"},{"transactionId":"618e87ec-dae4-4eec-8327-fecbf957a2c3","bookingDate":"2021-01-01","valueDate":"2021-01-01","transactionAmount":{"currency":"EUR","amount":"19.16"},"creditorAccount":{},"remittanceInformationUnstructured":"Kruidvat 6505 \\'S-GRAVENHAGE\\ BETAALAUTOMAAT 31-12-20 11:09 PASNR. 004 CONTACTLOOS","proprietaryBankTransactionCode":"BA"},{"transactionId":"05c169d0-53c3-4603-9b1f-85686614b9c9","bookingDate":"2020-12-30","valueDate":"2020-12-30","transactionAmount":{"currency":"EUR","amount":"1.00"},"creditorName":"PayPal (Europe) S.a.r.l. et Cie., S.C.A.","creditorAccount":{"iban":"DE88500700100175526303"},"remittanceInformationUnstructured":"LU96ZZZ0000000000000000058 48D2224TH4LKW 1011712877808 PP AFSCHRIJVING 1011712877808 PAYPAL","proprietaryBankTransactionCode":"EI","endToEndIdentification":"1011712877808 PP AFSCHRIJVING"},{"transactionId":"b46c44ca-a09a-4204-8ce5-f1d674fd3fcd","bookingDate":"2020-12-30","valueDate":"2020-12-30","transactionAmount":{"currency":"EUR","amount":"37.65"},"creditorName":"CZ Groep Zorgverzekeraar","creditorAccount":{"iban":"NL85INGB0668339063"},"remittanceInformationUnstructured":"NL18ZZZ410952220000 429146620001001001 SDD0174652667 kenmerk 7002812202425793 Rel.nr. 429146620 ZBZ.11122020.00.1940 -  -","proprietaryBankTransactionCode":"EI","endToEndIdentification":"SDD0174652667"},{"transactionId":"0dc567e4-5c36-4b0a-a306-21ee7973f055","bookingDate":"2020-12-30","valueDate":"2020-12-30","transactionAmount":{"currency":"EUR","amount":"21.78"},"creditorAccount":{},"remittanceInformationUnstructured":"Albert Heijn 1624 \\'S-GRAVENHAGE\\ BETAALAUTOMAAT 29-12-20 14:21 PASNR. 004 CONTACTLOOS","proprietaryBankTransactionCode":"BA"},{"transactionId":"9ac4cecf-6ab4-4272-b1a9-34460ab535f4","bookingDate":"2020-12-28","valueDate":"2020-12-28","transactionAmount":{"currency":"EUR","amount":"15.00"},"creditorName":"BEN NEDERLAND","creditorAccount":{"iban":"NL61COBA0733974775"},"remittanceInformationUnstructured":"NL93ZZZ332656790051 1.50755644 501416831586 Klant 1.50755644 Factuur 908034279936","proprietaryBankTransactionCode":"EI","endToEndIdentification":"501416831586"},{"transactionId":"948ff168-5706-4691-98ba-ddbd52f60633","bookingDate":"2020-12-28","valueDate":"2020-12-28","transactionAmount":{"currency":"EUR","amount":"10.62"},"creditorAccount":{},"remittanceInformationUnstructured":"ALBERT HEIJN 1495 \\'S-GRAVENHAGE\\ BETAALAUTOMAAT 27-12-20 18:26 PASNR. 004 CONTACTLOOS","proprietaryBankTransactionCode":"BA"},{"transactionId":"0482eb99-8203-4f75-95eb-0cde18e2e806","bookingDate":"2020-12-28","valueDate":"2020-12-28","transactionAmount":{"currency":"EUR","amount":"3.99"},"creditorAccount":{},"remittanceInformationUnstructured":"Ekoplaza Kerkplein \\'S-GRAVENHAGE\\ BETAALAUTOMAAT 27-12-20 16:32 PASNR. 004 CONTACTLOOS","proprietaryBankTransactionCode":"BA"},{"transactionId":"34f0685f-1a5a-4a17-8958-4c04781493b0","bookingDate":"2020-12-28","valueDate":"2020-12-28","transactionAmount":{"currency":"EUR","amount":"14.61"},"creditorAccount":{},"remittanceInformationUnstructured":"Ekoplaza Kerkplein \\'S-GRAVENHAGE\\ BETAALAUTOMAAT 27-12-20 13:05 PASNR. 004 CONTACTLOOS","proprietaryBankTransactionCode":"BA"},{"transactionId":"ffc17de9-ab1b-407e-81be-15a8ae48ae94","bookingDate":"2020-12-28","valueDate":"2020-12-27","transactionAmount":{"currency":"EUR","amount":"3.10"},"creditorAccount":{},"remittanceInformationUnstructured":"Jamin \\'S-GRAVENHAGE\\ BETAALAUTOMAAT 26-12-20 13:16 PASNR. 004 CONTACTLOOS","proprietaryBankTransactionCode":"BA"},{"transactionId":"c96458d5-e639-44eb-afe1-04fa4eccfd1a","bookingDate":"2020-12-28","valueDate":"2020-12-27","transactionAmount":{"currency":"EUR","amount":"0.59"},"creditorAccount":{},"remittanceInformationUnstructured":"ALBERT HEIJN 2207 \\'S-GRAVENHAGE\\ BETAALAUTOMAAT 26-12-20 13:19 PASNR. 004 CONTACTLOOS","proprietaryBankTransactionCode":"BA"},{"transactionId":"df5d3ec6-4a4b-40c4-b654-c18191328f5a","bookingDate":"2020-12-27","valueDate":"2020-12-27","transactionAmount":{"currency":"EUR","amount":"3.50"},"creditorAccount":{},"remittanceInformationUnstructured":"Kosten Triodos Internet Betaalrekening NL86 TRIO 0390 9455 44, R. Loef, periode 26 december 2020 tot en met 25 januari 2021","proprietaryBankTransactionCode":"KN"},{"transactionId":"da1ccb74-19c7-4e67-a2ba-52e3ce28df9a","bookingDate":"2020-12-25","valueDate":"2020-12-25","transactionAmount":{"currency":"EUR","amount":"13.58"},"creditorAccount":{},"remittanceInformationUnstructured":"Ekoplaza Kerkplein \\'S-GRAVENHAGE\\ BETAALAUTOMAAT 24-12-20 14:32 PASNR. 004 CONTACTLOOS","proprietaryBankTransactionCode":"BA"},{"transactionId":"607d6b1c-a5ca-43ce-b5a7-fb7b0d062e0a","bookingDate":"2020-12-23","valueDate":"2020-12-23","transactionAmount":{"currency":"EUR","amount":"4.99"},"creditorName":"SPOTIFY","creditorAccount":{"iban":"NL48ABNA0502830042"},"remittanceInformationUnstructured":"SpotifyNL NL74ZZZ342764500017 1315558504370921 C1616085544368638C SpotifyNL P12AE8B992","proprietaryBankTransactionCode":"EI","endToEndIdentification":"C1616085544368638C"},{"transactionId":"7f0f16f6-facc-4f63-bf69-f0e903fa64f6","bookingDate":"2020-12-23","valueDate":"2020-12-23","transactionAmount":{"currency":"EUR","amount":"2.00"},"debtorName":"SCOUPY NEDERLAND BV","debtorAccount":{"iban":"NL07ABNA0882531751"},"remittanceInformationUnstructured":"Deelname shopper onderzoek","proprietaryBankTransactionCode":"ET","endToEndIdentification":"C20201222-7007066026-57536645058759"},{"transactionId":"cd6974ae-8d5d-4088-bbd1-3fab014cf764","bookingDate":"2020-12-22","valueDate":"2020-12-22","transactionAmount":{"currency":"EUR","amount":"233.05"},"debtorName":"DUO Hoofdrekening","debtorAccount":{"iban":"NL45INGB0705001903"},"remittanceInformationUnstructured":"0010039000304013 Maandbetaling Studiefinanciering maand 12/2020","proprietaryBankTransactionCode":"ET","endToEndIdentification":"0010039000304013"},{"transactionId":"045b6912-4260-450c-94fb-1c647c2bc847","bookingDate":"2020-12-21","valueDate":"2020-12-21","transactionAmount":{"currency":"EUR","amount":"107.00"},"debtorName":"BELASTINGDIENST","debtorAccount":{"iban":"NL86INGB0002445588"},"remittanceInformationUnstructured":"MAAND JAN. NR. 233988725T100013 VOORSCHOT ZORGTOESLAG 2021 (LOEF ) MEER INFO OP WWW.TOESLAGEN.NL","proprietaryBankTransactionCode":"ET","endToEndIdentification":"GVSXX20201216013685126"},{"transactionId":"67219a20-cd65-4f2a-a3c7-5215c9d0a9cb","bookingDate":"2020-12-21","valueDate":"2020-12-21","transactionAmount":{"currency":"EUR","amount":"5.79"},"creditorAccount":{},"remittanceInformationUnstructured":"ALBERT HEIJN 1495 \\'S-GRAVENHAGE\\ BETAALAUTOMAAT 20-12-20 18:28 PASNR. 004 CONTACTLOOS","proprietaryBankTransactionCode":"BA"},{"transactionId":"7fc79e0c-21ce-44d4-89cd-f1583b9c768e","bookingDate":"2020-12-18","valueDate":"2020-12-18","transactionAmount":{"currency":"EUR","amount":"1189.32"},"debtorName":"Biotoop B.V.","debtorAccount":{"iban":"NL17RABO0150335199"},"remittanceInformationUnstructured":"Salaris Periode 13 2020","proprietaryBankTransactionCode":"ET","endToEndIdentification":"C49A1D6440E1B85D8C16968F21231E1F"},{"transactionId":"805414c4-49e5-4708-939f-b5d068d471fb","bookingDate":"2020-12-17","valueDate":"2020-12-17","transactionAmount":{"currency":"EUR","amount":"50.00"},"creditorName":"R. Loef","creditorAccount":{"iban":"NL41TRIO2024792529"},"remittanceInformationUnstructured":"","proprietaryBankTransactionCode":"PO"},{"transactionId":"7bd8c03f-2a36-4fb2-8021-f16560f7d74d","bookingDate":"2020-12-17","valueDate":"2020-12-17","transactionAmount":{"currency":"EUR","amount":"40.00"},"creditorName":"Papa en Mama","creditorAccount":{"iban":"NL14TRIO0784887799"},"remittanceInformationUnstructured":"Zodat jullie van mij kunnen blijven genieten :)","proprietaryBankTransactionCode":"PO"},{"transactionId":"9b4f9913-33da-41bb-8db0-191193757484","bookingDate":"2020-12-16","valueDate":"2020-12-16","transactionAmount":{"currency":"EUR","amount":"4.99"},"creditorName":"PayPal (Europe) S.a.r.l. et Cie., S.C.A.","creditorAccount":{"iban":"DE88500700100175526303"},"remittanceInformationUnstructured":"LU96ZZZ0000000000000000058 48D2224TH4LKW 1011531232400 PP AFSCHRIJVING 1011531232400 PAYPAL","proprietaryBankTransactionCode":"EI","endToEndIdentification":"1011531232400 PP AFSCHRIJVING"},{"transactionId":"f096c0f0-6b5d-4002-823a-6bce5cbcd169","bookingDate":"2020-12-16","valueDate":"2020-12-16","transactionAmount":{"currency":"EUR","amount":"1.19"},"creditorAccount":{},"remittanceInformationUnstructured":"ALBERT HEIJN 1495 \\'S-GRAVENHAGE\\ BETAALAUTOMAAT 15-12-20 20:19 PASNR. 004 CONTACTLOOS","proprietaryBankTransactionCode":"BA"},{"transactionId":"dc28c8e1-c7ff-413f-b7ed-deaeacbac7a7","bookingDate":"2020-12-16","valueDate":"2020-12-16","transactionAmount":{"currency":"EUR","amount":"3.97"},"creditorAccount":{},"remittanceInformationUnstructured":"Ekoplaza Kerkplein \\'S-GRAVENHAGE\\ BETAALAUTOMAAT 15-12-20 17:45 PASNR. 004 CONTACTLOOS","proprietaryBankTransactionCode":"BA"},{"transactionId":"45ccc7f3-2559-42a4-b607-6c939a3240bf","bookingDate":"2020-12-15","valueDate":"2020-12-15","transactionAmount":{"currency":"EUR","amount":"4.50"},"creditorAccount":{},"remittanceInformationUnstructured":"ALBERT HEIJN 1495 \\'S-GRAVENHAGE\\ BETAALAUTOMAAT 14-12-20 13:12 PASNR. 004 CONTACTLOOS","proprietaryBankTransactionCode":"BA"},{"transactionId":"0a382d8f-c12e-44c0-aac2-9ab123a3c094","bookingDate":"2020-12-15","valueDate":"2020-12-15","transactionAmount":{"currency":"EUR","amount":"24.79"},"creditorAccount":{},"remittanceInformationUnstructured":"Ekoplaza Kerkplein \\'S-GRAVENHAGE\\ BETAALAUTOMAAT 14-12-20 13:08 PASNR. 004 CONTACTLOOS","proprietaryBankTransactionCode":"BA"},{"transactionId":"387b8765-4b75-42bb-9951-7d0dd3111e09","bookingDate":"2020-12-14","valueDate":"2020-12-14","transactionAmount":{"currency":"EUR","amount":"10.00"},"creditorAccount":{},"remittanceInformationUnstructured":"Geldmaat Koningin Juli\\Den Haag \\ GELDAUTOMAAT 12-12-20 12:34 PASNR. 004","proprietaryBankTransactionCode":"GA"},{"transactionId":"53976f59-a779-4130-95d8-9458e748dde8","bookingDate":"2020-12-14","valueDate":"2020-12-14","transactionAmount":{"currency":"EUR","amount":"20.00"},"creditorAccount":{},"remittanceInformationUnstructured":"Geldmaat Koningin Juli\\Den Haag \\ GELDAUTOMAAT 12-12-20 12:33 PASNR. 004","proprietaryBankTransactionCode":"GA"},{"transactionId":"8397a79e-1f36-42c6-8860-abf5c481f68c","bookingDate":"2020-12-14","valueDate":"2020-12-14","transactionAmount":{"currency":"EUR","amount":"489.00"},"debtorName":"BELASTINGDIENST","debtorAccount":{"iban":"NL36INGB0003445588"},"remittanceInformationUnstructured":"TERUGGAAF NR. 233988725H9601 IB/PVV 2019 (LOEF )","proprietaryBankTransactionCode":"ET","endToEndIdentification":"GVSXX20201209005479697"},{"transactionId":"962aac88-bf95-4f50-a756-5178d5d552a4","bookingDate":"2020-12-14","valueDate":"2020-12-14","transactionAmount":{"currency":"EUR","amount":"22.00"},"creditorName":"The Poke Bar B.V. via Mollie","creditorAccount":{"iban":"NL51DEUT0265262461"},"remittanceInformationUnstructured":"Ordernummer M03519304M8PZFEF / Transactienummer 1150001373431515 / 13-12-20 12:35 / The Poke Bar thepokebar.nl","proprietaryBankTransactionCode":"ID","endToEndIdentification":"13-12-20 12:35 1150001373431515"},{"transactionId":"b4780a8e-0363-4ecf-8050-982e6ff948fc","bookingDate":"2020-12-14","valueDate":"2020-12-14","transactionAmount":{"currency":"EUR","amount":"5.28"},"creditorAccount":{},"remittanceInformationUnstructured":"Ekoplaza Kerkplein \\'S-GRAVENHAGE\\ BETAALAUTOMAAT 13-12-20 16:41 PASNR. 004 CONTACTLOOS","proprietaryBankTransactionCode":"BA"},{"transactionId":"7c99aa6f-2e90-44c6-90b1-409a498b160e","bookingDate":"2020-12-11","valueDate":"2020-12-11","transactionAmount":{"currency":"EUR","amount":"8.66"},"creditorAccount":{},"remittanceInformationUnstructured":"ALBERT HEIJN 1495 \\'S-GRAVENHAGE\\ BETAALAUTOMAAT 10-12-20 17:20 PASNR. 004 CONTACTLOOS","proprietaryBankTransactionCode":"BA"},{"transactionId":"2f803d84-4047-45c3-808a-ed40fece9e04","bookingDate":"2020-12-11","valueDate":"2020-12-11","transactionAmount":{"currency":"EUR","amount":"2.32"},"creditorAccount":{},"remittanceInformationUnstructured":"Ekoplaza Kerkplein \\'S-GRAVENHAGE\\ BETAALAUTOMAAT 10-12-20 15:11 PASNR. 004 CONTACTLOOS","proprietaryBankTransactionCode":"BA"},{"transactionId":"e728db0c-0f5a-40f4-b839-a611593c6840","bookingDate":"2020-12-10","valueDate":"2020-12-10","transactionAmount":{"currency":"EUR","amount":"2.18"},"debtorName":"SCOUPY NEDERLAND BV","debtorAccount":{"iban":"NL07ABNA0882531751"},"remittanceInformationUnstructured":"Scoupy cashback","proprietaryBankTransactionCode":"ET","endToEndIdentification":"24819930"}],"pending":[],"_links":{"account":"/nl/v1/accounts/c56fb304-1102-441a-91fa-aa7ce54c2bae","first":"/nl/v1/accounts/c56fb304-1102-441a-91fa-aa7ce54c2bae/transactions?bookingStatus=both&dateFrom=2000-10-10"}}}

