
REQUEST 1
POST https://somehost/openapi/oauth2/token
Content-Type: application/x-www-form-urlencoded
Accept: application/json

RESPONSE 1
200
Content-Type: application/json

{ "token_type":"bearer", "access_token":"AAIk**HASHED:wF**1hLrNWC5cXD0snTyKV3E6PHCCN8o22eHO7ytCkXusU7T-NX-3MS9Ldcw7siDt959l8PXAosTIkYzTCER-zA-AlbHIO1WBaq9RaojHX_26rWb5Pm3nJiVk1bg9qbZbhnoLkVtU7CEBXMoXzHb0G4XrKw3I_9kaO7D1DSN0TOaBqsTdgO9uwVQlgjcOfQ-EAkXAhRDJJdofgKaTf2x3Z4D8gIiGyQXPxvq4_z2tV3JtdwjplmC31i6kCrk0RlmzvgK4Sgxg5Qf-J8PzBNAfDELiczmqFOHEKVndUtN8hUg0h3BdxoDnKPrnwJ4worOX3WM9JaZnB0VSF_mfVe6P64UKL3WF9wdE2cnOF-C8_o_8YF8TgZV7TC5NgHhLPWOZqrld7ydka9tYVOn_uF8YZK6_MJs_fVIUItoyTKUZ5ypP3el2Eh2Eka13iJ1IbQfpQ34qQ6cU8K8VoE2wgZSuMllybYhAcmHYJqrJk1M8W9TPgLOCN1KUXH75mEqIVscZNmC3E6UnmSZoR3yngGdTOdg", "metadata":"a:consentId fffff", "expires_in":222, "consented_on": true, "scope":"ais.balances.read ais.transactions.read-90days ais.transactions.read-history oauth2.consents.read **HASHED:iv**_ais.balances.read **HASHED:iv**_ais.transactions.read-90days **HASHED:iv**_ais.transactions.read-history", "refresh_token":"refreshToken", "refresh_token_expires_in":111 }

REQUEST 2
GET https://somehost/openapi/payments/account-information/ais/accounts
Accept: application/json

RESPONSE 2
200
Content-Type: application/json

{"accounts":[{"resourceId":"i29S1Hewp3XwRsiuT1BWzo5n2NGDkSSB2A4VKrtXPFiGWhqkCSejsfYZ6dksNG0b","iban":"NL71RABO0346234166","currency":"EUR","status":"enabled","ownerName":"H.A. Akin","_links":{"balances":{"href":"/accounts/i29S1Hewp3XwRsiuT1BWzo5n2NGDkSSB2A4VKrtXPFiGWhqkCSejsfYZ6dksNG0b/balances"},"transactions":{"href":"/accounts/i29S1Hewp3XwRsiuT1BWzo5n2NGDkSSB2A4VKrtXPFiGWhqkCSejsfYZ6dksNG0b/transactions"}}}]}

REQUEST 3
GET https://somehost/openapi/payments/account-information/ais/accounts/i29S1Hewp3XwRsiuT1BWzo5n2NGDkSSB2A4VKrtXPFiGWhqkCSejsfYZ6dksNG0b/balances
Accept: application/json

RESPONSE 3
200
Content-Type: application/json

{"account":{"iban":"NL71RABO0346234166","currency":"EUR"},"balances":[{"balanceAmount":{"amount":"11.04","currency":"EUR"},"balanceType":"expected","lastChangeDateTime":"2021-04-14T19:56:43.861Z"}]}

REQUEST 4
GET https://somehost/openapi/payments/account-information/ais/accounts/i29S1Hewp3XwRsiuT1BWzo5n2NGDkSSB2A4VKrtXPFiGWhqkCSejsfYZ6dksNG0b/transactions?bookingStatus=booked
Accept: application/json

RESPONSE 4
200
Content-Type: application/json

{"account":{"iban":"NL71RABO0346234166","currency":"EUR"},"transactions":{"booked":[{"entryReference":"757","bookingDate":"2021-04-12","valueDate":"2021-04-12","transactionAmount":{"currency":"EUR","amount":"-4.15"},"creditorAccount":{},"creditorName":"Bakkerij Nieuw Fes ROTTERDAM","debtorAccount":{"iban":"NL71RABO0346234166","currency":"EUR"},"remittanceInformationUnstructured":"Betaalautomaat 15:39 pasnr. 011","raboBookingDateTime":"2021-04-12T13:39:22.190024Z","raboDetailedTransactionType":"2","raboTransactionTypeName":"bc"},{"entryReference":"756","endToEndId":"6493.14388248","mandateId":"ALL0012937194.01","creditorId":"NL66ZZZ290379290000","bookingDate":"2021-04-07","valueDate":"2021-04-07","transactionAmount":{"currency":"EUR","amount":"-6.33"},"creditorAccount":{"iban":"NL67INGB0005338373"},"creditorName":"Allianz Direct","debtorAccount":{"iban":"NL71RABO0346234166","currency":"EUR"},"remittanceInformationUnstructured":"Kenmerk: 2000000036280197 / Periode: 2021-04-01 - 2021-05-01 / NL71RABO0346234166","raboBookingDateTime":"2021-04-07T06:50:36.401925Z","raboDetailedTransactionType":"64","raboTransactionTypeName":"ei"},{"entryReference":"755","endToEndId":"06-04-2021 16:00 0050005369130938","bookingDate":"2021-04-06","valueDate":"2021-04-07","transactionAmount":{"currency":"EUR","amount":"-60.0"},"creditorAccount":{"iban":"NL05INGB0702278378"},"creditorName":"Wehkamp Finance","debtorAccount":{"iban":"NL71RABO0346234166","currency":"EUR"},"remittanceInformationUnstructured":"72000000000000000523876330071171476 0050005369130938 72000000000000000523876330071171476 Wehkamp Finance x4166 pasnr.011","purposeCode":"EPAY","raboBookingDateTime":"2021-04-06T14:01:25.252768Z","raboDetailedTransactionType":"25","raboTransactionTypeName":"id"},{"entryReference":"754","endToEndId":"000000048673181","bookingDate":"2021-04-06","valueDate":"2021-04-06","transactionAmount":{"currency":"EUR","amount":"120.0"},"creditorAccount":{"iban":"NL71RABO0346234166","currency":"EUR"},"debtorAccount":{"iban":"NL69ABNA0644512326"},"debtorName":"GEM RDAM SERVICEORG","remittanceInformationUnstructured":"Akin, HA. 1122864 Individuele InkomensToeslag","raboBookingDateTime":"2021-04-06T13:58:08.344471Z","raboDetailedTransactionType":"541","raboTransactionTypeName":"cb"},{"entryReference":"753","bookingDate":"2021-04-02","valueDate":"2021-04-01","transactionAmount":{"currency":"EUR","amount":"-1.9"},"creditorAccount":{},"creditorName":"Kosten","debtorAccount":{"iban":"NL71RABO0346234166","currency":"EUR"},"remittanceInformationUnstructured":"Rabo DirectPakket                  Periode 01-04-2021 t/m 30-04-2021","raboBookingDateTime":"2021-04-02T11:51:20.274486Z","raboDetailedTransactionType":"93","raboTransactionTypeName":"db"},{"entryReference":"752","endToEndId":"TK00303671","mandateId":"MANIJS009396","creditorId":"NL18ZZZ241082910000","bookingDate":"2021-04-01","valueDate":"2021-04-01","transactionAmount":{"currency":"EUR","amount":"-752.68"},"creditorAccount":{"iban":"NL42RABO0330574426"},"creditorName":"Stichting Woonbron","debtorAccount":{"iban":"NL71RABO0346234166","currency":"EUR"},"remittanceInformationUnstructured":"Incasso  Huur Periode: 01-04-2021 tot 01-05-2021","raboBookingDateTime":"2021-04-01T02:12:05.408337Z","raboDetailedTransactionType":"65","raboTransactionTypeName":"ei"},{"entryReference":"751","bookingDate":"2021-03-31","valueDate":"2021-03-31","transactionAmount":{"currency":"EUR","amount":"-1.0"},"creditorAccount":{},"creditorName":"CCV*CIGO KOP VAN ZUID ROTTERDAM","debtorAccount":{"iban":"NL71RABO0346234166","currency":"EUR"},"remittanceInformationUnstructured":"Betaalautomaat 16:01 pasnr. 011    Apple Pay","raboBookingDateTime":"2021-03-31T14:01:57.143176Z","raboDetailedTransactionType":"2","raboTransactionTypeName":"bc"},{"entryReference":"750","endToEndId":"90044004","mandateId":"6337215","creditorId":"NL97ZZZ534852620000","bookingDate":"2021-03-31","valueDate":"2021-03-31","transactionAmount":{"currency":"EUR","amount":"-50.0"},"creditorAccount":{"iban":"NL86ABNA0511919131"},"creditorName":"BUDGETENERGIE B V","debtorAccount":{"iban":"NL71RABO0346234166","currency":"EUR"},"remittanceInformationUnstructured":"Termijn april (kenmerk: 1200-0000-0420-7848)","raboBookingDateTime":"2021-03-31T06:44:14.415402Z","raboDetailedTransactionType":"64","raboTransactionTypeName":"ei"},{"entryReference":"749","endToEndId":"2021-03-24T18:18:57-000000000000024","mandateId":"2019100001","creditorId":"NL68ZZZ411333400000","bookingDate":"2021-03-26","valueDate":"2021-03-26","transactionAmount":{"currency":"EUR","amount":"-10.0"},"creditorAccount":{"iban":"NL81INGB0004332134"},"creditorName":"STICHTING AKTIEF ORANJEBOOM","debtorAccount":{"iban":"NL71RABO0346234166","currency":"EUR"},"remittanceInformationUnstructured":"GIFT MAART 2021","raboBookingDateTime":"2021-03-26T07:09:03.151375Z","raboDetailedTransactionType":"64","raboTransactionTypeName":"ei"},{"entryReference":"748","bookingDate":"2021-03-25","valueDate":"2021-03-25","transactionAmount":{"currency":"EUR","amount":"-1.5"},"creditorAccount":{},"creditorName":"Bakkerij OZ Sultan ROTTERDAM","debtorAccount":{"iban":"NL71RABO0346234166","currency":"EUR"},"remittanceInformationUnstructured":"Betaalautomaat 15:40 pasnr. 011    Apple Pay","raboBookingDateTime":"2021-03-25T14:41:00.116442Z","raboDetailedTransactionType":"2","raboTransactionTypeName":"bc"},{"entryReference":"747","bookingDate":"2021-03-25","valueDate":"2021-03-25","transactionAmount":{"currency":"EUR","amount":"-50.0"},"creditorAccount":{},"creditorName":"Geldmaat PRETORIALAAN ROTTERDAM","debtorAccount":{"iban":"NL71RABO0346234166","currency":"EUR"},"remittanceInformationUnstructured":"Geldautomaat 15:26 pasnr. 011","raboBookingDateTime":"2021-03-25T14:27:12.249145Z","raboDetailedTransactionType":"23","raboTransactionTypeName":"ga"},{"entryReference":"746","endToEndId":"ARNLNL2101321368","mandateId":"B0008195475-0346234166-01","creditorId":"NL12T2N333034180000","bookingDate":"2021-03-25","valueDate":"2021-03-25","transactionAmount":{"currency":"EUR","amount":"-30.0"},"creditorAccount":{"iban":"NL06COBA0637053753"},"creditorName":"TELE2","debtorAccount":{"iban":"NL71RABO0346234166","currency":"EUR"},"remittanceInformationUnstructured":"ARNLNL2101321368","raboBookingDateTime":"2021-03-25T07:03:25.578652Z","raboDetailedTransactionType":"64","raboTransactionTypeName":"ei"},{"entryReference":"745","bookingDate":"2021-03-24","valueDate":"2021-03-24","transactionAmount":{"currency":"EUR","amount":"-15.26"},"creditorAccount":{},"creditorName":"Action 1335 Rotterdam","debtorAccount":{"iban":"NL71RABO0346234166","currency":"EUR"},"remittanceInformationUnstructured":"Betaalautomaat 14:59 pasnr. 011    Apple Pay","raboBookingDateTime":"2021-03-24T13:59:20.762005Z","raboDetailedTransactionType":"2","raboTransactionTypeName":"bc"},{"entryReference":"744","bookingDate":"2021-03-24","valueDate":"2021-03-24","transactionAmount":{"currency":"EUR","amount":"-2.1"},"creditorAccount":{},"creditorName":"Bakkerij Prins ROTTERDAM","debtorAccount":{"iban":"NL71RABO0346234166","currency":"EUR"},"remittanceInformationUnstructured":"Betaalautomaat 13:54 pasnr. 011","raboBookingDateTime":"2021-03-24T12:54:47.026152Z","raboDetailedTransactionType":"2","raboTransactionTypeName":"bc"},{"entryReference":"743","endToEndId":"440058329010","mandateId":"1040000643670","creditorId":"NL10ZZZ302086370000","bookingDate":"2021-03-24","valueDate":"2021-03-24","transactionAmount":{"currency":"EUR","amount":"-57.99"},"creditorAccount":{"iban":"NL58INGB0000003050"},"creditorName":"Zilveren Kruis Zorgverzekeringen  NV","debtorAccount":{"iban":"NL71RABO0346234166","currency":"EUR"},"remittanceInformationUnstructured":"Overeengekomen betalingsregeling - PZK040190441","raboBookingDateTime":"2021-03-24T07:19:40.257458Z","raboDetailedTransactionType":"64","raboTransactionTypeName":"ei"},{"entryReference":"742","endToEndId":"440058329009","mandateId":"1280000649030","creditorId":"NL10ZZZ302086370000","bookingDate":"2021-03-24","valueDate":"2021-03-24","transactionAmount":{"currency":"EUR","amount":"-17.01"},"creditorAccount":{"iban":"NL58INGB0000003050"},"creditorName":"Zilveren Kruis Zorgverzekeringen  NV","debtorAccount":{"iban":"NL71RABO0346234166","currency":"EUR"},"remittanceInformationUnstructured":"Overeengekomen betalingsregeling - SZK040190441","raboBookingDateTime":"2021-03-24T07:19:40.257051Z","raboDetailedTransactionType":"64","raboTransactionTypeName":"ei"},{"entryReference":"741","endToEndId":"440058329008","mandateId":"1040000643670","creditorId":"NL10ZZZ302086370000","bookingDate":"2021-03-24","valueDate":"2021-03-24","transactionAmount":{"currency":"EUR","amount":"-114.9"},"creditorAccount":{"iban":"NL58INGB0000003050"},"creditorName":"Zilveren Kruis Zorgverzekeringen  NV","debtorAccount":{"iban":"NL71RABO0346234166","currency":"EUR"},"remittanceInformationUnstructured":"Premie Zilveren Kruis Relatienummer 040190441 Periode 01-04-2021 - 01-05-2021","raboBookingDateTime":"2021-03-24T07:19:14.634218Z","raboDetailedTransactionType":"64","raboTransactionTypeName":"ei"},{"entryReference":"740","endToEndId":"000000048410986","bookingDate":"2021-03-23","valueDate":"2021-03-23","transactionAmount":{"currency":"EUR","amount":"967.9"},"creditorAccount":{"iban":"NL71RABO0346234166","currency":"EUR"},"debtorAccount":{"iban":"NL69ABNA0644512326"},"debtorName":"GEM RDAM SERVICEORG","remittanceInformationUnstructured":"Akin, HA.                                                       1122864                         Betaling aan klant (restbetaling","raboBookingDateTime":"2021-03-23T12:57:53.226885Z","raboDetailedTransactionType":"541","raboTransactionTypeName":"cb"},{"entryReference":"739","endToEndId":"22-03-2021 18:23 0050005334304700","bookingDate":"2021-03-22","valueDate":"2021-03-23","transactionAmount":{"currency":"EUR","amount":"-51.03"},"creditorAccount":{"iban":"NL58INGB0000003050"},"creditorName":"Zilveren Kruis Zorgverzekeringen N.V","debtorAccount":{"iban":"NL71RABO0346234166","currency":"EUR"},"remittanceInformationUnstructured":"040190441 0050005334304700 aflossing BR zorgkosten Zilveren Kruis Zorgverzekeringen NV x4166 pasnr.011","purposeCode":"EPAY","raboBookingDateTime":"2021-03-22T17:24:50.679037Z","raboDetailedTransactionType":"25","raboTransactionTypeName":"id"},{"entryReference":"738","endToEndId":"22-03-2021 18:00 0050005334246569","bookingDate":"2021-03-22","valueDate":"2021-03-23","transactionAmount":{"currency":"EUR","amount":"-50.0"},"creditorAccount":{"iban":"NL05INGB0702278378"},"creditorName":"Wehkamp Finance","debtorAccount":{"iban":"NL71RABO0346234166","currency":"EUR"},"remittanceInformationUnstructured":"12000000000000000518782050071171476 0050005334246569 12000000000000000518782050071171476 Wehkamp Finance x4166 pasnr.011","purposeCode":"EPAY","raboBookingDateTime":"2021-03-22T17:01:17.324031Z","raboDetailedTransactionType":"25","raboTransactionTypeName":"id"},{"entryReference":"737","endToEndId":"22-03-2021 12:26 0020004916422850","bookingDate":"2021-03-22","valueDate":"2021-03-22","transactionAmount":{"currency":"EUR","amount":"-1205.36"},"creditorAccount":{"iban":"NL62RABO0150334583"},"creditorName":"Stichting Woonbron","debtorAccount":{"iban":"NL71RABO0346234166","currency":"EUR"},"remittanceInformationUnstructured":"21032212265bf20c 0020004916422850 Uw huurbetaling x4166 pasnr.011","purposeCode":"EPAY","raboBookingDateTime":"2021-03-22T11:28:42.789531Z","raboDetailedTransactionType":"25","raboTransactionTypeName":"id"},{"entryReference":"736","endToEndId":"GVSXX20210317039474923","bookingDate":"2021-03-22","valueDate":"2021-03-22","transactionAmount":{"currency":"EUR","amount":"343.0"},"creditorAccount":{"iban":"NL71RABO0346234166","currency":"EUR"},"debtorAccount":{"iban":"NL86INGB0002445588"},"debtorName":"BELASTINGDIENST","remittanceInformationUnstructured":"MAAND APR. NR. 219159488T100002 VOORSCHOT HUURTOESLAG 2021 (AKIN ) MEER INFO OP WWW.TOESLAGEN.NL","raboBookingDateTime":"2021-03-22T08:58:22.551334Z","raboDetailedTransactionType":"541","raboTransactionTypeName":"cb"},{"entryReference":"735","endToEndId":"GVSXX20210317042291718","bookingDate":"2021-03-22","valueDate":"2021-03-22","transactionAmount":{"currency":"EUR","amount":"107.0"},"creditorAccount":{"iban":"NL71RABO0346234166","currency":"EUR"},"debtorAccount":{"iban":"NL86INGB0002445588"},"debtorName":"BELASTINGDIENST","remittanceInformationUnstructured":"MAAND APR. NR. 219159488T100013 VOORSCHOT ZORGTOESLAG 2021 (AKIN ) MEER INFO OP WWW.TOESLAGEN.NL","raboBookingDateTime":"2021-03-22T08:43:04.724106Z","raboDetailedTransactionType":"541","raboTransactionTypeName":"cb"},{"entryReference":"734","endToEndId":"5000008209336292","mandateId":"6952006","creditorId":"NL64ZZZ341023030000","bookingDate":"2021-03-22","valueDate":"2021-03-22","transactionAmount":{"currency":"EUR","amount":"-12.95"},"creditorAccount":{"iban":"NL10ABNA0240120000"},"creditorName":"ENECO SERVICES","debtorAccount":{"iban":"NL71RABO0346234166","currency":"EUR"},"remittanceInformationUnstructured":"Kenmerk  5000008209336292 Omschrijving  Klantnummer  45907638-2  Periode  2021-03 Veenoord 516 ROTTERDAM","raboBookingDateTime":"2021-03-22T07:19:27.49941Z","raboDetailedTransactionType":"64","raboTransactionTypeName":"ei"},{"entryReference":"733","bookingDate":"2021-03-19","valueDate":"2021-03-19","transactionAmount":{"currency":"EUR","amount":"-19.0"},"creditorAccount":{"iban":"NL46ABNA0547147147"},"creditorName":"Cak","debtorAccount":{"iban":"NL71RABO0346234166","currency":"EUR"},"remittanceInformationUnstructured":"Factuurnummer : 810000006565484","raboBookingDateTime":"2021-03-19T10:49:52.16147Z","raboDetailedTransactionType":"547","raboTransactionTypeName":"bg"},{"entryReference":"732","endToEndId":"19-03-2021 11:03 0050005327269684","bookingDate":"2021-03-19","valueDate":"2021-03-19","transactionAmount":{"currency":"EUR","amount":"-104.0"},"creditorAccount":{"iban":"NL90INGB0705005070"},"creditorName":"Centraal Justitieel Incassobureau","debtorAccount":{"iban":"NL71RABO0346234166","currency":"EUR"},"remittanceInformationUnstructured":"4132542004202102 0050005327269684 Betaald via Digitaal Loket Centraal Justitieel Incassobureau x4166 pasnr.011","purposeCode":"EPAY","raboBookingDateTime":"2021-03-19T10:04:23.730394Z","raboDetailedTransactionType":"25","raboTransactionTypeName":"id"},{"entryReference":"731","endToEndId":"19-03-2021 11:02 0030006385346814","bookingDate":"2021-03-19","valueDate":"2021-03-19","transactionAmount":{"currency":"EUR","amount":"-68.34"},"creditorAccount":{"iban":"NL97ABNA0644512113"},"creditorName":"Gemeente Rotterdam","debtorAccount":{"iban":"NL71RABO0346234166","currency":"EUR"},"remittanceInformationUnstructured":"3308543452 0030006385346814 3308543452 x4166 pasnr.011","purposeCode":"EPAY","raboBookingDateTime":"2021-03-19T10:04:23.73015Z","raboDetailedTransactionType":"25","raboTransactionTypeName":"id"},{"entryReference":"730","endToEndId":"GVSXX20210316037783916","bookingDate":"2021-03-19","valueDate":"2021-03-19","transactionAmount":{"currency":"EUR","amount":"1191.0"},"creditorAccount":{"iban":"NL71RABO0346234166","currency":"EUR"},"debtorAccount":{"iban":"NL36INGB0003445588"},"debtorName":"BELASTINGDIENST","remittanceInformationUnstructured":"TERUGGAAF NR. 219159488H0001 IB/PVV 2020 (AKIN )","raboBookingDateTime":"2021-03-19T07:25:20.45846Z","raboDetailedTransactionType":"541","raboTransactionTypeName":"cb"},{"entryReference":"729","endToEndId":"753U000778208292","mandateId":"102654295U","creditorId":"NL85ZZZ140522640000","bookingDate":"2021-03-16","valueDate":"2021-03-16","transactionAmount":{"currency":"EUR","amount":"-36.0"},"creditorAccount":{"iban":"NL93INGB0007939833"},"creditorName":"VODAFONE LIBERTEL BV","debtorAccount":{"iban":"NL71RABO0346234166","currency":"EUR"},"remittanceInformationUnstructured":"Klant Nr XXXXXX437/XXXXXX395 Maart Factuur Nr 315131179473 zie vodafone.nl/my","raboBookingDateTime":"2021-03-16T07:04:38.890977Z","raboDetailedTransactionType":"64","raboTransactionTypeName":"ei"},{"entryReference":"728","endToEndId":"13-03-2021 17:31 0030006338944884","bookingDate":"2021-03-13","valueDate":"2021-03-15","transactionAmount":{"currency":"EUR","amount":"-11.25"},"creditorAccount":{"iban":"NL31ABNA0494688556"},"creditorName":"Takeaway.com","debtorAccount":{"iban":"NL71RABO0346234166","currency":"EUR"},"remittanceInformationUnstructured":"YHE6Q3 0030006338944884 bestelling Thuisbezorgd.nl x4166 pasnr.011","purposeCode":"EPAY","raboBookingDateTime":"2021-03-13T16:33:19.915887Z","raboDetailedTransactionType":"25","raboTransactionTypeName":"id"},{"entryReference":"727","bookingDate":"2021-03-12","valueDate":"2021-03-12","transactionAmount":{"currency":"EUR","amount":"-7.1"},"creditorAccount":{},"creditorName":"DIRK VDBROEK FIL4146 ROTTERDAM","debtorAccount":{"iban":"NL71RABO0346234166","currency":"EUR"},"remittanceInformationUnstructured":"Betaalautomaat 14:23 pasnr. 011","raboBookingDateTime":"2021-03-12T13:23:52.089996Z","raboDetailedTransactionType":"2","raboTransactionTypeName":"bc"},{"entryReference":"726","bookingDate":"2021-03-12","valueDate":"2021-03-12","transactionAmount":{"currency":"EUR","amount":"-3.57"},"creditorAccount":{},"creditorName":"Kruidvat 7377 ROTTERDAM","debtorAccount":{"iban":"NL71RABO0346234166","currency":"EUR"},"remittanceInformationUnstructured":"Betaalautomaat 13:48 pasnr. 011","raboBookingDateTime":"2021-03-12T12:48:42.962892Z","raboDetailedTransactionType":"2","raboTransactionTypeName":"bc"},{"entryReference":"725","endToEndId":"098803776473","mandateId":"000001174056","creditorId":"NL24ZZZ241706500000","bookingDate":"2021-03-12","valueDate":"2021-03-12","transactionAmount":{"currency":"EUR","amount":"-17.75"},"creditorAccount":{"iban":"NL13INGB0000008710"},"creditorName":"EVIDES WATERBEDRIJF","debtorAccount":{"iban":"NL71RABO0346234166","currency":"EUR"},"remittanceInformationUnstructured":"Factuurnr 072605919258 VNKlantnr 2002312993 BTW 1,47PC 3079 NR 516, MRT","raboBookingDateTime":"2021-03-12T07:07:15.709477Z","raboDetailedTransactionType":"64","raboTransactionTypeName":"ei"},{"entryReference":"724","endToEndId":"11-03-2021 09:14 0030006319815900","bookingDate":"2021-03-11","valueDate":"2021-03-11","transactionAmount":{"currency":"EUR","amount":"-152.21"},"creditorAccount":{"iban":"NL97ABNA0644512113"},"creditorName":"Gemeente Rotterdam","debtorAccount":{"iban":"NL71RABO0346234166","currency":"EUR"},"remittanceInformationUnstructured":"3308534279 0030006319815900 3308534279 x4166 pasnr.011","purposeCode":"EPAY","raboBookingDateTime":"2021-03-11T08:16:11.851735Z","raboDetailedTransactionType":"25","raboTransactionTypeName":"id"},{"entryReference":"723","endToEndId":"11-03-2021 09:13 0020004875572692","bookingDate":"2021-03-11","valueDate":"2021-03-11","transactionAmount":{"currency":"EUR","amount":"-200.0"},"creditorAccount":{"iban":"NL62RABO0150334583"},"creditorName":"Stichting Woonbron","debtorAccount":{"iban":"NL71RABO0346234166","currency":"EUR"},"remittanceInformationUnstructured":"21031109137428d8 0020004875572692 Uw huurbetaling x4166 pasnr.011","purposeCode":"EPAY","raboBookingDateTime":"2021-03-11T08:15:11.737221Z","raboDetailedTransactionType":"25","raboTransactionTypeName":"id"},{"entryReference":"722","endToEndId":"8021938001993169","bookingDate":"2021-03-11","valueDate":"2021-03-11","transactionAmount":{"currency":"EUR","amount":"393.25"},"creditorAccount":{"iban":"NL71RABO0346234166","currency":"EUR"},"debtorAccount":{"iban":"NL74ABNA0562524053"},"debtorName":"KAMPEN ASSURANTIEMAKELAA","remittanceInformationUnstructured":"Kenmerk 8021.9380.0199.3169 Omschrijving 41-PFS-1 ONS SCHADENR. 823754","raboBookingDateTime":"2021-03-11T07:23:14.197725Z","raboDetailedTransactionType":"541","raboTransactionTypeName":"cb"},{"entryReference":"721","endToEndId":"09-03-2021 16:54 0370305243433201","bookingDate":"2021-03-09","valueDate":"2021-03-09","transactionAmount":{"currency":"EUR","amount":"-9.45"},"creditorAccount":{"iban":"NL35RABO0117713678"},"creditorName":"Cafe-Restaurant Saray via PAY.nl","debtorAccount":{"iban":"NL71RABO0346234166","currency":"EUR"},"remittanceInformationUnstructured":"1431883400X81ee7 0370305243433201 bestelling 2628727 x4166 pasnr.011","purposeCode":"EPAY","raboBookingDateTime":"2021-03-09T15:55:34.966777Z","raboDetailedTransactionType":"25","raboTransactionTypeName":"id"},{"entryReference":"720","endToEndId":"460057553823","mandateId":"1280000649030","creditorId":"NL10ZZZ302086370000","bookingDate":"2021-03-08","valueDate":"2021-03-08","transactionAmount":{"currency":"EUR","amount":"-112.45"},"creditorAccount":{"iban":"NL58INGB0000003050"},"creditorName":"Zilveren Kruis Zorgverzekeringen  NV","debtorAccount":{"iban":"NL71RABO0346234166","currency":"EUR"},"remittanceInformationUnstructured":"Zilveren Kruis Afhandeling zorgkostennota s Ons kenmerk 040190441-2100001","raboBookingDateTime":"2021-03-08T07:07:17.37587Z","raboDetailedTransactionType":"64","raboTransactionTypeName":"ei"},{"entryReference":"719","endToEndId":"05-03-2021 08:17 0050005295957814","bookingDate":"2021-03-05","valueDate":"2021-03-05","transactionAmount":{"currency":"EUR","amount":"-53.63"},"creditorAccount":{"iban":"NL05INGB0702278378"},"creditorName":"Wehkamp Finance","debtorAccount":{"iban":"NL71RABO0346234166","currency":"EUR"},"remittanceInformationUnstructured":"12000000000000000513512130071171476 0050005295957814 12000000000000000513512130071171476 Wehkamp Finance x4166 pasnr.011","purposeCode":"EPAY","raboBookingDateTime":"2021-03-05T07:19:27.78394Z","raboDetailedTransactionType":"25","raboTransactionTypeName":"id"},{"entryReference":"718","endToEndId":"6303.14333148","mandateId":"ALL0012937194.01","creditorId":"NL66ZZZ290379290000","bookingDate":"2021-03-03","valueDate":"2021-03-03","transactionAmount":{"currency":"EUR","amount":"-6.33"},"creditorAccount":{"iban":"NL67INGB0005338373"},"creditorName":"Allianz Direct","debtorAccount":{"iban":"NL71RABO0346234166","currency":"EUR"},"remittanceInformationUnstructured":"Kenmerk: 4000000036280196 / Periode: 2021-03-01 - 2021-04-01 / NL71RABO0346234166","raboBookingDateTime":"2021-03-03T06:38:30.016004Z","raboDetailedTransactionType":"64","raboTransactionTypeName":"ei"},{"entryReference":"717","bookingDate":"2021-03-02","valueDate":"2021-03-02","transactionAmount":{"currency":"EUR","amount":"-6.25"},"creditorAccount":{},"creditorName":"Esso Rotterdam Stadion ROTTERDAM","debtorAccount":{"iban":"NL71RABO0346234166","currency":"EUR"},"remittanceInformationUnstructured":"Betaalautomaat 13:35 pasnr. 011","raboBookingDateTime":"2021-03-02T12:35:18.907952Z","raboDetailedTransactionType":"2","raboTransactionTypeName":"bc"},{"entryReference":"716","bookingDate":"2021-03-02","valueDate":"2021-03-01","transactionAmount":{"currency":"EUR","amount":"-1.7"},"creditorAccount":{},"creditorName":"Kosten","debtorAccount":{"iban":"NL71RABO0346234166","currency":"EUR"},"remittanceInformationUnstructured":"Rabo DirectPakket                  Periode 01-03-2021 t/m 31-03-2021","raboBookingDateTime":"2021-03-02T09:18:40.625797Z","raboDetailedTransactionType":"93","raboTransactionTypeName":"db"},{"entryReference":"715","endToEndId":"TK00249016","mandateId":"MANIJS009396","creditorId":"NL18ZZZ241082910000","bookingDate":"2021-03-01","valueDate":"2021-03-01","transactionAmount":{"currency":"EUR","amount":"-100.0"},"creditorAccount":{"iban":"NL42RABO0330574426"},"creditorName":"Stichting Woonbron","debtorAccount":{"iban":"NL71RABO0346234166","currency":"EUR"},"remittanceInformationUnstructured":"Incasso    Bet.regeling BER0021-00902 termijn 1","raboBookingDateTime":"2021-03-01T03:05:34.980109Z","raboDetailedTransactionType":"65","raboTransactionTypeName":"ei"},{"entryReference":"714","endToEndId":"TK00249017","mandateId":"MANIJS009396","creditorId":"NL18ZZZ241082910000","bookingDate":"2021-03-01","valueDate":"2021-03-01","transactionAmount":{"currency":"EUR","amount":"-752.68"},"creditorAccount":{"iban":"NL42RABO0330574426"},"creditorName":"Stichting Woonbron","debtorAccount":{"iban":"NL71RABO0346234166","currency":"EUR"},"remittanceInformationUnstructured":"Incasso  Huur Periode: 01-03-2021 tot 01-04-2021","raboBookingDateTime":"2021-03-01T03:05:34.979623Z","raboDetailedTransactionType":"65","raboTransactionTypeName":"ei"},{"entryReference":"713","bookingDate":"2021-02-27","valueDate":"2021-02-27","transactionAmount":{"currency":"EUR","amount":"-3.0"},"creditorAccount":{},"creditorName":"Bakkerij OZ Sultan ROTTERDAM","debtorAccount":{"iban":"NL71RABO0346234166","currency":"EUR"},"remittanceInformationUnstructured":"Betaalautomaat 15:44 pasnr. 011","raboBookingDateTime":"2021-02-27T14:44:58.484061Z","raboDetailedTransactionType":"2","raboTransactionTypeName":"bc"},{"entryReference":"712","endToEndId":"ARNL9926793955","mandateId":"RDAM-1108232-002","creditorId":"NL37ZZZ244832980001","bookingDate":"2021-02-26","valueDate":"2021-02-26","transactionAmount":{"currency":"EUR","amount":"-28.8"},"creditorAccount":{"iban":"NL97ABNA0644512113"},"creditorName":"GEM BELASTINGEN RDAM","debtorAccount":{"iban":"NL71RABO0346234166","currency":"EUR"},"remittanceInformationUnstructured":"ARNL9926793955 STZ Vergunningen                Vrdnr: 5509006746               Tijdvak: 01-JAN-2021/31-MRT-2021","raboBookingDateTime":"2021-02-26T09:16:47.122001Z","raboDetailedTransactionType":"64","raboTransactionTypeName":"ei"},{"entryReference":"711","endToEndId":"88786128","mandateId":"6337215","creditorId":"NL97ZZZ534852620000","bookingDate":"2021-02-26","valueDate":"2021-02-26","transactionAmount":{"currency":"EUR","amount":"-50.0"},"creditorAccount":{"iban":"NL86ABNA0511919131"},"creditorName":"BUDGETENERGIE B V","debtorAccount":{"iban":"NL71RABO0346234166","currency":"EUR"},"remittanceInformationUnstructured":"Termijn maart (kenmerk: 1200-0000-0420-7848)","raboBookingDateTime":"2021-02-26T07:53:27.851468Z","raboDetailedTransactionType":"64","raboTransactionTypeName":"ei"},{"entryReference":"710","endToEndId":"ARNLNL2101076693","mandateId":"B0008195475-0346234166-01","creditorId":"NL12T2N333034180000","bookingDate":"2021-02-25","valueDate":"2021-02-25","transactionAmount":{"currency":"EUR","amount":"-30.0"},"creditorAccount":{"iban":"NL06COBA0637053753"},"creditorName":"TELE2","debtorAccount":{"iban":"NL71RABO0346234166","currency":"EUR"},"remittanceInformationUnstructured":"ARNLNL2101076693","raboBookingDateTime":"2021-02-25T07:03:11.27118Z","raboDetailedTransactionType":"64","raboTransactionTypeName":"ei"},{"entryReference":"709","endToEndId":"440058075187","mandateId":"1040000643670","creditorId":"NL10ZZZ302086370000","bookingDate":"2021-02-24","valueDate":"2021-02-24","transactionAmount":{"currency":"EUR","amount":"-57.99"},"creditorAccount":{"iban":"NL58INGB0000003050"},"creditorName":"Zilveren Kruis Zorgverzekeringen  NV","debtorAccount":{"iban":"NL71RABO0346234166","currency":"EUR"},"remittanceInformationUnstructured":"Overeengekomen betalingsregeling - PZK040190441","raboBookingDateTime":"2021-02-24T07:15:22.020844Z","raboDetailedTransactionType":"64","raboTransactionTypeName":"ei"},{"entryReference":"708","endToEndId":"753U000778083313","mandateId":"102654295U","creditorId":"NL85ZZZ140522640000","bookingDate":"2021-02-24","valueDate":"2021-02-24","transactionAmount":{"currency":"EUR","amount":"-36.0"},"creditorAccount":{"iban":"NL93INGB0007939833"},"creditorName":"VODAFONE LIBERTEL BV","debtorAccount":{"iban":"NL71RABO0346234166","currency":"EUR"},"remittanceInformationUnstructured":"Klant Nr XXXXXX437/XXXXXX395 Februari Factuur Nr 315127590050 zie vodafone.nl/my","raboBookingDateTime":"2021-02-24T07:14:43.132341Z","raboDetailedTransactionType":"64","raboTransactionTypeName":"ei"},{"entryReference":"707","endToEndId":"440058075186","mandateId":"1280000649030","creditorId":"NL10ZZZ302086370000","bookingDate":"2021-02-24","valueDate":"2021-02-24","transactionAmount":{"currency":"EUR","amount":"-17.04"},"creditorAccount":{"iban":"NL58INGB0000003050"},"creditorName":"Zilveren Kruis Zorgverzekeringen  NV","debtorAccount":{"iban":"NL71RABO0346234166","currency":"EUR"},"remittanceInformationUnstructured":"Overeengekomen betalingsregeling - SZK040190441","raboBookingDateTime":"2021-02-24T07:03:39.602437Z","raboDetailedTransactionType":"64","raboTransactionTypeName":"ei"},{"entryReference":"706","endToEndId":"440058075185","mandateId":"1040000643670","creditorId":"NL10ZZZ302086370000","bookingDate":"2021-02-24","valueDate":"2021-02-24","transactionAmount":{"currency":"EUR","amount":"-114.9"},"creditorAccount":{"iban":"NL58INGB0000003050"},"creditorName":"Zilveren Kruis Zorgverzekeringen  NV","debtorAccount":{"iban":"NL71RABO0346234166","currency":"EUR"},"remittanceInformationUnstructured":"Premie Zilveren Kruis Relatienummer 040190441 Periode 01-03-2021 - 01-04-2021","raboBookingDateTime":"2021-02-24T07:02:37.159193Z","raboDetailedTransactionType":"64","raboTransactionTypeName":"ei"},{"entryReference":"705","endToEndId":"000000047858540","bookingDate":"2021-02-23","valueDate":"2021-02-23","transactionAmount":{"currency":"EUR","amount":"967.9"},"creditorAccount":{"iban":"NL71RABO0346234166","currency":"EUR"},"debtorAccount":{"iban":"NL69ABNA0644512326"},"debtorName":"GEM RDAM SERVICEORG","remittanceInformationUnstructured":"Akin, HA.                                                       1122864                         Betaling aan klant (restbetaling","raboBookingDateTime":"2021-02-23T12:10:45.093433Z","raboDetailedTransactionType":"541","raboTransactionTypeName":"cb"},{"entryReference":"704","endToEndId":"2021-02-21T13:31:39-000000000000024","mandateId":"2019100001","creditorId":"NL68ZZZ411333400000","bookingDate":"2021-02-23","valueDate":"2021-02-23","transactionAmount":{"currency":"EUR","amount":"-10.0"},"creditorAccount":{"iban":"NL81INGB0004332134"},"creditorName":"STICHTING AKTIEF ORANJEBOOM","debtorAccount":{"iban":"NL71RABO0346234166","currency":"EUR"},"remittanceInformationUnstructured":"GIFT FEBRUARI 2021","raboBookingDateTime":"2021-02-23T07:30:20.18529Z","raboDetailedTransactionType":"64","raboTransactionTypeName":"ei"},{"entryReference":"703","bookingDate":"2021-02-22","valueDate":"2021-02-22","transactionAmount":{"currency":"EUR","amount":"-2.44"},"creditorAccount":{"iban":"NL32RABO0321701240"},"creditorName":"Unive zuid nederland","debtorAccount":{"iban":"NL71RABO0346234166","currency":"EUR"},"remittanceInformationStructured":"2210628379914021","raboBookingDateTime":"2021-02-22T13:08:06.094978Z","raboDetailedTransactionType":"547","raboTransactionTypeName":"bg"},{"entryReference":"702","bookingDate":"2021-02-22","valueDate":"2021-02-22","transactionAmount":{"currency":"EUR","amount":"-19.03"},"creditorAccount":{"iban":"NL97ABNA0644512113"},"creditorName":"Gemeente Rotterdam","debtorAccount":{"iban":"NL71RABO0346234166","currency":"EUR"},"remittanceInformationStructured":"6000003308109396","raboBookingDateTime":"2021-02-22T13:07:07.914687Z","raboDetailedTransactionType":"547","raboTransactionTypeName":"bg"},{"entryReference":"701","endToEndId":"GVSXX20210217024545896","bookingDate":"2021-02-22","valueDate":"2021-02-22","transactionAmount":{"currency":"EUR","amount":"107.0"},"creditorAccount":{"iban":"NL71RABO0346234166","currency":"EUR"},"debtorAccount":{"iban":"NL86INGB0002445588"},"debtorName":"BELASTINGDIENST","remittanceInformationUnstructured":"MAAND MRT. NR. 219159488T100013 VOORSCHOT ZORGTOESLAG 2021 (AKIN ) MEER INFO OP WWW.TOESLAGEN.NL","raboBookingDateTime":"2021-02-22T08:05:03.660501Z","raboDetailedTransactionType":"541","raboTransactionTypeName":"cb"},{"entryReference":"700","endToEndId":"GVSXX20210217021723489","bookingDate":"2021-02-22","valueDate":"2021-02-22","transactionAmount":{"currency":"EUR","amount":"343.0"},"creditorAccount":{"iban":"NL71RABO0346234166","currency":"EUR"},"debtorAccount":{"iban":"NL86INGB0002445588"},"debtorName":"BELASTINGDIENST","remittanceInformationUnstructured":"MAAND MRT. NR. 219159488T100002 VOORSCHOT HUURTOESLAG 2021 (AKIN ) MEER INFO OP WWW.TOESLAGEN.NL","raboBookingDateTime":"2021-02-22T07:37:36.201126Z","raboDetailedTransactionType":"541","raboTransactionTypeName":"cb"},{"entryReference":"699","endToEndId":"1000008145154562","mandateId":"6952006","creditorId":"NL64ZZZ341023030000","bookingDate":"2021-02-22","valueDate":"2021-02-22","transactionAmount":{"currency":"EUR","amount":"-12.95"},"creditorAccount":{"iban":"NL10ABNA0240120000"},"creditorName":"ENECO SERVICES","debtorAccount":{"iban":"NL71RABO0346234166","currency":"EUR"},"remittanceInformationUnstructured":"Kenmerk  1000008145154562 Omschrijving  Klantnummer  45907638-2  Periode  2021-02 Veenoord 516 ROTTERDAM","raboBookingDateTime":"2021-02-22T07:04:36.631979Z","raboDetailedTransactionType":"64","raboTransactionTypeName":"ei"},{"entryReference":"698","endToEndId":"753U000775929110","mandateId":"102654295U","creditorId":"NL85ZZZ140522640000","bookingDate":"2021-02-19","valueDate":"2021-02-15","transactionAmount":{"currency":"EUR","amount":"36.0"},"creditorAccount":{"iban":"NL71RABO0346234166","currency":"EUR"},"debtorAccount":{"iban":"NL93INGB0007939833"},"debtorName":"VODAFONE LIBERTEL BV","remittanceInformationUnstructured":"Klant Nr XXXXXX437/XXXXXX395 Februari Factuur Nr 315127590050 zie vodafone.nl/my","raboBookingDateTime":"2021-02-19T13:06:56.660698Z","raboDetailedTransactionType":"108","raboTransactionTypeName":"st","reasonCode":"AM04"},{"entryReference":"697","endToEndId":"753U000775929110","mandateId":"102654295U","creditorId":"NL85ZZZ140522640000","bookingDate":"2021-02-15","valueDate":"2021-02-15","transactionAmount":{"currency":"EUR","amount":"-36.0"},"creditorAccount":{"iban":"NL93INGB0007939833"},"creditorName":"VODAFONE LIBERTEL BV","debtorAccount":{"iban":"NL71RABO0346234166","currency":"EUR"},"remittanceInformationUnstructured":"Klant Nr XXXXXX437/XXXXXX395 Februari Factuur Nr 315127590050 zie vodafone.nl/my","raboBookingDateTime":"2021-02-15T06:50:43.013377Z","raboDetailedTransactionType":"64","raboTransactionTypeName":"ei"},{"entryReference":"696","endToEndId":"084603511691","mandateId":"000001174056","creditorId":"NL24ZZZ241706500000","bookingDate":"2021-02-12","valueDate":"2021-02-12","transactionAmount":{"currency":"EUR","amount":"-17.75"},"creditorAccount":{"iban":"NL13INGB0000008710"},"creditorName":"EVIDES WATERBEDRIJF","debtorAccount":{"iban":"NL71RABO0346234166","currency":"EUR"},"remittanceInformationUnstructured":"Factuurnr 070110850247 VNKlantnr 2002312993 BTW 1,47PC 3079 NR 516, FEB","raboBookingDateTime":"2021-02-12T07:07:12.057584Z","raboDetailedTransactionType":"64","raboTransactionTypeName":"ei"},{"entryReference":"695","bookingDate":"2021-02-09","valueDate":"2021-02-09","transactionAmount":{"currency":"EUR","amount":"-47.58"},"creditorAccount":{},"creditorName":"Sahan Putsebocht ROTTERDAM","debtorAccount":{"iban":"NL71RABO0346234166","currency":"EUR"},"remittanceInformationUnstructured":"Betaalautomaat 15:34 pasnr. 011","raboBookingDateTime":"2021-02-09T14:34:40.030593Z","raboDetailedTransactionType":"2","raboTransactionTypeName":"bc"},{"entryReference":"694","bookingDate":"2021-02-09","valueDate":"2021-02-09","transactionAmount":{"currency":"EUR","amount":"-12.52"},"creditorAccount":{},"creditorName":"Kruidvat 7377 ROTTERDAM","debtorAccount":{"iban":"NL71RABO0346234166","currency":"EUR"},"remittanceInformationUnstructured":"Betaalautomaat 14:24 pasnr. 011","raboBookingDateTime":"2021-02-09T13:24:46.860238Z","raboDetailedTransactionType":"2","raboTransactionTypeName":"bc"},{"entryReference":"693","bookingDate":"2021-02-08","valueDate":"2021-02-08","transactionAmount":{"currency":"EUR","amount":"-54.19"},"creditorAccount":{},"creditorName":"Sahan Oranjeboom ROTTERDAM","debtorAccount":{"iban":"NL71RABO0346234166","currency":"EUR"},"remittanceInformationUnstructured":"Betaalautomaat 14:54 pasnr. 011","raboBookingDateTime":"2021-02-08T13:54:59.205509Z","raboDetailedTransactionType":"30","raboTransactionTypeName":"ba"},{"entryReference":"692","endToEndId":"05-02-2021 11:13 0050005227758296","bookingDate":"2021-02-05","valueDate":"2021-02-05","transactionAmount":{"currency":"EUR","amount":"-55.27"},"creditorAccount":{"iban":"NL05INGB0702278378"},"creditorName":"Wehkamp Finance","debtorAccount":{"iban":"NL71RABO0346234166","currency":"EUR"},"remittanceInformationUnstructured":"62000000000000000504338460071171476 0050005227758296 62000000000000000504338460071171476 Wehkamp Finance x4166 pasnr.011","purposeCode":"EPAY","raboBookingDateTime":"2021-02-05T10:15:54.066889Z","raboDetailedTransactionType":"25","raboTransactionTypeName":"id"},{"entryReference":"691","endToEndId":"GVSXX20210202017679694","bookingDate":"2021-02-05","valueDate":"2021-02-05","transactionAmount":{"currency":"EUR","amount":"24.0"},"creditorAccount":{"iban":"NL71RABO0346234166","currency":"EUR"},"debtorAccount":{"iban":"NL36INGB0003445588"},"debtorName":"BELASTINGDIENST","remittanceInformationUnstructured":"TERUGGAAF NR. 219159488U1 MOTORRYTUIGENB.21 (41-PFS-1 )","raboBookingDateTime":"2021-02-05T08:57:57.00845Z","raboDetailedTransactionType":"541","raboTransactionTypeName":"cb"},{"entryReference":"690","bookingDate":"2021-02-03","valueDate":"2021-02-01","transactionAmount":{"currency":"EUR","amount":"-1.7"},"creditorAccount":{},"creditorName":"Kosten","debtorAccount":{"iban":"NL71RABO0346234166","currency":"EUR"},"remittanceInformationUnstructured":"Rabo DirectPakket                  Periode 01-02-2021 t/m 28-02-2021","raboBookingDateTime":"2021-02-03T08:51:06.42658Z","raboDetailedTransactionType":"93","raboTransactionTypeName":"db"},{"entryReference":"689","endToEndId":"6156.14239950","mandateId":"ALL0012937194.01","creditorId":"NL66ZZZ290379290000","bookingDate":"2021-02-03","valueDate":"2021-02-03","transactionAmount":{"currency":"EUR","amount":"-6.33"},"creditorAccount":{"iban":"NL67INGB0005338373"},"creditorName":"Allianz Direct","debtorAccount":{"iban":"NL71RABO0346234166","currency":"EUR"},"remittanceInformationUnstructured":"Kenmerk: 6000000036280195 / Periode: 2021-02-01 - 2021-03-01 / NL71RABO0346234166","raboBookingDateTime":"2021-02-03T07:04:15.550816Z","raboDetailedTransactionType":"64","raboTransactionTypeName":"ei"},{"entryReference":"688","endToEndId":"02-02-2021 20:47 0050005220905059","bookingDate":"2021-02-02","valueDate":"2021-02-03","transactionAmount":{"currency":"EUR","amount":"-90.72"},"creditorAccount":{"iban":"NL05INGB0702278378"},"creditorName":"Wehkamp Finance","debtorAccount":{"iban":"NL71RABO0346234166","currency":"EUR"},"remittanceInformationUnstructured":"32000000000000000503437420071171476 0050005220905059 32000000000000000503437420071171476 Wehkamp Finance x4166 pasnr.011","purposeCode":"EPAY","raboBookingDateTime":"2021-02-02T19:49:08.851619Z","raboDetailedTransactionType":"25","raboTransactionTypeName":"id"},{"entryReference":"687","endToEndId":"02-02-2021 20:00 0050005220755586","bookingDate":"2021-02-02","valueDate":"2021-02-03","transactionAmount":{"currency":"EUR","amount":"-56.81"},"creditorAccount":{"iban":"NL27INGB0000026500"},"creditorName":"bol.com b.v.","debtorAccount":{"iban":"NL71RABO0346234166","currency":"EUR"},"remittanceInformationUnstructured":"1193965477 0050005220755586 bol.com ref 1193965477 bol.com x4166 pasnr.011","purposeCode":"EPAY","raboBookingDateTime":"2021-02-02T19:01:52.001207Z","raboDetailedTransactionType":"25","raboTransactionTypeName":"id"},{"entryReference":"686","bookingDate":"2021-02-02","valueDate":"2021-02-02","transactionAmount":{"currency":"EUR","amount":"-200.0"},"creditorAccount":{},"creditorName":"CCV*De Optiek ROTTERDAM","debtorAccount":{"iban":"NL71RABO0346234166","currency":"EUR"},"remittanceInformationUnstructured":"Betaalautomaat 16:59 pasnr. 011","raboBookingDateTime":"2021-02-02T15:59:08.552277Z","raboDetailedTransactionType":"2","raboTransactionTypeName":"bc"},{"entryReference":"685","endToEndId":"01-02-2021 21:21 0370210885329512","bookingDate":"2021-02-01","valueDate":"2021-02-01","transactionAmount":{"currency":"EUR","amount":"-9.45"},"creditorAccount":{"iban":"NL35RABO0117713678"},"creditorName":"Cafe-Restaurant Saray via PAY.nl","debtorAccount":{"iban":"NL71RABO0346234166","currency":"EUR"},"remittanceInformationUnstructured":"1404987051Xbff20 0370210885329512 bestelling 2514327 x4166 pasnr.011","purposeCode":"EPAY","raboBookingDateTime":"2021-02-01T20:22:37.124867Z","raboDetailedTransactionType":"25","raboTransactionTypeName":"id"},{"entryReference":"684","bookingDate":"2021-01-30","valueDate":"2021-01-30","transactionAmount":{"currency":"EUR","amount":"-5.05"},"creditorAccount":{},"creditorName":"Sahan Oranjeboom ROTTERDAM","debtorAccount":{"iban":"NL71RABO0346234166","currency":"EUR"},"remittanceInformationUnstructured":"Betaalautomaat 19:27 pasnr. 011","raboBookingDateTime":"2021-01-30T18:27:13.714242Z","raboDetailedTransactionType":"2","raboTransactionTypeName":"bc"},{"entryReference":"683","bookingDate":"2021-01-29","valueDate":"2021-01-29","transactionAmount":{"currency":"EUR","amount":"-27.0"},"creditorAccount":{},"creditorName":"Esso Rotterdam Stadion ROTTERDAM","debtorAccount":{"iban":"NL71RABO0346234166","currency":"EUR"},"remittanceInformationUnstructured":"Betaalautomaat 20:49 pasnr. 011","raboBookingDateTime":"2021-01-29T19:48:34.185945Z","raboDetailedTransactionType":"2","raboTransactionTypeName":"bc"},{"entryReference":"682","bookingDate":"2021-01-29","valueDate":"2021-01-29","transactionAmount":{"currency":"EUR","amount":"-22.5"},"creditorAccount":{},"creditorName":"Holland Carwash B.V. AALSMEER","debtorAccount":{"iban":"NL71RABO0346234166","currency":"EUR"},"remittanceInformationUnstructured":"Betaalautomaat 15:39 pasnr. 011","raboBookingDateTime":"2021-01-29T14:39:55.428113Z","raboDetailedTransactionType":"2","raboTransactionTypeName":"bc"},{"entryReference":"681","endToEndId":"87739614","mandateId":"6337215","creditorId":"NL97ZZZ534852620000","bookingDate":"2021-01-29","valueDate":"2021-01-29","transactionAmount":{"currency":"EUR","amount":"-50.0"},"creditorAccount":{"iban":"NL86ABNA0511919131"},"creditorName":"BUDGETENERGIE B V","debtorAccount":{"iban":"NL71RABO0346234166","currency":"EUR"},"remittanceInformationUnstructured":"Termijnbedrag 2021/02 4207848/1000018961474","raboBookingDateTime":"2021-01-29T08:06:51.10039Z","raboDetailedTransactionType":"64","raboTransactionTypeName":"ei"},{"entryReference":"680","endToEndId":"27-01-2021 13:03 0020004709223300","bookingDate":"2021-01-27","valueDate":"2021-01-27","transactionAmount":{"currency":"EUR","amount":"-44.5"},"creditorAccount":{"iban":"NL48RABO0132394782"},"creditorName":"Rituals Cosmetics via Adyen","debtorAccount":{"iban":"NL71RABO0346234166","currency":"EUR"},"remittanceInformationUnstructured":"1516117490007422 0020004709223300 GL18411939 x4166 pasnr.011","purposeCode":"EPAY","raboBookingDateTime":"2021-01-27T12:05:47.425686Z","raboDetailedTransactionType":"25","raboTransactionTypeName":"id"},{"entryReference":"679","endToEndId":"AC210126123449108643","bookingDate":"2021-01-27","valueDate":"2021-01-27","transactionAmount":{"currency":"EUR","amount":"10.19"},"creditorAccount":{"iban":"NL71RABO0346234166","currency":"EUR"},"debtorAccount":{"iban":"NL32RABO0321701240"},"debtorName":"Unive Zuid-Nederland Bem","remittanceInformationUnstructured":"U6283799-  UKEX0700000065461551/9700000065461552-Terugbetaling premie-N 65461551/N 65461552","raboBookingDateTime":"2021-01-27T11:42:12.579888Z","raboDetailedTransactionType":"541","raboTransactionTypeName":"cb"},{"entryReference":"678","endToEndId":"COAXX865396631202101211301089095459","mandateId":"012558495","creditorId":"NL35ZZZ273653230000","bookingDate":"2021-01-27","valueDate":"2021-01-27","transactionAmount":{"currency":"EUR","amount":"-35.0"},"creditorAccount":{"iban":"NL86INGB0002445588"},"creditorName":"BELASTINGDIENST","debtorAccount":{"iban":"NL71RABO0346234166","currency":"EUR"},"remittanceInformationUnstructured":"41-PFS-1 LET OP, NIEUW TARIEF      12-01-2021 t/m 11-02-2021          MEER INFO WWW.BELASTINGDIENST.NL","raboBookingDateTime":"2021-01-27T09:46:08.842892Z","raboDetailedTransactionType":"64","raboTransactionTypeName":"ei"},{"entryReference":"677","bookingDate":"2021-01-26","valueDate":"2021-01-26","transactionAmount":{"currency":"EUR","amount":"-6.75"},"creditorAccount":{},"creditorName":"Lidl 628 Rotterdam ROTTERDAM","debtorAccount":{"iban":"NL71RABO0346234166","currency":"EUR"},"remittanceInformationUnstructured":"Betaalautomaat 16:43 pasnr. 011","raboBookingDateTime":"2021-01-26T15:43:30.401729Z","raboDetailedTransactionType":"2","raboTransactionTypeName":"bc"},{"entryReference":"676","bookingDate":"2021-01-25","valueDate":"2021-01-25","transactionAmount":{"currency":"EUR","amount":"-7.55"},"creditorAccount":{},"creditorName":"MC DONALDS ANTWERPEN ANTWERPEN BEL","debtorAccount":{"iban":"NL71RABO0346234166","currency":"EUR"},"remittanceInformationUnstructured":"Betaalautomaat 17:25 pasnr. 011","raboBookingDateTime":"2021-01-25T16:25:56.49191Z","raboDetailedTransactionType":"3","raboTransactionTypeName":"bc"},{"entryReference":"675","bookingDate":"2021-01-25","valueDate":"2021-01-25","transactionAmount":{"currency":"EUR","amount":"-23.31"},"creditorAccount":{},"creditorName":"ZEEMAN ANTWERPEN DE KE ANTWERPEN BEL","debtorAccount":{"iban":"NL71RABO0346234166","currency":"EUR"},"remittanceInformationUnstructured":"Betaalautomaat 17:22 pasnr. 011    Apple Pay","raboBookingDateTime":"2021-01-25T16:22:46.497855Z","raboDetailedTransactionType":"3","raboTransactionTypeName":"bc"},{"entryReference":"674","bookingDate":"2021-01-25","valueDate":"2021-01-25","transactionAmount":{"currency":"EUR","amount":"-27.72"},"creditorAccount":{},"creditorName":"Action 2087 Antwerpen sta BEL","debtorAccount":{"iban":"NL71RABO0346234166","currency":"EUR"},"remittanceInformationUnstructured":"Betaalautomaat 16:35 pasnr. 011    Apple Pay","raboBookingDateTime":"2021-01-25T15:35:08.204168Z","raboDetailedTransactionType":"3","raboTransactionTypeName":"bc"},{"entryReference":"673","bookingDate":"2021-01-25","valueDate":"2021-01-25","transactionAmount":{"currency":"EUR","amount":"-5.99"},"creditorAccount":{},"creditorName":"DIRK VDBROEK FIL4328 ROTTERDAM","debtorAccount":{"iban":"NL71RABO0346234166","currency":"EUR"},"remittanceInformationUnstructured":"Betaalautomaat 13:07 pasnr. 011    Apple Pay","raboBookingDateTime":"2021-01-25T12:07:15.588903Z","raboDetailedTransactionType":"2","raboTransactionTypeName":"bc"},{"entryReference":"672","endToEndId":"000000047322428","bookingDate":"2021-01-25","valueDate":"2021-01-25","transactionAmount":{"currency":"EUR","amount":"967.9"},"creditorAccount":{"iban":"NL71RABO0346234166","currency":"EUR"},"debtorAccount":{"iban":"NL69ABNA0644512326"},"debtorName":"GEM RDAM SERVICEORG","remittanceInformationUnstructured":"Akin, HA.                                                       1122864                         Betaling aan klant (restbetaling","raboBookingDateTime":"2021-01-25T11:22:43.138302Z","raboDetailedTransactionType":"541","raboTransactionTypeName":"cb"},{"entryReference":"671","endToEndId":"400057203736","mandateId":"1280000649030","creditorId":"NL10ZZZ302086370000","bookingDate":"2021-01-25","valueDate":"2021-01-25","transactionAmount":{"currency":"EUR","amount":"-28.36"},"creditorAccount":{"iban":"NL58INGB0000003050"},"creditorName":"Zilveren Kruis Zorgverzekeringen  NV","debtorAccount":{"iban":"NL71RABO0346234166","currency":"EUR"},"remittanceInformationUnstructured":"Overeengekomen betalingsregeling - SZK040190441","raboBookingDateTime":"2021-01-25T08:25:23.028006Z","raboDetailedTransactionType":"64","raboTransactionTypeName":"ei"},{"entryReference":"670","endToEndId":"400057203735","mandateId":"1040000643670","creditorId":"NL10ZZZ302086370000","bookingDate":"2021-01-25","valueDate":"2021-01-25","transactionAmount":{"currency":"EUR","amount":"-114.9"},"creditorAccount":{"iban":"NL58INGB0000003050"},"creditorName":"Zilveren Kruis Zorgverzekeringen  NV","debtorAccount":{"iban":"NL71RABO0346234166","currency":"EUR"},"remittanceInformationUnstructured":"Premie Zilveren Kruis Relatienummer 040190441 Periode 01-02-2021 - 01-03-2021","raboBookingDateTime":"2021-01-25T08:06:49.871456Z","raboDetailedTransactionType":"64","raboTransactionTypeName":"ei"},{"entryReference":"669","endToEndId":"ARNLNL2100734427","mandateId":"B0008195475-0346234166-01","creditorId":"NL12T2N333034180000","bookingDate":"2021-01-25","valueDate":"2021-01-25","transactionAmount":{"currency":"EUR","amount":"-30.0"},"creditorAccount":{"iban":"NL06COBA0637053753"},"creditorName":"TELE2","debtorAccount":{"iban":"NL71RABO0346234166","currency":"EUR"},"remittanceInformationUnstructured":"ARNLNL2100734427","raboBookingDateTime":"2021-01-25T07:05:17.009653Z","raboDetailedTransactionType":"64","raboTransactionTypeName":"ei"},{"entryReference":"668","endToEndId":"ARNL9000055177922","mandateId":"T2MI40000126598","creditorId":"NL12T2N333034180000","bookingDate":"2021-01-25","valueDate":"2021-01-25","transactionAmount":{"currency":"EUR","amount":"-12.9"},"creditorAccount":{"iban":"NL50COBA0637053737"},"creditorName":"TELE2","debtorAccount":{"iban":"NL71RABO0346234166","currency":"EUR"},"remittanceInformationUnstructured":"ARNL9000055177922","raboBookingDateTime":"2021-01-25T06:54:04.591949Z","raboDetailedTransactionType":"64","raboTransactionTypeName":"ei"},{"entryReference":"667","endToEndId":"24-01-2021 18:43 0050005195121212","bookingDate":"2021-01-24","valueDate":"2021-01-25","transactionAmount":{"currency":"EUR","amount":"-37.0"},"creditorAccount":{"iban":"NL05INGB0702278378"},"creditorName":"Wehkamp Finance","debtorAccount":{"iban":"NL71RABO0346234166","currency":"EUR"},"remittanceInformationUnstructured":"62000000000000000499925600071171476 0050005195121212 62000000000000000499925600071171476 Wehkamp Finance x4166 pasnr.011","purposeCode":"EPAY","raboBookingDateTime":"2021-01-24T17:44:50.434012Z","raboDetailedTransactionType":"25","raboTransactionTypeName":"id"},{"entryReference":"666","endToEndId":"24-01-2021 18:42 0050005195119129","bookingDate":"2021-01-24","valueDate":"2021-01-25","transactionAmount":{"currency":"EUR","amount":"-22.85"},"creditorAccount":{"iban":"NL05INGB0702278378"},"creditorName":"Wehkamp Finance","debtorAccount":{"iban":"NL71RABO0346234166","currency":"EUR"},"remittanceInformationUnstructured":"61000000000000000499925330071171476 0050005195119129 61000000000000000499925330071171476 Wehkamp Finance x4166 pasnr.011","purposeCode":"EPAY","raboBookingDateTime":"2021-01-24T17:43:20.201992Z","raboDetailedTransactionType":"25","raboTransactionTypeName":"id"},{"entryReference":"665","bookingDate":"2021-01-24","valueDate":"2021-01-24","transactionAmount":{"currency":"EUR","amount":"-8.5"},"creditorAccount":{},"creditorName":"CCV*Emak Tabaksshop ROTTERDAM","debtorAccount":{"iban":"NL71RABO0346234166","currency":"EUR"},"remittanceInformationUnstructured":"Betaalautomaat 13:43 pasnr. 011","raboBookingDateTime":"2021-01-24T12:43:56.166599Z","raboDetailedTransactionType":"2","raboTransactionTypeName":"bc"},{"entryReference":"664","bookingDate":"2021-01-23","valueDate":"2021-01-23","transactionAmount":{"currency":"EUR","amount":"-1000.0"},"creditorAccount":{},"creditorName":"CCV*A tot Z Autos B.V. RIDDERKERK","debtorAccount":{"iban":"NL71RABO0346234166","currency":"EUR"},"remittanceInformationUnstructured":"Betaalautomaat 15:00 pasnr. 011","raboBookingDateTime":"2021-01-23T14:00:08.472704Z","raboDetailedTransactionType":"2","raboTransactionTypeName":"bc"},{"entryReference":"663","endToEndId":"TK00021758","mandateId":"MANIJS009396","creditorId":"NL18ZZZ241082910000","bookingDate":"2021-01-23","valueDate":"2021-01-04","transactionAmount":{"currency":"EUR","amount":"752.68"},"creditorAccount":{"iban":"NL71RABO0346234166","currency":"EUR"},"debtorAccount":{"iban":"NL42RABO0330574426"},"debtorName":"Stichting Woonbron","remittanceInformationUnstructured":"Incasso  Huur Periode: 01-01-2021 tot 01-02-2021","raboBookingDateTime":"2021-01-23T11:39:10.386554Z","raboDetailedTransactionType":"104","raboTransactionTypeName":"st","reasonCode":"MD06"},{"entryReference":"662","endToEndId":"22-01-2021 13:08 0030005942120973","bookingDate":"2021-01-22","valueDate":"2021-01-22","transactionAmount":{"currency":"EUR","amount":"-2.0"},"creditorAccount":{"iban":"NL59ABNA0817771190"},"creditorName":"Apple","debtorAccount":{"iban":"NL71RABO0346234166","currency":"EUR"},"remittanceInformationUnstructured":"1519113173071147 0030005942120973 MV685YHMJ0a0 https://apple.co/b x4166 pasnr.011","purposeCode":"EPAY","raboBookingDateTime":"2021-01-22T12:10:59.269891Z","raboDetailedTransactionType":"25","raboTransactionTypeName":"id"},{"entryReference":"661","endToEndId":"22-01-2021 13:03 0030005942099904","bookingDate":"2021-01-22","valueDate":"2021-01-22","transactionAmount":{"currency":"EUR","amount":"-2.0"},"creditorAccount":{"iban":"NL59ABNA0817771190"},"creditorName":"Apple","debtorAccount":{"iban":"NL71RABO0346234166","currency":"EUR"},"remittanceInformationUnstructured":"1516113170167875 0030005942099904 MV685YGSJ8a0 https://apple.co/b x4166 pasnr.011","purposeCode":"EPAY","raboBookingDateTime":"2021-01-22T12:04:57.983056Z","raboDetailedTransactionType":"25","raboTransactionTypeName":"id"},{"entryReference":"660","endToEndId":"2021-01-17T12:40:46-000000000000025","mandateId":"2019100001","creditorId":"NL68ZZZ411333400000","bookingDate":"2021-01-22","valueDate":"2021-01-22","transactionAmount":{"currency":"EUR","amount":"-10.0"},"creditorAccount":{"iban":"NL81INGB0004332134"},"creditorName":"STICHTING AKTIEF ORANJEBOOM","debtorAccount":{"iban":"NL71RABO0346234166","currency":"EUR"},"remittanceInformationUnstructured":"GIFT JANUARI 2021","raboBookingDateTime":"2021-01-22T07:02:24.632355Z","raboDetailedTransactionType":"64","raboTransactionTypeName":"ei"},{"entryReference":"659","bookingDate":"2021-01-21","valueDate":"2021-01-21","transactionAmount":{"currency":"EUR","amount":"-19.0"},"creditorAccount":{"iban":"NL46ABNA0547147147"},"creditorName":"Cak","debtorAccount":{"iban":"NL71RABO0346234166","currency":"EUR"},"remittanceInformationUnstructured":"8100005932709","raboBookingDateTime":"2021-01-21T19:06:47.106346Z","raboDetailedTransactionType":"547","raboTransactionTypeName":"bg"},{"entryReference":"658","bookingDate":"2021-01-21","valueDate":"2021-01-21","transactionAmount":{"currency":"EUR","amount":"-2.5"},"creditorAccount":{},"creditorName":"CCV*VERHAGE FASTFOOD ROTTERDAM","debtorAccount":{"iban":"NL71RABO0346234166","currency":"EUR"},"remittanceInformationUnstructured":"Betaalautomaat 15:17 pasnr. 011","raboBookingDateTime":"2021-01-21T14:17:51.212537Z","raboDetailedTransactionType":"2","raboTransactionTypeName":"bc"},{"entryReference":"657","bookingDate":"2021-01-21","valueDate":"2021-01-21","transactionAmount":{"currency":"EUR","amount":"-21.65"},"creditorAccount":{},"creditorName":"Kruidvat 7377 ROTTERDAM","debtorAccount":{"iban":"NL71RABO0346234166","currency":"EUR"},"remittanceInformationUnstructured":"Betaalautomaat 15:15 pasnr. 011","raboBookingDateTime":"2021-01-21T14:15:52.030914Z","raboDetailedTransactionType":"2","raboTransactionTypeName":"bc"},{"entryReference":"656","bookingDate":"2021-01-20","valueDate":"2021-01-20","transactionAmount":{"currency":"EUR","amount":"-19.03"},"creditorAccount":{"iban":"NL97ABNA0644512113"},"creditorName":"Gemeente Rotterdam","debtorAccount":{"iban":"NL71RABO0346234166","currency":"EUR"},"remittanceInformationStructured":"6000003308109396","raboBookingDateTime":"2021-01-20T12:30:18.854766Z","raboDetailedTransactionType":"547","raboTransactionTypeName":"bg"},{"entryReference":"655","endToEndId":"20-01-2021 12:22 0050005183479364","bookingDate":"2021-01-20","valueDate":"2021-01-20","transactionAmount":{"currency":"EUR","amount":"-66.0"},"creditorAccount":{"iban":"NL56INGB0705005100"},"creditorName":"Centraal Justitieel Incassobureau","debtorAccount":{"iban":"NL71RABO0346234166","currency":"EUR"},"remittanceInformationUnstructured":"3062542238273024 0050005183479364 Betaald via Digitaal Loket Centraal Justitieel Incassobureau x4166 pasnr.011","purposeCode":"EPAY","raboBookingDateTime":"2021-01-20T11:25:15.282122Z","raboDetailedTransactionType":"25","raboTransactionTypeName":"id"},{"entryReference":"654","endToEndId":"GVSXX20210115006523036","bookingDate":"2021-01-20","valueDate":"2021-01-20","transactionAmount":{"currency":"EUR","amount":"107.0"},"creditorAccount":{"iban":"NL71RABO0346234166","currency":"EUR"},"debtorAccount":{"iban":"NL86INGB0002445588"},"debtorName":"BELASTINGDIENST","remittanceInformationUnstructured":"MAAND FEB. NR. 219159488T100013 VOORSCHOT ZORGTOESLAG 2021 (AKIN ) MEER INFO OP WWW.TOESLAGEN.NL","raboBookingDateTime":"2021-01-20T08:19:26.633414Z","raboDetailedTransactionType":"541","raboTransactionTypeName":"cb"},{"entryReference":"653","endToEndId":"GVSXX20210115003690988","bookingDate":"2021-01-20","valueDate":"2021-01-20","transactionAmount":{"currency":"EUR","amount":"436.0"},"creditorAccount":{"iban":"NL71RABO0346234166","currency":"EUR"},"debtorAccount":{"iban":"NL86INGB0002445588"},"debtorName":"BELASTINGDIENST","remittanceInformationUnstructured":"JAN-FEB NR. 219159488T100002 VOORSCHOT HUURTOESLAG 2021 (AKIN ) MEER INFO OP WWW.TOESLAGEN.NL","raboBookingDateTime":"2021-01-20T08:06:25.244792Z","raboDetailedTransactionType":"541","raboTransactionTypeName":"cb"},{"entryReference":"652","endToEndId":"0000008100624992","mandateId":"6952006","creditorId":"NL64ZZZ341023030000","bookingDate":"2021-01-20","valueDate":"2021-01-20","transactionAmount":{"currency":"EUR","amount":"-12.95"},"creditorAccount":{"iban":"NL10ABNA0240120000"},"creditorName":"ENECO SERVICES","debtorAccount":{"iban":"NL71RABO0346234166","currency":"EUR"},"remittanceInformationUnstructured":"Kenmerk  0000008100624992 Omschrijving  Klantnummer  45907638-2  Periode  2021-01 Veenoord 516 ROTTERDAM","raboBookingDateTime":"2021-01-20T07:25:34.239584Z","raboDetailedTransactionType":"64","raboTransactionTypeName":"ei"},{"entryReference":"651","endToEndId":"091004137501","mandateId":"000001174056","creditorId":"NL24ZZZ241706500000","bookingDate":"2021-01-18","valueDate":"2021-01-18","transactionAmount":{"currency":"EUR","amount":"-17.75"},"creditorAccount":{"iban":"NL13INGB0000008710"},"creditorName":"EVIDES WATERBEDRIJF","debtorAccount":{"iban":"NL71RABO0346234166","currency":"EUR"},"remittanceInformationUnstructured":"Factuurnr 070110803499 VNKlantnr 2002312993 BTW 1,47PC 3079 NR 516, JAN","raboBookingDateTime":"2021-01-18T05:15:09.636245Z","raboDetailedTransactionType":"64","raboTransactionTypeName":"ei"},{"entryReference":"650","endToEndId":"753U000773743787","mandateId":"102654295U","creditorId":"NL85ZZZ140522640000","bookingDate":"2021-01-15","valueDate":"2021-01-15","transactionAmount":{"currency":"EUR","amount":"-54.65"},"creditorAccount":{"iban":"NL93INGB0007939833"},"creditorName":"VODAFONE LIBERTEL BV","debtorAccount":{"iban":"NL71RABO0346234166","currency":"EUR"},"remittanceInformationUnstructured":"Klant Nr XXXXXX437/XXXXXX395 Januari Factuur Nr 315124138876 zie vodafone.nl/my","raboBookingDateTime":"2021-01-15T07:17:35.021854Z","raboDetailedTransactionType":"64","raboTransactionTypeName":"ei"}],"_links":{"account":{"href":"/accounts/i29S1Hewp3XwRsiuT1BWzo5n2NGDkSSB2A4VKrtXPFiGWhqkCSejsfYZ6dksNG0b"}}}}

REQUEST 5
GET https://somehost/openapi/payments/account-information/ais/accounts/i29S1Hewp3XwRsiuT1BWzo5n2NGDkSSB2A4VKrtXPFiGWhqkCSejsfYZ6dksNG0b/transactions?bookingStatus=booked&dateFrom=2020-10-16T22%3A00%3A00.000Z&dateTo=2021-01-14T22%3A59%3A59.999Z&size=500
Accept: application/json

RESPONSE 5
200
Content-Type: application/json

{"account":{"iban":"NL71RABO0346234166","currency":"EUR"},"transactions":{"booked":[{"entryReference":"649","bookingDate":"2021-01-12","valueDate":"2021-01-12","transactionAmount":{"currency":"EUR","amount":"-30.0"},"creditorAccount":{},"creditorName":"CCV*De Optiek ROTTERDAM","debtorAccount":{"iban":"NL71RABO0346234166","currency":"EUR"},"remittanceInformationUnstructured":"Betaalautomaat 17:07 pasnr. 011    Apple Pay","raboBookingDateTime":"2021-01-12T16:07:18.855765Z","raboDetailedTransactionType":"2","raboTransactionTypeName":"bc"},{"entryReference":"648","endToEndId":"0020004654641072","bookingDate":"2021-01-12","valueDate":"2021-01-12","transactionAmount":{"currency":"EUR","amount":"20.0"},"creditorAccount":{"iban":"NL71RABO0346234166","currency":"EUR"},"debtorAccount":{"iban":"NL13RABO0181015595"},"debtorName":"Betaalverzoek Rabobank","remittanceInformationUnstructured":"NL90INGB0680619852:Hr B Cekic:Doos","raboBookingDateTime":"2021-01-12T12:36:14.248255Z","raboDetailedTransactionType":"124","raboTransactionTypeName":"bv"},{"entryReference":"647","bookingDate":"2021-01-08","valueDate":"2021-01-08","transactionAmount":{"currency":"EUR","amount":"-1.0"},"creditorAccount":{},"creditorName":"SPY*Guel Bakkerij ROTTERDAM","debtorAccount":{"iban":"NL71RABO0346234166","currency":"EUR"},"remittanceInformationUnstructured":"Betaalautomaat 14:25 pasnr. 011    Apple Pay","raboBookingDateTime":"2021-01-08T13:25:31.416015Z","raboDetailedTransactionType":"2","raboTransactionTypeName":"bc"},{"entryReference":"646","bookingDate":"2021-01-06","valueDate":"2021-01-06","transactionAmount":{"currency":"EUR","amount":"-1.59"},"creditorAccount":{},"creditorName":"Kruidvat 7712 HOEVEN","debtorAccount":{"iban":"NL71RABO0346234166","currency":"EUR"},"remittanceInformationUnstructured":"Betaalautomaat 15:57 pasnr. 011    Apple Pay","raboBookingDateTime":"2021-01-06T14:57:57.71932Z","raboDetailedTransactionType":"2","raboTransactionTypeName":"bc"},{"entryReference":"645","endToEndId":"85522371.6119","bookingDate":"2021-01-05","valueDate":"2021-01-05","transactionAmount":{"currency":"EUR","amount":"10.0"},"creditorAccount":{"iban":"NL71RABO0346234166","currency":"EUR"},"debtorAccount":{"iban":"NL62INGB0663707048"},"debtorName":"Nederlandse Loterij Organisatie B.V.","remittanceInformationUnstructured":"Ref. 85522371.6119 Overboeking van Internet saldo, Gezamenlijke merken Nederlandse Loterij, Boeking 2021-01-03 14:11:55","raboBookingDateTime":"2021-01-05T16:34:35.391471Z","raboDetailedTransactionType":"541","raboTransactionTypeName":"cb"},{"entryReference":"644","endToEndId":"5994.14148065","mandateId":"ALL0012937194.01","creditorId":"NL66ZZZ290379290000","bookingDate":"2021-01-05","valueDate":"2021-01-05","transactionAmount":{"currency":"EUR","amount":"-6.33"},"creditorAccount":{"iban":"NL67INGB0005338373"},"creditorName":"Allianz Direct","debtorAccount":{"iban":"NL71RABO0346234166","currency":"EUR"},"remittanceInformationUnstructured":"Kenmerk: 8000000036280194 / Periode: 2021-01-01 - 2021-02-01 / NL71RABO0346234166","raboBookingDateTime":"2021-01-05T07:37:32.291531Z","raboDetailedTransactionType":"64","raboTransactionTypeName":"ei"},{"entryReference":"643","bookingDate":"2021-01-05","valueDate":"2021-01-01","transactionAmount":{"currency":"EUR","amount":"-2.0"},"creditorAccount":{},"creditorName":"Kosten","debtorAccount":{"iban":"NL71RABO0346234166","currency":"EUR"},"remittanceInformationUnstructured":"Stortingsapparaat (eigen storting) Periode 01-12-2020 t/m 31-12-2020","raboBookingDateTime":"2021-01-05T04:22:24.692444Z","raboDetailedTransactionType":"93","raboTransactionTypeName":"db"},{"entryReference":"642","bookingDate":"2021-01-05","valueDate":"2021-01-01","transactionAmount":{"currency":"EUR","amount":"-1.7"},"creditorAccount":{},"creditorName":"Kosten","debtorAccount":{"iban":"NL71RABO0346234166","currency":"EUR"},"remittanceInformationUnstructured":"Rabo DirectPakket                  Periode 01-01-2021 t/m 31-01-2021","raboBookingDateTime":"2021-01-05T04:22:24.691837Z","raboDetailedTransactionType":"93","raboTransactionTypeName":"db"},{"entryReference":"641","endToEndId":"04-01-2021 15:43 0050005142215314","bookingDate":"2021-01-04","valueDate":"2021-01-05","transactionAmount":{"currency":"EUR","amount":"-90.0"},"creditorAccount":{"iban":"NL05INGB0702278378"},"creditorName":"Tinka B.V.","debtorAccount":{"iban":"NL71RABO0346234166","currency":"EUR"},"remittanceInformationUnstructured":"62000000000000000492531780071171476 0050005142215314 62000000000000000492531780071171476 Wehkamp Finance x4166 pasnr.011","purposeCode":"EPAY","raboBookingDateTime":"2021-01-04T14:44:48.090552Z","raboDetailedTransactionType":"25","raboTransactionTypeName":"id"},{"entryReference":"640","endToEndId":"425025306429","mandateId":"1040000643670","creditorId":"NL10ZZZ302086370000","bookingDate":"2021-01-04","valueDate":"2020-11-24","transactionAmount":{"currency":"EUR","amount":"165.05"},"creditorAccount":{"iban":"NL71RABO0346234166","currency":"EUR"},"debtorAccount":{"iban":"NL58INGB0000003050"},"debtorName":"Zilveren Kruis Zorgverzekeringen  NV","remittanceInformationUnstructured":"Premie Zilveren Kruis Relatienummer 040190441 Periode 01-12-2020 - 01-01-2021","raboBookingDateTime":"2021-01-04T14:41:47.623605Z","raboDetailedTransactionType":"104","raboTransactionTypeName":"st","reasonCode":"MD06"},{"entryReference":"639","endToEndId":"480051082240","mandateId":"1040000643670","creditorId":"NL10ZZZ302086370000","bookingDate":"2021-01-04","valueDate":"2020-12-24","transactionAmount":{"currency":"EUR","amount":"114.9"},"creditorAccount":{"iban":"NL71RABO0346234166","currency":"EUR"},"debtorAccount":{"iban":"NL58INGB0000003050"},"debtorName":"Zilveren Kruis Zorgverzekeringen  NV","remittanceInformationUnstructured":"Premie Zilveren Kruis Relatienummer 040190441 Periode 01-01-2021 - 01-02-2021","raboBookingDateTime":"2021-01-04T14:41:27.515898Z","raboDetailedTransactionType":"104","raboTransactionTypeName":"st","reasonCode":"MD06"},{"entryReference":"638","endToEndId":"TK00021758","mandateId":"MANIJS009396","creditorId":"NL18ZZZ241082910000","bookingDate":"2021-01-04","valueDate":"2021-01-04","transactionAmount":{"currency":"EUR","amount":"-752.68"},"creditorAccount":{"iban":"NL42RABO0330574426"},"creditorName":"Stichting Woonbron","debtorAccount":{"iban":"NL71RABO0346234166","currency":"EUR"},"remittanceInformationUnstructured":"Incasso  Huur Periode: 01-01-2021 tot 01-02-2021","raboBookingDateTime":"2021-01-04T02:14:00.303734Z","raboDetailedTransactionType":"65","raboTransactionTypeName":"ei"},{"entryReference":"637","bookingDate":"2021-01-03","valueDate":"2021-01-03","transactionAmount":{"currency":"EUR","amount":"-1.0"},"creditorAccount":{},"creditorName":"CCV*Emak Tabaksshop ROTTERDAM","debtorAccount":{"iban":"NL71RABO0346234166","currency":"EUR"},"remittanceInformationUnstructured":"Betaalautomaat 15:11 pasnr. 011    Apple Pay","raboBookingDateTime":"2021-01-03T14:11:40.808776Z","raboDetailedTransactionType":"2","raboTransactionTypeName":"bc"},{"entryReference":"636","endToEndId":"86599999","mandateId":"6337215","creditorId":"NL97ZZZ534852620000","bookingDate":"2020-12-31","valueDate":"2020-12-31","transactionAmount":{"currency":"EUR","amount":"-50.0"},"creditorAccount":{"iban":"NL86ABNA0511919131"},"creditorName":"BUDGETENERGIE B V","debtorAccount":{"iban":"NL71RABO0346234166","currency":"EUR"},"remittanceInformationUnstructured":"Termijnbedrag 2021/01 4207848/1000018395535","raboBookingDateTime":"2020-12-31T07:05:30.476735Z","raboDetailedTransactionType":"64","raboTransactionTypeName":"ei"},{"entryReference":"635","endToEndId":"2700000063399909","mandateId":"71166-12283570","creditorId":"NL32ZZZ230134240000","bookingDate":"2020-12-30","valueDate":"2020-12-30","transactionAmount":{"currency":"EUR","amount":"-159.59"},"creditorAccount":{"iban":"NL32RABO0321701240"},"creditorName":"Unive Zuid-Nederland Bem","debtorAccount":{"iban":"NL71RABO0346234166","currency":"EUR"},"remittanceInformationUnstructured":"Unive Premie 28-12-2020 / 27-01-2021 Nota 63399909 UKIN2700000063399909 U6283799 Op mijnunive.nl vindt u meer informatie.","raboBookingDateTime":"2020-12-30T02:29:46.837766Z","raboDetailedTransactionType":"65","raboTransactionTypeName":"ei"},{"entryReference":"634","bookingDate":"2020-12-29","valueDate":"2020-12-29","transactionAmount":{"currency":"EUR","amount":"60.0"},"creditorAccount":{"iban":"NL71RABO0346234166","currency":"EUR"},"debtorAccount":{"iban":"NL81INGB0673857271"},"debtorName":"Hr A Gumus","remittanceInformationUnstructured":"Lening","raboBookingDateTime":"2020-12-29T15:40:52.745259Z","raboDetailedTransactionType":"541","raboTransactionTypeName":"cb"},{"entryReference":"633","bookingDate":"2020-12-29","valueDate":"2020-12-29","transactionAmount":{"currency":"EUR","amount":"-59.4"},"creditorAccount":{},"creditorName":"Aldi 009 Rotterdam ROTTERDAM","debtorAccount":{"iban":"NL71RABO0346234166","currency":"EUR"},"remittanceInformationUnstructured":"Betaalautomaat 15:21 pasnr. 011","raboBookingDateTime":"2020-12-29T14:21:18.113169Z","raboDetailedTransactionType":"2","raboTransactionTypeName":"bc"},{"entryReference":"632","endToEndId":"237419326/DT/201224113847402","bookingDate":"2020-12-29","valueDate":"2020-12-29","transactionAmount":{"currency":"EUR","amount":"46.0"},"creditorAccount":{"iban":"NL71RABO0346234166","currency":"EUR"},"debtorAccount":{"iban":"NL56INGB0705005100"},"debtorName":"Min. v Justitie en Veiligheid 592/CJIB SANCTIES","remittanceInformationUnstructured":"Zaaknummer: 237419326 Dubbel betaald/41PFS1 5062542237419326","raboBookingDateTime":"2020-12-29T07:22:46.769912Z","raboDetailedTransactionType":"541","raboTransactionTypeName":"cb"},{"entryReference":"631","endToEndId":"COAXX474163313202012211301082633387","mandateId":"012558495","creditorId":"NL35ZZZ273653230000","bookingDate":"2020-12-28","valueDate":"2020-12-28","transactionAmount":{"currency":"EUR","amount":"-36.0"},"creditorAccount":{"iban":"NL86INGB0002445588"},"creditorName":"BELASTINGDIENST","debtorAccount":{"iban":"NL71RABO0346234166","currency":"EUR"},"remittanceInformationUnstructured":"41-PFS-1                           12-12-2020 t/m 11-01-2021          MEER INFO WWW.BELASTINGDIENST.NL","raboBookingDateTime":"2020-12-28T11:08:17.49482Z","raboDetailedTransactionType":"64","raboTransactionTypeName":"ei"},{"entryReference":"630","endToEndId":"ARNLNL2017117803","mandateId":"B0008195475-0346234166-01","creditorId":"NL12T2N333034180000","bookingDate":"2020-12-28","valueDate":"2020-12-28","transactionAmount":{"currency":"EUR","amount":"-29.68"},"creditorAccount":{"iban":"NL06COBA0637053753"},"creditorName":"TELE2","debtorAccount":{"iban":"NL71RABO0346234166","currency":"EUR"},"remittanceInformationUnstructured":"ARNLNL2017117803","raboBookingDateTime":"2020-12-28T07:06:19.338991Z","raboDetailedTransactionType":"64","raboTransactionTypeName":"ei"},{"entryReference":"629","endToEndId":"ARNL9000054782267","mandateId":"T2MI40000126598","creditorId":"NL12T2N333034180000","bookingDate":"2020-12-28","valueDate":"2020-12-28","transactionAmount":{"currency":"EUR","amount":"-27.67"},"creditorAccount":{"iban":"NL50COBA0637053737"},"creditorName":"TELE2","debtorAccount":{"iban":"NL71RABO0346234166","currency":"EUR"},"remittanceInformationUnstructured":"ARNL9000054782267","raboBookingDateTime":"2020-12-28T07:03:52.481677Z","raboDetailedTransactionType":"64","raboTransactionTypeName":"ei"},{"entryReference":"628","bookingDate":"2020-12-25","valueDate":"2020-12-25","transactionAmount":{"currency":"EUR","amount":"-1.0"},"creditorAccount":{},"creditorName":"SPY*Guel Bakkerij ROTTERDAM","debtorAccount":{"iban":"NL71RABO0346234166","currency":"EUR"},"remittanceInformationUnstructured":"Betaalautomaat 13:18 pasnr. 011","raboBookingDateTime":"2020-12-25T12:18:53.366683Z","raboDetailedTransactionType":"30","raboTransactionTypeName":"ba"},{"entryReference":"627","endToEndId":"480051082240","mandateId":"1040000643670","creditorId":"NL10ZZZ302086370000","bookingDate":"2020-12-24","valueDate":"2020-12-24","transactionAmount":{"currency":"EUR","amount":"-114.9"},"creditorAccount":{"iban":"NL58INGB0000003050"},"creditorName":"Zilveren Kruis Zorgverzekeringen  NV","debtorAccount":{"iban":"NL71RABO0346234166","currency":"EUR"},"remittanceInformationUnstructured":"Premie Zilveren Kruis Relatienummer 040190441 Periode 01-01-2021 - 01-02-2021","raboBookingDateTime":"2020-12-24T07:18:09.582655Z","raboDetailedTransactionType":"64","raboTransactionTypeName":"ei"},{"entryReference":"626","endToEndId":"480051082241","mandateId":"1280000649030","creditorId":"NL10ZZZ302086370000","bookingDate":"2020-12-24","valueDate":"2020-12-24","transactionAmount":{"currency":"EUR","amount":"-28.36"},"creditorAccount":{"iban":"NL58INGB0000003050"},"creditorName":"Zilveren Kruis Zorgverzekeringen  NV","debtorAccount":{"iban":"NL71RABO0346234166","currency":"EUR"},"remittanceInformationUnstructured":"Overeengekomen betalingsregeling - SZK040190441","raboBookingDateTime":"2020-12-24T06:56:55.346791Z","raboDetailedTransactionType":"64","raboTransactionTypeName":"ei"},{"entryReference":"625","endToEndId":"2020-12-16T19:18:40-000000000000028","mandateId":"2019100001","creditorId":"NL68ZZZ411333400000","bookingDate":"2020-12-23","valueDate":"2020-12-23","transactionAmount":{"currency":"EUR","amount":"-10.0"},"creditorAccount":{"iban":"NL81INGB0004332134"},"creditorName":"STICHTING AKTIEF ORANJEBOOM","debtorAccount":{"iban":"NL71RABO0346234166","currency":"EUR"},"remittanceInformationUnstructured":"GIFT DECEMBER 2020","raboBookingDateTime":"2020-12-23T06:50:05.050802Z","raboDetailedTransactionType":"64","raboTransactionTypeName":"ei"},{"entryReference":"624","bookingDate":"2020-12-22","valueDate":"2020-12-22","transactionAmount":{"currency":"EUR","amount":"-56.67"},"creditorAccount":{},"creditorName":"Lidl 409 Rotterdam ROTTERDAM","debtorAccount":{"iban":"NL71RABO0346234166","currency":"EUR"},"remittanceInformationUnstructured":"Betaalautomaat 20:17 pasnr. 011","raboBookingDateTime":"2020-12-22T19:17:54.524481Z","raboDetailedTransactionType":"2","raboTransactionTypeName":"bc"},{"entryReference":"623","endToEndId":"000000046991598","bookingDate":"2020-12-22","valueDate":"2020-12-22","transactionAmount":{"currency":"EUR","amount":"953.13"},"creditorAccount":{"iban":"NL71RABO0346234166","currency":"EUR"},"debtorAccount":{"iban":"NL69ABNA0644512326"},"debtorName":"GEM RDAM SERVICEORG","remittanceInformationUnstructured":"Akin, HA.                                                       1122864                         Betaling aan klant (restbetaling","raboBookingDateTime":"2020-12-22T10:57:49.637652Z","raboDetailedTransactionType":"541","raboTransactionTypeName":"cb"},{"entryReference":"622","bookingDate":"2020-12-22","valueDate":"2020-12-22","transactionAmount":{"currency":"EUR","amount":"21.0"},"creditorAccount":{"iban":"NL71RABO0346234166","currency":"EUR"},"debtorAccount":{"iban":"BE47734028922880"},"debtorName":"ACAZA BV","remittanceInformationUnstructured":"TERUGBETALING BOL - 80403738","raboBookingDateTime":"2020-12-22T08:00:57.269993Z","raboDetailedTransactionType":"541","raboTransactionTypeName":"cb"},{"entryReference":"621","endToEndId":"22-12-2020 01:56 1030000294225234","bookingDate":"2020-12-22","valueDate":"2020-12-22","transactionAmount":{"currency":"EUR","amount":"-30.0"},"creditorAccount":{"iban":"NL93DEUT0265252393"},"creditorName":"Nederlandse Loterij Organisatie BV","debtorAccount":{"iban":"NL71RABO0346234166","currency":"EUR"},"remittanceInformationUnstructured":"1149291418345867 1030000294225234 Bestelling klantnummer 114929141 x4166 pasnr.011","purposeCode":"EPAY","raboBookingDateTime":"2020-12-22T00:58:28.803608Z","raboDetailedTransactionType":"25","raboTransactionTypeName":"id"},{"entryReference":"620","endToEndId":"21-12-2020 13:09 0050005106316310","bookingDate":"2020-12-21","valueDate":"2020-12-21","transactionAmount":{"currency":"EUR","amount":"-33.0"},"creditorAccount":{"iban":"NL05INGB0702278378"},"creditorName":"WEHKAMP FINANCE B.V.","debtorAccount":{"iban":"NL71RABO0346234166","currency":"EUR"},"remittanceInformationUnstructured":"72000000000000000486670180071171476 0050005106316310 72000000000000000486670180071171476 x4166 pasnr.011","purposeCode":"EPAY","raboBookingDateTime":"2020-12-21T12:11:18.108226Z","raboDetailedTransactionType":"25","raboTransactionTypeName":"id"},{"entryReference":"619","bookingDate":"2020-12-21","valueDate":"2020-12-21","transactionAmount":{"currency":"EUR","amount":"-19.0"},"creditorAccount":{"iban":"NL46ABNA0547147147"},"creditorName":"Cak","debtorAccount":{"iban":"NL71RABO0346234166","currency":"EUR"},"remittanceInformationUnstructured":"810000004520398","raboBookingDateTime":"2020-12-21T12:05:15.318264Z","raboDetailedTransactionType":"547","raboTransactionTypeName":"bg"},{"entryReference":"618","bookingDate":"2020-12-21","valueDate":"2020-12-21","transactionAmount":{"currency":"EUR","amount":"-19.03"},"creditorAccount":{"iban":"NL97ABNA0644512113"},"creditorName":"Gemeente Rotterdam","debtorAccount":{"iban":"NL71RABO0346234166","currency":"EUR"},"remittanceInformationStructured":"6000003308109396","raboBookingDateTime":"2020-12-21T12:03:27.236108Z","raboDetailedTransactionType":"547","raboTransactionTypeName":"bg"},{"entryReference":"617","endToEndId":"21-12-2020 13:00 0050005106267237","bookingDate":"2020-12-21","valueDate":"2020-12-21","transactionAmount":{"currency":"EUR","amount":"-46.0"},"creditorAccount":{"iban":"NL56INGB0705005100"},"creditorName":"Centraal Justitieel Incassobureau","debtorAccount":{"iban":"NL71RABO0346234166","currency":"EUR"},"remittanceInformationUnstructured":"5062542237419326 0050005106267237 Betaald via Digitaal Loket Centraal Justitieel Incassobureau x4166 pasnr.011","purposeCode":"EPAY","raboBookingDateTime":"2020-12-21T12:02:26.022882Z","raboDetailedTransactionType":"25","raboTransactionTypeName":"id"},{"entryReference":"616","endToEndId":"21-12-2020 12:57 0030005840886086","bookingDate":"2020-12-21","valueDate":"2020-12-21","transactionAmount":{"currency":"EUR","amount":"-22.4"},"creditorAccount":{"iban":"NL97ABNA0644512113"},"creditorName":"Gemeente Rotterdam","debtorAccount":{"iban":"NL71RABO0346234166","currency":"EUR"},"remittanceInformationUnstructured":"3308155419 0030005840886086 3308155419 x4166 pasnr.011","purposeCode":"EPAY","raboBookingDateTime":"2020-12-21T11:58:55.176525Z","raboDetailedTransactionType":"25","raboTransactionTypeName":"id"},{"entryReference":"615","bookingDate":"2020-12-21","valueDate":"2020-12-21","transactionAmount":{"currency":"EUR","amount":"-46.0"},"creditorAccount":{"iban":"NL56INGB0705005100"},"creditorName":"Cjib","debtorAccount":{"iban":"NL71RABO0346234166","currency":"EUR"},"remittanceInformationStructured":"5062542237419326","raboBookingDateTime":"2020-12-21T11:31:57.511753Z","raboDetailedTransactionType":"547","raboTransactionTypeName":"bg"},{"entryReference":"614","endToEndId":"21-12-2020 12:17 0050005105978307","bookingDate":"2020-12-21","valueDate":"2020-12-21","transactionAmount":{"currency":"EUR","amount":"-41.99"},"creditorAccount":{"iban":"NL27INGB0000026500"},"creditorName":"bol.com b.v.","debtorAccount":{"iban":"NL71RABO0346234166","currency":"EUR"},"remittanceInformationUnstructured":"BUN1800051950633 0050005105978307 bol.com ref BUN1800051950633 bol.com x4166 pasnr.011","purposeCode":"EPAY","raboBookingDateTime":"2020-12-21T11:19:18.117645Z","raboDetailedTransactionType":"25","raboTransactionTypeName":"id"},{"entryReference":"613","endToEndId":"GVSXX20201216012976527","bookingDate":"2020-12-21","valueDate":"2020-12-21","transactionAmount":{"currency":"EUR","amount":"107.0"},"creditorAccount":{"iban":"NL71RABO0346234166","currency":"EUR"},"debtorAccount":{"iban":"NL86INGB0002445588"},"debtorName":"BELASTINGDIENST","remittanceInformationUnstructured":"MAAND JAN. NR. 219159488T100013 VOORSCHOT ZORGTOESLAG 2021 (AKIN ) MEER INFO OP WWW.TOESLAGEN.NL","raboBookingDateTime":"2020-12-21T09:03:45.605467Z","raboDetailedTransactionType":"541","raboTransactionTypeName":"cb"},{"entryReference":"612","endToEndId":"GVSXX20201216010114531","bookingDate":"2020-12-21","valueDate":"2020-12-21","transactionAmount":{"currency":"EUR","amount":"250.0"},"creditorAccount":{"iban":"NL71RABO0346234166","currency":"EUR"},"debtorAccount":{"iban":"NL86INGB0002445588"},"debtorName":"BELASTINGDIENST","remittanceInformationUnstructured":"MAAND JAN. NR. 219159488T100012 VOORSCHOT HUURTOESLAG 2021 (AKIN ) MEER INFO OP WWW.TOESLAGEN.NL","raboBookingDateTime":"2020-12-21T08:21:43.930471Z","raboDetailedTransactionType":"541","raboTransactionTypeName":"cb"},{"entryReference":"611","endToEndId":"2000008050685592","mandateId":"6952006","creditorId":"NL64ZZZ341023030000","bookingDate":"2020-12-21","valueDate":"2020-12-21","transactionAmount":{"currency":"EUR","amount":"-12.95"},"creditorAccount":{"iban":"NL10ABNA0240120000"},"creditorName":"ENECO SERVICES","debtorAccount":{"iban":"NL71RABO0346234166","currency":"EUR"},"remittanceInformationUnstructured":"Kenmerk  2000008050685592 Omschrijving  Klantnummer  45907638-2  Periode  2020-12 Veenoord 516 ROTTERDAM","raboBookingDateTime":"2020-12-21T07:20:16.594268Z","raboDetailedTransactionType":"64","raboTransactionTypeName":"ei"},{"entryReference":"610","endToEndId":"095204288992","mandateId":"000001174056","creditorId":"NL24ZZZ241706500000","bookingDate":"2020-12-18","valueDate":"2020-12-18","transactionAmount":{"currency":"EUR","amount":"-17.75"},"creditorAccount":{"iban":"NL13INGB0000008710"},"creditorName":"EVIDES WATERBEDRIJF","debtorAccount":{"iban":"NL71RABO0346234166","currency":"EUR"},"remittanceInformationUnstructured":"Factuurnr 071906248905 VNKlantnr 2002312993 BTW 1,47PC 3079 NR 516, DEC","raboBookingDateTime":"2020-12-18T06:50:57.186948Z","raboDetailedTransactionType":"64","raboTransactionTypeName":"ei"},{"entryReference":"609","endToEndId":"09-12-2020 14:59 0020004529743718","bookingDate":"2020-12-09","valueDate":"2020-12-09","transactionAmount":{"currency":"EUR","amount":"-752.68"},"creditorAccount":{"iban":"NL62RABO0150334583"},"creditorName":"Stichting Woonbron","debtorAccount":{"iban":"NL71RABO0346234166","currency":"EUR"},"remittanceInformationUnstructured":"2012091458de0b4b 0020004529743718 Uw huurbetaling x4166 pasnr.011","purposeCode":"EPAY","raboBookingDateTime":"2020-12-09T14:00:40.751607Z","raboDetailedTransactionType":"25","raboTransactionTypeName":"id"},{"entryReference":"608","bookingDate":"2020-12-09","valueDate":"2020-12-09","transactionAmount":{"currency":"EUR","amount":"652.0"},"creditorAccount":{"iban":"NL71RABO0346234166","currency":"EUR"},"debtorAccount":{},"remittanceInformationUnstructured":"Stortingsapparaat 14:55 pasnr. 011","raboBookingDateTime":"2020-12-09T13:57:40.118529Z","raboDetailedTransactionType":"119","raboTransactionTypeName":"kh"},{"entryReference":"607","endToEndId":"09-12-2020 13:02 0030005800047636","bookingDate":"2020-12-09","valueDate":"2020-12-09","transactionAmount":{"currency":"EUR","amount":"-28.4"},"creditorAccount":{"iban":"NL22ABNA0487710150"},"creditorName":"Santander Consumer Finance","debtorAccount":{"iban":"NL71RABO0346234166","currency":"EUR"},"remittanceInformationUnstructured":"323702289 0030005800047636 Herinnering x4166 pasnr.011","purposeCode":"EPAY","raboBookingDateTime":"2020-12-09T12:04:01.787324Z","raboDetailedTransactionType":"25","raboTransactionTypeName":"id"},{"entryReference":"606","endToEndId":"09-12-2020 00:51 0050005070882852","bookingDate":"2020-12-08","valueDate":"2020-12-09","transactionAmount":{"currency":"EUR","amount":"-7.0"},"creditorAccount":{"iban":"NL27INGB0000026500"},"creditorName":"bol.com b.v.","debtorAccount":{"iban":"NL71RABO0346234166","currency":"EUR"},"remittanceInformationUnstructured":"BUN1800050621095 0050005070882852 bol.com ref BUN1800050621095 bol.com x4166 pasnr.011","purposeCode":"EPAY","raboBookingDateTime":"2020-12-08T23:53:40.012148Z","raboDetailedTransactionType":"25","raboTransactionTypeName":"id"},{"entryReference":"605","bookingDate":"2020-12-06","valueDate":"2020-12-06","transactionAmount":{"currency":"EUR","amount":"-10.0"},"creditorAccount":{},"creditorName":"Albert Heijn 1037 RIJSWIJK ZH","debtorAccount":{"iban":"NL71RABO0346234166","currency":"EUR"},"remittanceInformationUnstructured":"Betaalautomaat 18:13 pasnr. 011    Apple Pay","raboBookingDateTime":"2020-12-06T17:13:20.711988Z","raboDetailedTransactionType":"2","raboTransactionTypeName":"bc"},{"entryReference":"604","bookingDate":"2020-12-06","valueDate":"2020-12-06","transactionAmount":{"currency":"EUR","amount":"-7.8"},"creditorAccount":{},"creditorName":"McDonald's Rijswijk RIJSWIJK ZH","debtorAccount":{"iban":"NL71RABO0346234166","currency":"EUR"},"remittanceInformationUnstructured":"Betaalautomaat 17:59 pasnr. 011    Apple Pay","raboBookingDateTime":"2020-12-06T16:59:19.059436Z","raboDetailedTransactionType":"2","raboTransactionTypeName":"bc"},{"entryReference":"603","bookingDate":"2020-12-06","valueDate":"2020-12-06","transactionAmount":{"currency":"EUR","amount":"-2.12"},"creditorAccount":{},"creditorName":"Kruidvat 7377 ROTTERDAM","debtorAccount":{"iban":"NL71RABO0346234166","currency":"EUR"},"remittanceInformationUnstructured":"Betaalautomaat 16:09 pasnr. 011    Apple Pay","raboBookingDateTime":"2020-12-06T15:09:07.292851Z","raboDetailedTransactionType":"2","raboTransactionTypeName":"bc"},{"entryReference":"602","bookingDate":"2020-12-06","valueDate":"2020-12-06","transactionAmount":{"currency":"EUR","amount":"-9.7"},"creditorAccount":{},"creditorName":"Action 1335 Rotterdam","debtorAccount":{"iban":"NL71RABO0346234166","currency":"EUR"},"remittanceInformationUnstructured":"Betaalautomaat 15:56 pasnr. 011    Apple Pay","raboBookingDateTime":"2020-12-06T14:56:47.987649Z","raboDetailedTransactionType":"2","raboTransactionTypeName":"bc"},{"entryReference":"601","bookingDate":"2020-12-06","valueDate":"2020-12-06","transactionAmount":{"currency":"EUR","amount":"-2.0"},"creditorAccount":{},"creditorName":"SPY*Guel Bakkerij ROTTERDAM","debtorAccount":{"iban":"NL71RABO0346234166","currency":"EUR"},"remittanceInformationUnstructured":"Betaalautomaat 13:50 pasnr. 011    Apple Pay","raboBookingDateTime":"2020-12-06T12:50:40.8978Z","raboDetailedTransactionType":"2","raboTransactionTypeName":"bc"},{"entryReference":"600","endToEndId":"05-12-2020 12:20 0050005062339912","bookingDate":"2020-12-05","valueDate":"2020-12-07","transactionAmount":{"currency":"EUR","amount":"-61.5"},"creditorAccount":{"iban":"NL05INGB0702278378"},"creditorName":"WEHKAMP FINANCE B.V.","debtorAccount":{"iban":"NL71RABO0346234166","currency":"EUR"},"remittanceInformationUnstructured":"62000000000000000480347310071171476 0050005062339912 62000000000000000480347310071171476 x4166 pasnr.011","purposeCode":"EPAY","raboBookingDateTime":"2020-12-05T11:22:20.402864Z","raboDetailedTransactionType":"25","raboTransactionTypeName":"id"},{"entryReference":"599","endToEndId":"5808.14024121","mandateId":"ALL0012937194.01","creditorId":"NL66ZZZ290379290000","bookingDate":"2020-12-03","valueDate":"2020-12-03","transactionAmount":{"currency":"EUR","amount":"-6.33"},"creditorAccount":{"iban":"NL67INGB0005338373"},"creditorName":"Allianz Direct","debtorAccount":{"iban":"NL71RABO0346234166","currency":"EUR"},"remittanceInformationUnstructured":"Kenmerk: 1000000036280193 / Periode: 2020-12-01 - 2021-01-01 / NL71RABO0346234166","raboBookingDateTime":"2020-12-03T06:57:29.981325Z","raboDetailedTransactionType":"64","raboTransactionTypeName":"ei"},{"entryReference":"598","bookingDate":"2020-12-02","valueDate":"2020-12-01","transactionAmount":{"currency":"EUR","amount":"-1.7"},"creditorAccount":{},"creditorName":"Kosten","debtorAccount":{"iban":"NL71RABO0346234166","currency":"EUR"},"remittanceInformationUnstructured":"Rabo DirectPakket                  Periode 01-12-2020 t/m 31-12-2020","raboBookingDateTime":"2020-12-02T07:53:45.818442Z","raboDetailedTransactionType":"93","raboTransactionTypeName":"db"},{"entryReference":"597","bookingDate":"2020-12-01","valueDate":"2020-12-01","transactionAmount":{"currency":"EUR","amount":"-93.04"},"creditorAccount":{},"creditorName":"Esso Rotterdam Stadion ROTTERDAM","debtorAccount":{"iban":"NL71RABO0346234166","currency":"EUR"},"remittanceInformationUnstructured":"Betaalautomaat 17:36 pasnr. 011","raboBookingDateTime":"2020-12-01T16:36:37.239043Z","raboDetailedTransactionType":"2","raboTransactionTypeName":"bc"},{"entryReference":"596","endToEndId":"KENIJS826683","mandateId":"MANIJS009396","creditorId":"NL18ZZZ241082910000","bookingDate":"2020-12-01","valueDate":"2020-12-01","transactionAmount":{"currency":"EUR","amount":"752.68"},"creditorAccount":{"iban":"NL71RABO0346234166","currency":"EUR"},"debtorAccount":{"iban":"NL06RABO0314677259"},"debtorName":"Stichting Woonbron","remittanceInformationUnstructured":"Incasso Huur Periode van 01-12-2020 tot 01-01-2021","raboBookingDateTime":"2020-12-01T10:30:33.283294Z","raboDetailedTransactionType":"104","raboTransactionTypeName":"st","reasonCode":"MD06"},{"entryReference":"595","endToEndId":"2020-11-25T12:08:56-000000000000588","mandateId":"20111871","creditorId":"NL90ZZZ411771400000","bookingDate":"2020-12-01","valueDate":"2020-12-01","transactionAmount":{"currency":"EUR","amount":"-25.0"},"creditorAccount":{"iban":"NL16RABO0394715950"},"creditorName":"SICN","debtorAccount":{"iban":"NL71RABO0346234166","currency":"EUR"},"remittanceInformationUnstructured":"CENAZEFONU AIDATI 2021 / 20111871","raboBookingDateTime":"2020-12-01T02:49:45.728828Z","raboDetailedTransactionType":"65","raboTransactionTypeName":"ei"},{"entryReference":"594","endToEndId":"KENIJS826683","mandateId":"MANIJS009396","creditorId":"NL18ZZZ241082910000","bookingDate":"2020-12-01","valueDate":"2020-12-01","transactionAmount":{"currency":"EUR","amount":"-752.68"},"creditorAccount":{"iban":"NL06RABO0314677259"},"creditorName":"Stichting Woonbron","debtorAccount":{"iban":"NL71RABO0346234166","currency":"EUR"},"remittanceInformationUnstructured":"Incasso Huur Periode van 01-12-2020 tot 01-01-2021","raboBookingDateTime":"2020-12-01T02:40:31.683428Z","raboDetailedTransactionType":"65","raboTransactionTypeName":"ei"},{"entryReference":"593","bookingDate":"2020-11-30","valueDate":"2020-11-30","transactionAmount":{"currency":"EUR","amount":"-16.04"},"creditorAccount":{},"creditorName":"Action 1335 Rotterdam","debtorAccount":{"iban":"NL71RABO0346234166","currency":"EUR"},"remittanceInformationUnstructured":"Betaalautomaat 17:10 pasnr. 011","raboBookingDateTime":"2020-11-30T16:10:17.467956Z","raboDetailedTransactionType":"2","raboTransactionTypeName":"bc"},{"entryReference":"592","endToEndId":"85604010","mandateId":"6337215","creditorId":"NL97ZZZ534852620000","bookingDate":"2020-11-30","valueDate":"2020-11-30","transactionAmount":{"currency":"EUR","amount":"-50.0"},"creditorAccount":{"iban":"NL86ABNA0511919131"},"creditorName":"BUDGETENERGIE B V","debtorAccount":{"iban":"NL71RABO0346234166","currency":"EUR"},"remittanceInformationUnstructured":"Termijnbedrag 2020/12 4207848/1000017651484","raboBookingDateTime":"2020-11-30T06:54:07.090103Z","raboDetailedTransactionType":"64","raboTransactionTypeName":"ei"},{"entryReference":"591","bookingDate":"2020-11-29","valueDate":"2020-11-29","transactionAmount":{"currency":"EUR","amount":"-10.93"},"creditorAccount":{},"creditorName":"Action 1335 Rotterdam","debtorAccount":{"iban":"NL71RABO0346234166","currency":"EUR"},"remittanceInformationUnstructured":"Betaalautomaat 15:01 pasnr. 011    Apple Pay","raboBookingDateTime":"2020-11-29T14:01:04.006186Z","raboDetailedTransactionType":"2","raboTransactionTypeName":"bc"},{"entryReference":"590","endToEndId":"28-11-2020 05:18 0030005763668276","bookingDate":"2020-11-28","valueDate":"2020-11-30","transactionAmount":{"currency":"EUR","amount":"-15.8"},"creditorAccount":{"iban":"NL70ABNA0593078446"},"creditorName":"NS GROEP N.V.","debtorAccount":{"iban":"NL71RABO0346234166","currency":"EUR"},"remittanceInformationUnstructured":"32232460 0030005763668276 NS ETICKET ORDER 32232460 x4166 pasnr.011","purposeCode":"EPAY","raboBookingDateTime":"2020-11-28T04:19:26.207071Z","raboDetailedTransactionType":"25","raboTransactionTypeName":"id"},{"entryReference":"589","endToEndId":"27-11-2020 14:01 0050005039292083","bookingDate":"2020-11-27","valueDate":"2020-11-27","transactionAmount":{"currency":"EUR","amount":"-28.89"},"creditorAccount":{"iban":"NL27INGB0000026500"},"creditorName":"bol.com b.v.","debtorAccount":{"iban":"NL71RABO0346234166","currency":"EUR"},"remittanceInformationUnstructured":"BUN1800049531392 0050005039292083 bol.com ref BUN1800049531392 bol.com x4166 pasnr.011","purposeCode":"EPAY","raboBookingDateTime":"2020-11-27T13:03:01.288405Z","raboDetailedTransactionType":"25","raboTransactionTypeName":"id"},{"entryReference":"588","endToEndId":"COAXX424276857202011231301028874065","mandateId":"012558495","creditorId":"NL35ZZZ273653230000","bookingDate":"2020-11-27","valueDate":"2020-11-27","transactionAmount":{"currency":"EUR","amount":"-35.0"},"creditorAccount":{"iban":"NL86INGB0002445588"},"creditorName":"BELASTINGDIENST","debtorAccount":{"iban":"NL71RABO0346234166","currency":"EUR"},"remittanceInformationUnstructured":"41-PFS-1                           12-11-2020 t/m 11-12-2020          MEER INFO WWW.BELASTINGDIENST.NL","raboBookingDateTime":"2020-11-27T09:16:09.652329Z","raboDetailedTransactionType":"64","raboTransactionTypeName":"ei"},{"entryReference":"587","endToEndId":"ARNLNL2016071599","mandateId":"B0008195475-0346234166-01","creditorId":"NL12T2N333034180000","bookingDate":"2020-11-25","valueDate":"2020-11-25","transactionAmount":{"currency":"EUR","amount":"-61.61"},"creditorAccount":{"iban":"NL06COBA0637053753"},"creditorName":"TELE2","debtorAccount":{"iban":"NL71RABO0346234166","currency":"EUR"},"remittanceInformationUnstructured":"ARNLNL2016071599","raboBookingDateTime":"2020-11-25T08:37:53.178585Z","raboDetailedTransactionType":"64","raboTransactionTypeName":"ei"},{"entryReference":"586","endToEndId":"ARNL9000054260074","mandateId":"T2MI40000126598","creditorId":"NL12T2N333034180000","bookingDate":"2020-11-25","valueDate":"2020-11-25","transactionAmount":{"currency":"EUR","amount":"-26.67"},"creditorAccount":{"iban":"NL50COBA0637053737"},"creditorName":"TELE2","debtorAccount":{"iban":"NL71RABO0346234166","currency":"EUR"},"remittanceInformationUnstructured":"ARNL9000054260074","raboBookingDateTime":"2020-11-25T06:51:52.13882Z","raboDetailedTransactionType":"64","raboTransactionTypeName":"ei"},{"entryReference":"585","endToEndId":"6700000062515179","mandateId":"71166-12283570","creditorId":"NL32ZZZ230134240000","bookingDate":"2020-11-25","valueDate":"2020-11-25","transactionAmount":{"currency":"EUR","amount":"-159.59"},"creditorAccount":{"iban":"NL32RABO0321701240"},"creditorName":"Cooperatie Unive Zuid-NL","debtorAccount":{"iban":"NL71RABO0346234166","currency":"EUR"},"remittanceInformationUnstructured":"Unive Premie 28-11-2020 / 27-12-2020 Nota 62515179 UKIN6700000062515179 U6283799 Op mijnunive.nl vindt u meer informatie.","raboBookingDateTime":"2020-11-25T02:41:29.046947Z","raboDetailedTransactionType":"65","raboTransactionTypeName":"ei"},{"entryReference":"584","endToEndId":"000000046488849","bookingDate":"2020-11-24","valueDate":"2020-11-24","transactionAmount":{"currency":"EUR","amount":"953.13"},"creditorAccount":{"iban":"NL71RABO0346234166","currency":"EUR"},"debtorAccount":{"iban":"NL69ABNA0644512326"},"debtorName":"GEM RDAM SERVICEORG","remittanceInformationUnstructured":"Akin, HA.                                                       1122864                         Betaling aan klant (restbetaling","raboBookingDateTime":"2020-11-24T10:58:33.959352Z","raboDetailedTransactionType":"541","raboTransactionTypeName":"cb"},{"entryReference":"583","endToEndId":"425025306429","mandateId":"1040000643670","creditorId":"NL10ZZZ302086370000","bookingDate":"2020-11-24","valueDate":"2020-11-24","transactionAmount":{"currency":"EUR","amount":"-165.05"},"creditorAccount":{"iban":"NL58INGB0000003050"},"creditorName":"Zilveren Kruis Zorgverzekeringen  NV","debtorAccount":{"iban":"NL71RABO0346234166","currency":"EUR"},"remittanceInformationUnstructured":"Premie Zilveren Kruis Relatienummer 040190441 Periode 01-12-2020 - 01-01-2021","raboBookingDateTime":"2020-11-24T08:28:12.308127Z","raboDetailedTransactionType":"64","raboTransactionTypeName":"ei"},{"entryReference":"582","endToEndId":"425025306430","mandateId":"1280000649030","creditorId":"NL10ZZZ302086370000","bookingDate":"2020-11-24","valueDate":"2020-11-24","transactionAmount":{"currency":"EUR","amount":"-28.37"},"creditorAccount":{"iban":"NL58INGB0000003050"},"creditorName":"Zilveren Kruis Zorgverzekeringen  NV","debtorAccount":{"iban":"NL71RABO0346234166","currency":"EUR"},"remittanceInformationUnstructured":"Overeengekomen betalingsregeling - SZK040190441","raboBookingDateTime":"2020-11-24T08:28:12.307437Z","raboDetailedTransactionType":"64","raboTransactionTypeName":"ei"},{"entryReference":"581","bookingDate":"2020-11-23","valueDate":"2020-11-23","transactionAmount":{"currency":"EUR","amount":"-14.2"},"creditorAccount":{},"creditorName":"NS-R'dam Zuid 201 ROTTERDAM","debtorAccount":{"iban":"NL71RABO0346234166","currency":"EUR"},"remittanceInformationUnstructured":"Betaalautomaat 13:22 pasnr. 011","raboBookingDateTime":"2020-11-23T12:22:28.947767Z","raboDetailedTransactionType":"2","raboTransactionTypeName":"bc"},{"entryReference":"580","endToEndId":"2020-11-18T18:13:00-000000000000025","mandateId":"2019100001","creditorId":"NL68ZZZ411333400000","bookingDate":"2020-11-23","valueDate":"2020-11-23","transactionAmount":{"currency":"EUR","amount":"-10.0"},"creditorAccount":{"iban":"NL81INGB0004332134"},"creditorName":"STICHTING AKTIEF ORANJEBOOM","debtorAccount":{"iban":"NL71RABO0346234166","currency":"EUR"},"remittanceInformationUnstructured":"GIFT NOVEMBER 2020","raboBookingDateTime":"2020-11-23T07:14:33.342657Z","